publish_date,headline
2020-03-15,Treasury Secretary Mnuchin does not expect recession from the coronavirus
2020-03-15,"Dow drops nearly 3,000 points, as coronavirus collapse continues; worst day since '87"
2020-03-15,Trump considering 'full pardon' of former national security advisor Michael Flynn
2020-03-15,Stemming the flow of international students could cost US colleges $41 billion
2020-03-15,"If you're panic shopping, chances are good you might also panic-sell your stocks"
2020-03-15,"How to think like Jeff Bezos and become a digital powerhouse, from a former Amazon exec"
2020-03-15,Joe Biden pledges to pick a woman to be his running mate
2020-03-15,Joe Biden's revival is a boon for this San Francisco tech start-up
2020-03-15,NFL players union approves new agreement that includes pay increases and extra regular season game
2020-03-15,Alphabet's Verily launches a limited coronavirus screening website
2020-03-15,Consumer companies like Clorox are calling on the White House to help prevent product shortages
2020-03-15,"Trump administration mulls 'all options' to curb coronavirus, including domestic air travel ban"
2020-03-15,"S&P 500 recovers some of its steep losses after halt, now down 6%"
2020-03-15,Bank of America CEO Moynihan says 'we're in a war to contain this virus'
2020-03-15,The Senate has not yet scheduled a vote for the coronavirus relief bill already passed by the House
2020-03-15,Germany tries to stop US from luring away firm seeking coronavirus vaccine
2020-03-15,"Coronavirus live updates: Fed slashes rates, New York governor wants Trump to mobilize the military"
2020-03-15,"2020 was already expected to be a weak year at the box office, coronavirus could mean 'cinematic disaster'"
2020-03-15,"Trump talks coronavirus hoarding, supply chain with Target, Campbell, Costco and others"
2020-03-15,"Coronavirus live updates: New York governor wants Trump to mobilize army, NYC mayor calls outbreak 'war'"
2020-03-15,Even the world's biggest hedge fund was caught flat-footed by the coronavirus market sell-off
2020-03-15,Trump applauds Fed's move to slash interest rates and says investors 'should be very thrilled'
2020-03-15,New York City schools will close this week to help contain the coronavirus outbreak
2020-03-15,American Airlines cuts international capacity by 75% as demand collapses
2020-03-15,These retailers are closing stores to slow coronavirus outbreak
2020-03-15,Dow futures fall 600 points even after Fed slashes rates to calm markets amid coronavirus outbreak
2020-03-15,Under-the-radar trend suggests the US may avoid a recession during the coronavirus crisis
2020-03-15,Federal Reserve cuts rates to zero and launches massive $700 billion quantitative easing program
2020-03-15,"Most voters in 2020 battlegrounds fear coronavirus will lead to recession, CNBC/Change Research poll finds"
2020-03-15,"Aramco's 2019 profit falls 21%, plans to adjust capital spending"
2020-03-15,LVMH will use its perfume and cosmetics factories to manufacture free hand sanitizer for France
2020-03-15,An options strategy pros use when looking to buy stocks on the cheap during big market declines
2020-03-15,"Starbucks temporarily adopts 'to go' model, will close or shorten hours near coronavirus clusters"
2020-03-15,Amazon says it is out of stock of household items and deliveries are delayed due to coronavirus demand
2020-03-15,The Federal Reserve has taken massive steps to help markets. Here's what's left in its arsenal
2020-03-15,Biden and Sanders to face off in first one-on-one Democratic primary debate as coronavirus pandemic rages
2020-03-16,"Tesla is still not cheap after 40% plunge, Bernstein says"
2020-03-16,South Korea stocks dive beyond 3% after Dow sees worst drop since 1987; Philippines suspends trading
2020-03-16,Here are some 'stocks for the storm' from BTIG
2020-03-16,"The Fed tried some extreme measures to stabilize the markets, but may need to go further to steady the ship"
2020-03-16,Credit market pain won't end until Washington puts more muscle into stimulus
2020-03-16,"Stocks making the biggest moves after hours: MGM Resorts, Tencent Music, Amazon and more"
2020-03-16,Kelly Evans: Dow plunges 10%--again
2020-03-16,"Stocks making the biggest moves midday: Apple, Gap, Delta, JPMorgan Chase, Boeing & more"
2020-03-16,Major averages fall double digits as coronavirus concerns intensify — what to watch now
2020-03-16,EU proposes ban on non-essential incoming foreign travel for 30 days
2020-03-16,Cramer's lightning round: Buy Waste Management 'as it goes down'
2020-03-16,San Francisco Bay area officials order nearly 7 million people to 'shelter in place' to curb coronavirus spread
2020-03-16,Tax deadlines are likely to change. Here's what you need to know
2020-03-16,"Universal to release movies online while they are in theaters, starting with 'Trolls World Tour'"
2020-03-16,Millions of Americans could lose their jobs in a coronavirus recession. Many won't get severance pay
2020-03-16,These financial moves can help you prepare for a recession
2020-03-16,"Dow rebounds more than 1,000 points as Trump seeks $1 trillion in stimulus for coronavirus fight"
2020-03-16,"The bottom is close and coronavirus is likely to cause sharp, short recession, BCA Research says"
2020-03-16,"Tesla begins Model Y deliveries, meeting expectations for the crossover SUV"
2020-03-16,"Google says expect increased YouTube video removals, service delays as workers move online"
2020-03-16,Athletes team up to raise money for people affected by coronavirus
2020-03-16,'You're supposed to be the President' – Trump and Cuomo fight on Twitter about coronavirus response
2020-03-16,US airlines seek more than $50 billion in government assistance as coronavirus roils business
2020-03-16,Judge denies Ohio governor's push to postpone Tuesday's primary
2020-03-16,Howard Marks says the market is 'pricing in a bad scenario' and there is value for investors
2020-03-16,Boeing and Trump administration in talks about short-term aid as aviation reels from coronavirus
2020-03-16,Coronavirus concerns: Trump press secretary Grisham working from home after contact with Brazil delegation at Mar-a-Lago
2020-03-16,"Wall Street's fear gauge closes at highest level ever, surpassing even financial crisis peak"
2020-03-16,White House cancels annual Easter Egg Roll due to coronavirus
2020-03-16,Google parent Alphabet began sharing YouTube revenue after SEC request
2020-03-16,McDonald's asks US franchisees to close dining rooms amid coronavirus outbreak
2020-03-16,Economist Paul McCulley says the stock plunge is not an indictment of Fed's emergency measures
2020-03-16,"Chick-fil-A, Taco Bell and Starbucks are turning to drive-thrus as COVID-19 spreads"
2020-03-16,States call for federal delay to enforcement for 'Real ID' use at airports
2020-03-16,Markets are getting crushed but these stocks have held up
2020-03-16,"Stock market leaders unite against calls to stop trading, saying it would only compound anxiety"
2020-03-16,Market-beating money manager David Herro says it's time to 'gently' buy some stocks
2020-03-16,Telemedicine companies are struggling to serve 'extreme volumes' of patients as coronavirus calls surge
2020-03-16,"Coronavirus is hitting the economy worse than Wall Street thinks, investor Rich Bernstein warns"
2020-03-16,Facebook's Sandberg: No one knows how much impact coronavirus will have on marketing industry
2020-03-16,Worried about your access to cash? Here's where to put emergency funds now
2020-03-16,"GM offering 0% financing for 7 years, deferred payments amid coronavirus outbreak"
2020-03-16,SBA and small business 'disaster' loans have never faced test like coronavirus
2020-03-16,"Kentucky delays its 2020 primary, the latest state to do so as coronavirus spreads"
2020-03-16,"Stock market live updates: S&P down 6%, trading halted at one point, Dow falls 30% from record at lows"
2020-03-16,False coronavirus rumors surge in 'hidden viral' text messages
2020-03-16,First human trial for coronavirus vaccine begins Monday in the US
2020-03-16,"Jim Cramer says forget index funds, buy shares in companies 'we can't live without'"
2020-03-16,"Telemedicine system crashes, Trump issues 'coronavirus guidelines,' SF and France order 'stay home'"
2020-03-16,Dow futures jump 200 points after Wall Street suffers worst day since 1987 market crash
2020-03-16,NASCAR suspends season until May but will reschedule events
2020-03-16,"Stock market live Monday: Dow drops 13%, Trump says recession possible, trading halted at open"
2020-03-16,"Stock market live updates: S&P down 8%, trading halted at one point, Dow falls 30% from record at lows"
2020-03-16,"Based on history, the stock market is pricing in a recession and maybe something more 'onerous'"
2020-03-16,CDC confirms first known employee infected with coronavirus
2020-03-16,Coronavirus forces airlines to consider a once unthinkable possibility — halting US flights
2020-03-16,"These high quality stocks can withstand a recession, Jefferies says"
2020-03-16,Paid sick leave sticking point in Senate vote on coronavirus relief bill
2020-03-16,"Coronavirus could be the tipping point for movie theaters, gyms and other industries already suffering from disruption"
2020-03-16,Dow rallies 500 points as White House details plans to combat slowdown from coronavirus
2020-03-16,"Joe Biden is the apparent winner of the Washington Democratic primary, NBC News reports"
2020-03-16,"Coronavirus wreaks havoc on retail supply chains globally, even as China's factories come back online"
2020-03-16,Fed says it will offer an additional $500 billion in overnight repo funding markets
2020-03-16,"Coronavirus: NY, NJ, Connecticut coordinate restrictions on restaurants, limit events to fewer than 50 people"
2020-03-16,US stock futures rise slightly following Dow's third-worst day ever
2020-03-16,"Coronavirus live updates: Telemedicine system crashes, Trump issues 'coronavirus guidelines,' SF and France order 'stay home'"
2020-03-16,"BlackRock's Rieder says it's time to selectively buy 'once in a lifetime' stock bargains, but market has not bottomed"
2020-03-16,San Francisco Bay Area officials order nearly 7 million people to 'shelter in place' to curb coronavirus spread
2020-03-16,"European stocks close down 5%, airline stocks tank as EU proposes travel restrictions"
2020-03-16,Trump pledges to backstop airlines '100%' in coronavirus response
2020-03-16,"Google and Facebook shares could drop another 30% to 40%, Evercore analysts say"
2020-03-16,White House advisor Peter Navarro: I'm bringing an executive order to Trump that would reduce US foreign dependency on medicines
2020-03-16,Defense Secretary Esper and deputy to remain separated as coronavirus precaution
2020-03-16,"Coronavirus in US may peak late April to early May, warns ex-FDA chief Scott Gottlieb"
2020-03-16,EU proposes ban on nonessential inbound travelers from abroad for 30 days
2020-03-16,IMF says it's ready to mobilize its $1 trillion lending capacity to fight coronavirus
2020-03-16,"Oil drops 10% at the low, breaking below $29 as demand evaporates"
2020-03-16,Hedge fund manager: I'm buying stocks because investors are misinterpreting coronavirus hysteria
2020-03-16,"Fiat Chrysler, PSA Group end production at European plants due to coronavirus"
2020-03-16,"As markets crash, Wall Street says buy Clorox, Costco and Domino's"
2020-03-16,"Silicon Valley executives plot investment blitz with charities, groups to help fight coronavirus"
2020-03-16,World Health Organization says some nations aren't running enough coronavirus tests: 'Test every suspected case'
2020-03-16,"El-Erian blasts Fed, saying it should have been 'laser-focused' on market failures and cut rates later"
2020-03-16,Coronavirus outbreak prompts growing number of states to ban dining in at restaurants
2020-03-16,"Three key drivers can help consumer staples keep outperforming, wealth manager says"
2020-03-16,Canada closing borders to non-citizens because of coronavirus
2020-03-16,NFL cancels 2020 draft event in Las Vegas due to coronavirus
2020-03-16,White House braces for political fight as it readies coronavirus airline bailout package
2020-03-16,What you need to know about the government's break for student loan borrowers amid the coronavirus
2020-03-16,"Focus on 'essential' companies that can 'get through to the other side,' Jim Cramer says"
2020-03-16,The 'kindness postcard' and other heartwarming gestures sparked by coronavirus
2020-03-16,Megadonors pull plug on plan for anti-Sanders super PAC as Biden racks up wins
2020-03-16,"Canada closing borders to noncitizens because of coronavirus, U.S. citizens exempt from ban 'for the moment'"
2020-03-16,"Bridgewater's Dalio says Fed has done all it can, targeted fiscal stimulus is needed"
2020-03-16,WHO considers 'airborne precautions' for medical staff after study shows coronavirus can survive in air
2020-03-16,Here's what happened to the stock market on Monday
2020-03-16,"Dow rebounds by 1,000 points amid report coronavirus stimulus package may be $1 trillion"
2020-03-16,Treasury Secretary Mnuchin tells Cramer there will be a lot of 'pent-up demand' when crisis ends
2020-03-16,"Coronavirus live updates: NY tri-state area imposes new restrictions, Workday to give workers cash"
2020-03-16,"Amazon to hire 100,000 more workers and give raises to current staff to deal with coronavirus demands"
2020-03-16,RBC warns coronavirus could cause 20% decline in US vehicle sales as auto stocks tank
2020-03-16,Tech titans erase more than $1 trillion in market sell-off
2020-03-16,"Coronavirus live updates: China reports 21 new cases, Malaysia shuts borders"
2020-03-16,Workday will give employees a cash bonus worth two weeks of pay amid coronavirus outbreak
2020-03-16,Uber is delivering free meals to health-care workers and first responders amid coronavirus crisis
2020-03-16,"UK Prime Minister tells Brits to stop all non-essential contact and avoid pubs, clubs and theaters"
2020-03-16,Biden leads Sanders in Ohio and Arizona as he looks to extend his primary edge: NBC/Marist polls
2020-03-16,NBA and NHL say players can still travel after seasons suspended due to coronavirus
2020-03-16,"Romney proposes sending $1,000 checks to every American to ease coronavirus economic pain"
2020-03-16,Watch now: ETF Edge on unpacking the market's historic volatility and lessons on liquidity
2020-03-16,The Alphabet coronavirus screening website that Trump talked about last week is not currently taking appointments
2020-03-16,"Gold falls below $1,500 as it is dragged into the global market rout"
2020-03-16,Retail store closures in the US could explode because of the coronavirus
2020-03-16,"Supreme Court postpones arguments because of coronavirus, citing Spanish flu precedent"
2020-03-16,Trump issues 'Coronavirus Guidelines' for next 15 days to slow pandemic
2020-03-16,"Coronavirus will be 'with us permanently,' former Bank of England official warns"
2020-03-16,Apple fined a record $1.2 billion by French antitrust authorities
2020-03-16,Senate has yet to receive final draft of coronavirus relief bill passed by the House
2020-03-16,Morgan Stanley: Coronavirus relief does not have the 'moral hazard' of financial crisis rescue
2020-03-16,New York Gov. Cuomo warns US won't have enough hospital beds for coronavirus pandemic
2020-03-16,JPMorgan tells employees around the world to work from home if possible
2020-03-16,Wall Street says these things must happen before the market will stop plunging and bottom
2020-03-16,"Trump says coronavirus crisis could stretch into August, may look at lockdown for 'certain areas'"
2020-03-16,"Coronavirus live updates: Canada closes its borders, states ban dining in at restaurants"
2020-03-16,"Coronavirus: NY, NJ, CT coordinate restrictions on restaurants, limit events to fewer than 50 people"
2020-03-17,How those coronavirus-fueled investment losses help cut your taxes
2020-03-17,Disney pushes 'Black Widow' from May 1 release and it could impact the whole Marvel slate
2020-03-17,Macy's is closing stores nationwide because of coronavirus
2020-03-17,Pompeo calls Iranian regime 'an accomplice' amid deepening coronavirus outbreak
2020-03-17,Ford weighing shift reductions as UAW presses Big 3 automakers to close factories
2020-03-17,"White House seeks to pass coronavirus aid, including for airlines and Boeing, 'very quickly'"
2020-03-17,"These are the ultimate 'social distancing' stocks, Piper Sandler says"
2020-03-17,"New Yorkers should be prepared for a 'shelter-in-place order,' Mayor Bill de Blasio says"
2020-03-17,Fox to buy video streaming firm Tubi for $440 million in cash
2020-03-17,The coronavirus crisis is making travel cheaper. Here's why you should resist the urge to buy.
2020-03-17,Trump spoke with restaurant company CEOs about coronavirus response
2020-03-17,Coronavirus may drive more high school seniors to in-state public colleges
2020-03-17,Stocks rebound on White House coronavirus plan — here are the lingering risks to watch
2020-03-17,Trump dismissed coronavirus pandemic worry in January — now claims he long warned about it
2020-03-17,Here's what happened to the stock market on Tuesday
2020-03-17,Social Security offices close due to coronavirus. Here's what that means for you
2020-03-17,The Fed will keep short-term cash injections to banks going through the week
2020-03-17,Asia stocks set to trade higher as Dow rebounds on stimulus hopes
2020-03-17,Financial independence fans see opportunity as market lurches
2020-03-17,"Sephora, Ulta and other beauty brands shutter stores and shift online as coronavirus changes consumer habits"
2020-03-17,"Uber stock drops 6.8% after it cancels car pools, tech stocks rally"
2020-03-17,"The 2020 Olympics are still happening, insists the IOC — but skepticism is starting to creep in"
2020-03-17,The government wants to start sending millions of Americans a check. Here's how to use it wisely
2020-03-17,Before coronavirus crash many big corporations broke the No. 1 rule of personal finance
2020-03-17,Biden aims to tighten his grip on the Democratic nomination as three states hold primaries in the shadow of coronavirus
2020-03-17,NFL free agent deals at risk as team doctors can't evaluate players due to coronavirus
2020-03-17,Dow futures fall 400 points in overnight trading after rebound on hopes for $1 trillion stimulus
2020-03-17,"How coronavirus could finally turn universal basic income, long favored by Silicon Valley, into political reality"
2020-03-17,The market crash hit the bull market's cult trends like pot and alternative meat hardest
2020-03-17,"New York state coronavirus cases soar to about 1,700, hospitalizing 19%"
2020-03-17,"Coronavirus live updates: Virus reaches all 50 states, stock futures fall, Pentagon sending respirators and ventilators"
2020-03-17,Sheryl Sandberg says Facebook wants to help small businesses pay workers and move online amid COVID-19 crisis
2020-03-17,Treasury and IRS to delay tax payment deadline by 90 days
2020-03-17,Tom Brady announces he will leave the New England Patriots
2020-03-17,"Trump seeks stimulus package potentially worth more than $1 trillion, including direct payments to Americans"
2020-03-17,"Kroger CEO: We have hired 2,000 people and have 10,000 openings in response to coronavirus demand"
2020-03-17,"SoftBank may not complete $3 billion tender offer for WeWork, sources say"
2020-03-17,"Stocks making the biggest moves after hours: FedEx, MongoDB, Boeing and more"
2020-03-17,"Coronavirus has now spread to all 50 states and DC, US death toll passes 100"
2020-03-17,FAA: Tower at Chicago's Midway airport is closed after 'several' employees there test positive for COVID-19
2020-03-17,"Cramer: Don't buy the dips in the market, sell bad stocks on any pops"
2020-03-17,"Even with $1 trillion stimulus, hit to economy and employment from virus will be big"
2020-03-17,Tesla factory is still open for business as Musk tells employees 'I will personally be at work'
2020-03-17,The Federal Reserve is adding another program to keep money flowing for big financial institutions
2020-03-17,"Zoom is 'leading the shift to a more virtual work paradigm,' Needham says"
2020-03-17,"Analysts are starting to say it's time to buy defensive stocks like Walmart, P&G & more in Tuesday's calls of the day"
2020-03-17,Gundlach says it's 'ludicrous' to think US won't enter a recession as coronavirus hits economy
2020-03-17,"You have financial questions, we have experts to get you some answers"
2020-03-17,Amazon shares seen benefiting from 'in-home shift' due to the coronavirus
2020-03-17,"Stock market live Tuesday: Stocks rebound on stimulus hopes, Dow up 1,000, oil drops 6%"
2020-03-17,"Group run by former Google CEO to hold meeting with VCs, philanthropists about ways to fight coronavirus"
2020-03-17,"Pentagon to free up 5 million respirator masks and 2,000 ventilators for coronavirus efforts"
2020-03-17,Banks nearly took down the economy in 2008. Now the industry hopes to redeem itself
2020-03-17,"L Brands, American Eagle, other retailers withdraw earnings outlooks as coronavirus shuts stores, some are tapping credit lines"
2020-03-17,"Market collapse leaves the best opportunity to pick stocks 'maybe ever,' Bank of America says"
2020-03-17,J&J hopes to start human trials for coronavirus vaccine in November
2020-03-17,Cuomo and Trump patch up their war of words over coronavirus as cases mount
2020-03-17,"'No blank check' for airlines seeking more than $50 billion in coronavirus aid, Democrats warn"
2020-03-17,Amazon prioritizes household staples and medical supplies from merchants amid coronavirus outbreak
2020-03-17,"Coronavirus live updates: Tax deadline delayed, UK pledges business relief"
2020-03-17,"New Yorkers should be prepared for a 'shelter in place order,' Mayor Bill de Blasio says"
2020-03-17,"Stock market live updates: White House and Fed boost stocks, Dow up 1,000, Boeing craters"
2020-03-17,Value investor David Katz says he's buying these high-quality stocks during the sell-off
2020-03-17,NFL free agent deals are at risk because teams can't have their doctors evaluate players due to coronavirus
2020-03-17,Apple stores in U.S. closed 'until further notice'
2020-03-17,Ex-Trump chief of staff Mick Mulvaney self-quarantining over coronavirus concern
2020-03-17,"This is 'the best thing that investors can do' right now, says ETF analyst"
2020-03-17,Gov. Cuomo says New York City will not be quarantined: 'It cannot happen'
2020-03-17,"NBCU, ViacomCBS, Walt Disney Television and other media companies will run new coronavirus PSAs"
2020-03-17,"WHO urges Europe to learn from China, take 'boldest' action possible to tackle coronavirus"
2020-03-17,Joe Biden gets Secret Service detail as he closes in on the 2020 Democratic nomination
2020-03-17,Trump administration wants an $850 billion stimulus plan to curb coronavirus damage
2020-03-17,"Stock market live updates: White House and Fed boost stocks, Dow surges 1,000, Boeing craters"
2020-03-17,Mnuchin says Trump administration is looking to get cash to Americans 'immediately'
2020-03-17,US airlines rally after Mnuchin seeks to pass coronavirus aid 'very quickly'
2020-03-17,"Cisco says Webex video-calling service is seeing record usage too, even as competitor Zoom draws all the attention"
2020-03-17,"Boeing seeking 'tens of billions' in U.S. government loan guarantees, sources say"
2020-03-17,10-year Treasury yield rebounds above 1% as White House seeks a possible $1 trillion stimulus
2020-03-17,Group run by former Google CEO to hold meeting with venture capitalists about ways to fight coronavirus
2020-03-17,"Coronavirus live updates: 4 Nets players test positive for the coronavirus, NYC weighing 'shelter in place'"
2020-03-17,Credit markets signal the US risks heading towards a financial crisis
2020-03-17,How to buy and set up the right monitor for your laptop so you can work more comfortably at home
2020-03-17,Facebook announces $100 million program for small businesses impacted by coronavirus
2020-03-17,"Facebook to give $1,000 bonuses to each of its employees to deal with coronavirus fallout"
2020-03-17,Morgan Stanley says a global recession in 2020 is now the firm's 'base case'
2020-03-17,"Treasury Secretary Mnuchin says financial markets will stay open, but could shorten trading hours"
2020-03-17,Apple stores in US closed 'until further notice'
2020-03-17,European Union will close external borders for 30 days to slow coronavirus pandemic
2020-03-17,Former California Rep. Duncan Hunter sentenced to 11 months for misuse of campaign funds
2020-03-17,McConnell says Senate won't pass House coronavirus bill without 'significant and bold new steps'
2020-03-17,"Stock futures jumped all over the place this morning, causing Cramer to say they're 'a total joke'"
2020-03-17,"Goldman slashes oil forecast, sees US crude at $22 per barrel"
2020-03-17,DoorDash eliminates and reduces some commission fees for restaurants
2020-03-17,Swedish pension fund with billions of assets under management to stop fossil fuel investments
2020-03-17,"Stocks making the biggest moves midday: Regeneron, Boeing, Amazon, Clorox and more"
2020-03-17,Senators push to let every American vote by mail as coronavirus keeps people at home
2020-03-17,Kelly Evans: Mark Cuban gets it
2020-03-17,UAW calls for two-week shutdown of Big 3 auto plants
2020-03-17,'Whatever it takes': UK pledges almost $400 billion to help businesses through coronavirus
2020-03-17,Goldman has a sophisticated strategy to trade the volatile market and possible comeback
2020-03-17,"US coronavirus cases surpass 5,000, up fivefold from a week ago"
2020-03-17,Treasury and IRS to delay tax season deadline by 90 days
2020-03-17,Chief mortgage regulator working on plan for potential spike in delinquencies from coronavirus
2020-03-17,"This is when to buy Microsoft, Apple, Amazon and Alphabet stock: Piper Sandler technical analyst"
