publish_date,headline
2020-03-17,"Coronavirus live updates: Mnuchin says Americans 'need cash now,' Poland closes border causing massive traffic jams"
2020-03-17,Hopes of a coronavirus vaccine mount as three key biotech players make progress
2020-03-17,"No blank check for airlines seeking coronavirus aid after spending $39 billion on stock buybacks, unions say"
2020-03-17,Historic slide in oil could cost energy industry thousands of jobs
2020-03-17,"China expels journalists from New York Times, Wall Street Journal and Washington Post"
2020-03-17,Fed will help businesses get up to $1 trillion in funding in the short-term borrowing markets amid coronavirus crisis
2020-03-17,Cramer calls on government to enlist corporate America in a coordinated coronavirus fight
2020-03-17,"Trump seeking $1 trillion stimulus package, including $250 billion in payments to Americans, WSJ says"
2020-03-17,"ESPN reveals how it will move forward without live sports during coronavirus, including 'stunt event programming'"
2020-03-17,"Regulators consider loosening bank liquidity rules amid coronavirus crisis, could boost loan volume"
2020-03-17,Travel industry pushes for $150 billion in aid as coronavirus cripples business
