publish_date,headline
2020-01-23,This map shows the latest spread of reported cases of coronavirus
2020-02-25,Here's how to reduce the taxes on your Social Security benefits
2020-03-02,Here's why the coronavirus may clobber your retirement plans
2020-03-02,How to build a cash reserve if coronavirus causes you to miss work
2020-03-03,What the Fed cutting interest rates to zero means for you
2020-03-08,"Dow sinks 2,000 points in worst day since 2008, S&P 500 drops more than 7%"
2020-03-08,"Here's why you probably won't own a flying car, but may still commute by air"
2020-03-08,"Sen. Ted Cruz, Rep. Paul Gosar, Rep. Doug Collins self-quarantine after interaction with CPAC attendee who tested positive for coronavirus"
2020-03-09,"With stocks plunging on oil price war and coronavirus fear, here's what to watch and do"
2020-03-09,"CDC says coronavirus testing is now available across all 50 states, more tests coming soon"
2020-03-09,"Focus on Apple and other 'tech winners for next 5-10 years' during this market selloff, Wedbush says"
2020-03-09,Gig economy companies from Uber to Lyft take action as coronavirus cases grow; workers say it's not enough
2020-03-09,Six signals from one research firm say a bottom is in and it's time to buy stocks
2020-03-09,El-Erian: US stock market could end up dropping 20%-30% before bottom is finally reached
2020-03-09,Trump and Pence try to reassure GOP donors they have coronavirus response under control
2020-03-09,"Biden has big lead over Sanders in Tuesday's make-or-break Michigan primary, polls say"
2020-03-09,"Oil jumps more than 10% one day after sharpest decline since 1991, amid hopes for continued OPEC talks"
2020-03-09,"Coronavirus-stricken Princess Cruises ship moves to Port of Oakland in California, thousands prepare to disembark"
2020-03-09,Tempted to claim Social Security benefits amid the market slump? Here's what to know first
2020-03-09,Trump had contact with congressmen Collins and Gaetz before they self-quarantined over coronavirus concerns
2020-03-09,"Coronavirus live updates: Cruise ship heads for Oakland, NYC mayor urges staying home"
2020-03-09,"Prince Andrew refuses to cooperate in Jeffrey Epstein probe, reportedly hires top extradition lawyer"
2020-03-09,"It takes an average of 5 days for coronavirus symptoms to show, new study says"
2020-03-09,"NYC mayor, officials urge New Yorkers to work from home, get mental health counseling amid coronavirus outbreak"
2020-03-09,The work-from-home trade: These tech companies could benefit from coronavirus office closures
2020-03-09,Tesla shares plummet as cheap oil and coronavirus challenge electric car and solar sales
2020-03-09,Media companies begin canceling annual ad presentations as coronavirus spreads in New York
2020-03-09,"Russia, Saudi Arabia squabble over oil strategy, but the real battle is with the US"
2020-03-09,"Google blocks visitors to Silicon Valley and New York offices, asks more staff to work from home"
2020-03-09,Bargain airfares not enough to entice travelers 'fearful at any price' amid coronavirus
2020-03-09,Stitch Fix shares crater more than 30% as sales miss and outlook disappoints
2020-03-09,"Stock market live Monday: Stocks post major losses, Dow's worst point drop ever, Oil tanks 24%"
2020-03-09,White House to invite Wall Street executives to meet over coronavirus concerns
2020-03-09,Apple says it's now OK to use disinfectant wipes to clean your iPhone
2020-03-09,Amazon tells employees in New York and New Jersey to work from home as coronavirus spreads
2020-03-09,Cramer: Amazon is a stock worth buying during this major market meltdown
2020-03-09,Italy extends its quarantine to the entire country; PM asks residents to stay at home
2020-03-09,"Trump downplays oil plunge, coronavirus as markets tank: 'Life & the economy go on'"
2020-03-09,"Stocks making the biggest moves midday: Diamondback Energy, Walmart, Twitter and more"
2020-03-09,Here's what you need to know about coronavirus and your health insurance
2020-03-09,Regulators urge banks to get funding to people who are impacted by the coronavirus
2020-03-09,Stocks are on the cusp of a bear market. Here's how long they last and how bad they can get
2020-03-09,Jim Cramer says he could see '9 or 10' oil companies going bankrupt if crude declines persist
2020-03-09,Watch: Coronavirus task force holds press briefing as US outbreak expands
2020-03-09,Former Obama fundraising chief calls on over 700 bundlers to back Joe Biden's surging campaign
2020-03-09,"Tapestry CEO agrees to stay at company for three years, Coach brand president to resign"
2020-03-09,Biden and Sanders' fight over trade is a war for the future of the Democratic Party
2020-03-09,Gold is a hot investment. Here's why you should resist the urge to buy during the market selloff
2020-03-09,"Robinhood goes down again, causing clients to miss out on another historic trading day"
2020-03-09,This low-volatility fund is beating a stomach-churning market - Here's what it holds
2020-03-09,"Robert Shiller: Coronavirus is creating a 'dangerous time' for markets, panic is just starting"
2020-03-09,Tech's big five lost over $320 billion of value in Monday's market crash; Apple plunged 7.9%
2020-03-09,"S&P 500 ETF just had its third-worst open ever, behind only the financial crisis and 9/11"
2020-03-09,"Coronavirus quarantine: For some, missing work could be financially 'crushing'"
2020-03-09,How wealthy investors are managing their portfolios amid the coronavirus scare
2020-03-09,Here are the milestones and firsts from the markets' historically bad day
2020-03-09,Stocks are rallying in the final hour of trading as Wall Street measures fiscal stimulus prospects
2020-03-09,"Stocks have not been this attractive vs bonds since the 1950s, according to Bank of America"
2020-03-09,Credit Suisse cuts market forecast because of the coronavirus 'global demand shock'
2020-03-10,"Star Seahawks linebacker rejects NFL collective bargaining agreement: 'You have guys suffering from 16 games, and you're going to add more games?'"
2020-03-10,"Coronavirus: Harvard moves classes online, tells students not to return after spring break"
2020-03-10,"Stocks making the biggest moves midday: Stitch Fix, Amazon, Qualcomm, Royal Caribbean and more"
2020-03-10,"Sell-off on Wall Street accelerates, with the Dow down 1,000 points"
2020-03-10,Get those money issues settled before the marriage
2020-03-10,United Airlines' US bookings plunge 70% as coronavirus spreads
2020-03-10,"Coronavirus cases could reach 64,000 in Washington state by May, governor says"
2020-03-10,"Trump pitched 0% payroll tax rate for the rest of the year, White House official says"
2020-03-10,Biden suggests he would veto 'Medicare for All' over its price tag
2020-03-10,Apple employee in Ireland tests positive for coronavirus in first confirmed case at company
2020-03-10,"Wall Street wants Trump to act within days on virus, or risks for a bigger sell-off and a recession will grow"
2020-03-10,"US isn't prepared for outbreak: This is a 'coronavirus winter, and we're in the first week,' disease specialist says"
2020-03-10,"White House plan for economic response to coronavirus is 'not there right now,' officials say"
2020-03-10,Mortgage bankers double their 2020 refinance forecast
2020-03-10,"Dow drops 1,400 points and is now on pace to close in a bear market, down 20% from its record"
2020-03-10,"Coronavirus live updates: Trump pitches 0%, NYC's count can't keep up, virus on trading floor"
2020-03-10,Apple got off to a strong start and looked unstoppable in 2020. Then the coronavirus broke out
2020-03-10,Here's where to get your tax return done for free
2020-03-10,"NYC coronavirus cases are 'coming in so intensely now,' Mayor de Blasio says"
2020-03-10,Sony Pictures delays 'Peter Rabbit 2' release to August amid coronavirus disruption
2020-03-10,Dow falls more than 800 points in wild trading
2020-03-10,CNN scraps live audience for next Democratic primary debate amid coronavirus fears
2020-03-10,Coronavirus and the election: Washington state primary voters urged not to lick mail-in ballots
2020-03-10,Medicare will cover coronavirus tests. Here's how to get one if you think you have symptoms
2020-03-10,Cramer: I'm more comfortable buying stocks after Trump acknowledged coronavirus stimulus need
2020-03-10,Joe Biden tells factory worker 'you're full of s---' during a tense argument over guns
2020-03-10,"Stock market live updates: Rally into the close, 10-year yield rebounds, oil climbs 10%"
2020-03-10,Stitch Fix shares are tanking as Wall Street fears core business could be reaching 'saturation point'
2020-03-10,Download these apps to stay informed and entertained if you're stuck at home
2020-03-10,CEO of largest NY health provider: White House coronavirus stumbles set back prevention efforts
2020-03-10,"Trump endorses Tommy Tuberville, the ex-football coach facing Jeff Sessions in Alabama's GOP Senate primary"
2020-03-10,"Joe Biden wins Missouri Democratic primary, NBC News projects, another key win for the former VP"
2020-03-10,"Market sell-off is a 'gross overreaction' to a 'severe but manageable flu,' Morningstar says"
2020-03-10,"Dow drops 1,400 points and tumbles into a bear market, down 20% from last month's record close"
2020-03-10,"Morgan Stanley says an employee tested positive for coronavirus, adding to Wall Street firms breached by virus"
2020-03-10,"Google tells more than 100,000 North American employees to stay home amid coronavirus fears"
2020-03-10,Trump administration expected to seek aid for shale companies hit by oil rout
2020-03-10,Walmart deploys new emergency leave policy after Kentucky associate tests positive for coronavirus
2020-03-10,JPMorgan says the stock sell-off is overdone and recession risk is overblown
2020-03-10,Elon Musk says he's looking to open a Tesla Cybertruck factory in 'central USA'
2020-03-10,"Next six months likely 'painful' for oil, says Goldman Sachs' Jeffrey Currie"
2020-03-10,Some airlines are running near-empty 'ghost flights' as coronavirus hits passenger numbers
2020-03-10,The Biden campaign has dramatically increased Facebook ad spending since Super Tuesday
2020-03-10,Google bans all ads for medical face masks amid coronavirus outbreak
2020-03-10,Bernie Sanders looks to Michigan to block Joe Biden's march to the Democratic nomination
2020-03-10,"New York Gov. Cuomo deploys National Guard to New Rochelle, establishes containment center to stem coronavirus"
2020-03-10,Coronavirus could financially cripple many Americans
2020-03-10,People are stealing hand sanitizer and surgical masks from doctors' offices because of coronavirus fears
2020-03-10,Yelp gives senators its list of grievances against Google in antitrust hearing
2020-03-10,Dos and dont's to avoid panic about your 401(k)
2020-03-10,Joe Biden takes a big step closer to the Democratic nomination with Michigan primary victory
2020-03-10,Elon Musk says Tesla has now produced 1 million electric vehicles
2020-03-10,"Trump pitched 0% payroll tax rate for the rest of this year, White House official says"
2020-03-10,"In this volatile market, it's key to keep it simple"
2020-03-10,What Merrill is telling clients now amid market uncertainty
2020-03-10,"Dow drops deeper into bear market territory, now down 1,600 points in final hour of trading"
2020-03-10,Educators scramble to bring classes to the cloud as coronavirus shuts schools
2020-03-10,Cramer: I'm more comfortable about the market after Trump acknowledged coronavirus stimulus need
2020-03-11,"IRS likely to delay April 15 tax filing deadline as part of Trump coronavirus response, WSJ says"
2020-03-11,"American troops killed, injured in Iraq rocket attack, US officials say"
2020-03-11,Joe Biden campaign announces new coronavirus committee to provide counsel as pandemic fears escalate
2020-03-11,"Stock market live updates: Dow tanks more than 900, oil slides, Cramer on when to buy"
2020-03-11,NYU doctor says US hospitals are unprepared for coronavirus and will be 'flooded'
2020-03-11,Watch: President Donald Trump addresses nation on US response to coronavirus
2020-03-11,Coronavirus fallout: At least 150 companies have warned of earnings hit
2020-03-11,"Bank of America says the 5G iPhone may be delayed, but there's still one big reason to buy Apple"
2020-03-11,"With interest rates near zero, preserving retirement income gets risky"
2020-03-11,Goldman says the bull market will end soon with stocks dropping another 15%
2020-03-11,"Coronavirus live updates: Trump meets with Wall Street execs, March Madness closed to fans"
2020-03-11,Trump suspends travel from Europe for 30 days as part of response to 'foreign' coronavirus
2020-03-11,Mortgage refinance applications spike 79% as homeowners rush to take advantage of lower rates
2020-03-11,"Coronavirus live updates: China reports 11 additional deaths, WHO declares global pandemic"
2020-03-11,YouTube will stream its big advertiser pitch instead of holding an in-person event due to coronavirus
2020-03-11,More than a third of US adults say movie theaters should close amid coronavirus outbreak
2020-03-11,Adidas CEO: Coronavirus outbreak is 'a painful setback'
2020-03-11,Boeing 737 Max cancellations pile up in bleak start to the year
2020-03-11,Britain unveils $39 billion spending package as it tries to tackle coronavirus slowdown
2020-03-11,These stocks are 'at their best when the market is at its worst'
2020-03-11,"Twitter is forcing its 4,900 employees to work from home"
2020-03-11,Dow falls hard into a bear market and analysts say the selling could be far from over
2020-03-11,White House task force recommends anti-coronavirus strategies for four counties
2020-03-11,Trump cancels events in Colorado and Nevada 'out of an abundance of caution' over coronavirus
2020-03-11,Ex-FDA chief on coronavirus: Governments must follow lead of businesses and impose more restrictions
2020-03-11,"Cramer sees Dow revisiting Christmas Eve 2018 lows, putting blue chips firmly in a bear market"
2020-03-11,More than a third of U.S. adults say movie theaters should close amid coronavirus outbreak
2020-03-11,The European Central Bank is set to deliver a major stimulus package to counter the coronavirus impact
2020-03-11,Coronavirus books plagiarized from news outlets dominate Amazon search results
2020-03-11,No automakers 'coming out unscathed' as US coronavirus cases grow
2020-03-11,Bernie Sanders will stay in the 2020 race after latest primary setback
2020-03-11,Putin takes a big step closer to being Russia's president beyond 2024
2020-03-11,"Stock market live updates: Dow tanks more than 800, oil slides, Cramer on when to buy"
2020-03-11,"If you don't have a 529 savings plan, you're not alone. Here's what you need to know"
2020-03-11,The coronavirus is hurting the euro zone economy. But Lagarde is not out of options
2020-03-11,"10-year Treasury yield rebounds, climbs above 0.8%"
2020-03-11,The Dow is in a bear market. Here's how bad it could get
2020-03-11,Citigroup's Corbat says 'this is not a financial crisis' during Trump meeting with Wall Street execs
2020-03-11,The 50-year-old founder of Rockstar just got a $3 billion check from PepsiCo
2020-03-11,"Now you can follow the coronavirus outbreak through Apple News on your iPhone, iPad or Mac"
2020-03-11,"Stock market live updates: Dow bear market, S&P sinks 6%, official global pandemic"
2020-03-11,"Apple is working on a new iPhone app with workout videos, code-named 'Seymour'"
2020-03-11,Cramer on coronavirus-driven turmoil: Stocks to hold and 'still not too late to own some gold'
2020-03-11,Here's what Goldman is telling clients to do following its bold call for deeper losses from here
2020-03-11,Got a high-deductible health plan? It may cover the cost of coronavirus testing
2020-03-11,NBA suspends season indefinitely after Utah Jazz player tests positive for coronavirus
2020-03-11,Here's why people are panic buying and stockpiling toilet paper to cope with coronavirus fears
2020-03-11,Value investor Bill Nygren scooping up travel and bank stocks during the market turmoil
2020-03-11,The Navy offers a glimpse inside the compound where its new drone warship is being built
2020-03-11,This Dow member has beaten the market during the last three recessions
2020-03-11,A coalition of students and activists are suing one of the biggest university systems over the SAT
2020-03-11,Amazon's cashierless checkout technology coming to Newark Airport
2020-03-11,"Here are Wednesday's biggest analyst calls of the day: Apple, Boeing, Delta, Eli Lilly & more"
2020-03-11,"El-Erian tells investors to 'be careful out there', warns of market stress"
2020-03-11,10-year Treasury yield rises slightly in volatile trading
2020-03-11,From frenzy to furlough: Bakeries see thousands in Pi Day sales vanish as coronavirus spreads
2020-03-11,Top US health official says the coronavirus is 10 times 'more lethal' than the seasonal flu
2020-03-11,Bank CEOs convene in Washington for meeting with President Trump on coronavirus response
2020-03-11,"Stocks making the biggest moves midday: Norwegian Cruise Line, DXC Technology, Citigroup & more"
2020-03-11,Boeing plans early draw on more than $13 billion loan as market turbulence worsens
2020-03-11,"Stock market live updates: Bear market, Dow tanks 1,400 points, official global pandemic"
2020-03-11,"Coronavirus live updates: First death from virus in Ireland, US hospital considers temporary facilities"
2020-03-11,Economist Alan Blinder says the US is probably already in recession
2020-03-11,"Tom Hanks, Rita Wilson test positive for coronavirus"
2020-03-11,10-year Treasury yield falls below 0.7% as flight to safety continues
2020-03-11,Amazon and Gates Foundation may team up to deliver coronavirus test kits to Seattle homes
2020-03-11,Markets want White House and Congress to move quickly on stimulus to head off a recession
2020-03-11,Oil falls after Saudi Aramco asked to raise output capacity
2020-03-11,Lawmakers pressure Big Pharma on drug supply chains amid coronavirus outbreak
2020-03-11,World Health Organization declares the coronavirus outbreak a global pandemic
2020-03-11,These S&P 500 stocks have outperformed since the 2009 bottom — here are the two that traders would buy
2020-03-11,First US hospital chain to treat coronavirus considers treating patients in 'tents outside'
2020-03-11,"Bernie Sanders wins the North Dakota Democratic caucus, NBC News projects"
2020-03-11,"Bank stocks have become 'awful investments' because of the coronavirus impact, Jim Cramer says"
2020-03-11,How the coronavirus crisis might trip up your tax filing
2020-03-11,Microsoft unifies research groups as it appoints a science chief
2020-03-11,"White House told federal health agency to classify coronavirus deliberations, sources say"
2020-03-11,"Stock market live updates: Dow tanks 1,100, oil and yields slide, Cramer on when to buy"
2020-03-11,"Up to 150 million Americans are expected to contract the coronavirus, congressional doctor says"
2020-03-11,Amazon launches $25 million relief fund for delivery drivers and seasonal employees amid coronavirus outbreak
2020-03-11,Golden State Warriors to play first NBA game without fans after San Francisco bans large crowds due to coronavirus fears
2020-03-11,"As energy stocks sink, analysts say to buy these solar names instead"
2020-03-11,Why millennials may shrug at the stock market's troubles
2020-03-11,Hotel disputes conservative lobbyist Matt Schlapp's claim of coronavirus 'screening' at CPAC site
2020-03-11,"Everything Jim Cramer said about the stock market on 'Mad Money,' including recession potential, bank stock headwinds"
2020-03-11,Cramer's lightning round: Zoetis could be 'resistant to recession'
2020-03-11,Futures are rebounding Wednesday night after Dow closes in bear market. Traders await Trump
2020-03-11,Facebook is giving free Portal video chat devices to employees who request them
2020-03-11,Trump's payroll tax cut proposal fails to gain traction in Congress after boosting market hopes
2020-03-11,Three TSA airport screeners in California test positive for new coronavirus
2020-03-11,"Your first trade for Wednesday, March 11"
2020-03-11,What to watch today: Dow to tank as wild market swings continue on coronavirus concerns
2020-03-11,"Dow losses reach nearly 9%, putting it on track for worst one-day decline since 1987 crash"
2020-03-11,Restaurants rethink paid sick-leave policies as coronavirus outbreak spreads
2020-03-11,Cruise industry proposes travel restrictions for passengers over 70 as coronavirus spreads
2020-03-11,US footwear imports from China just had their worst January in a decade
2020-03-11,Fed boosts money it's providing to banks in overnight repo lending to $175 billion
2020-03-11,US sporting goods retailer Modell's files for bankruptcy protection
2020-03-11,Senate Democrats unveil relief proposal in response to coronavirus outbreak
2020-03-11,Dow plunges as coronavirus is declared a pandemic — here's what to watch in the sell-off
2020-03-11,Here's what happened to the stock market on Wednesday
2020-03-11,"These tech stocks are the safest in a recession, top analyst Mark Mahaney says"
2020-03-11,"Trump calls emergency meeting with top health officials at White House, top lawmaker says"
2020-03-11,"Google recommends all employees in UK, Europe, Middle East and Africa work from home"
2020-03-11,CME Group to close Chicago trading floor as a precaution due to coronavirus
2020-03-11,"Coronavirus live updates: Gottlieb urges faster response, US cities ban large gatherings"
2020-03-11,NCAA March Madness basketball games will be played without fans
2020-03-11,Senators dispute industry claims that a bill targeting tech's legal shield would prohibit encryption
2020-03-11,"Boeing halts hiring, limits overtime to preserve cash, stock falls most since 1974"
2020-03-11,YouTube reverses policy of banning ads on coronavirus videos
2020-03-11,"Boeing halts hiring, limits overtime as coronavirus poses 'global economic disruption', shares down 13%"
2020-03-11,Fiat Chrysler idling Italian plants as coronavirus outbreak intensifies
2020-03-11,"This is a market that favors stock picking instead of ETFs, Bank of America strategist says"
2020-03-11,Travel industry could lose $24 billion as coronavirus cripples tourism from outside US
2020-03-11,"Coronavirus quarantines could be the perfect backdrop for HBO Max, Peacock and Quibi to join the streaming wars"
2020-03-11,"Ford Explorer back 'on track' following flawed launch, exec says"
2020-03-11,Large gatherings banned in San Francisco and Seattle area to slow the coronavirus outbreak
2020-03-11,"This 'ticking nuclear bomb' could cause energy bankruptcies, Onyxpoint partner says"
2020-03-11,"Oil lobbyists met with White House staffers to discuss markets amid OPEC price war, coronavirus"
2020-03-11,"Stocks won't recover from the coronavirus fallout until a stimulus package is passed, Invesco predicts"
2020-03-11,Strategist Jim Paulsen: The stock market 'oozes panic' and appears near a bottom
2020-03-11,"Stopping the coronavirus from spreading will include a recession, Jim Cramer says"
2020-03-11,Harvey Weinstein sentenced to 23 years in prison for rape and sex assault in case that sparked 'MeToo' movement
2020-03-11,Treasury recommends Trump administration delay the April 15 tax deadline
2020-03-11,Sports teams see ticket prices drop as much as 30% on secondary market as coronavirus fears spread
2020-03-11,Asia stocks drop as Dow enters bear market; WHO declares coronavirus outbreak a pandemic
2020-03-11,New York late-night shows will ditch live audiences in an effort to prevent coronavirus from spreading
2020-03-11,Boeing halts hiring as coronavirus poses 'global economic disruption'
2020-03-11,6 charts show the coronavirus impact on the global economy and markets so far
2020-03-11,Traders grapple to find the bottom as Dow enters bear market territory with S&P 500 not far behind
2020-03-11,"Dow drops more than 8%, heads for biggest one-day plunge since 1987 market crash"
2020-03-11,Dow plunges 10% amid coronavirus fears for its worst day since the 1987 market crash
2020-03-11,Starbucks will offer 'catastrophe pay' to baristas exposed to the coronavirus
2020-03-11,"What a payroll tax cut could mean for Social Security, Medicare and consumer spending"
2020-03-11,Toymaker CEO: Small businesses may see 'real carnage' from coronavirus without government help
2020-03-11,Top federal health official says coronavirus outbreak is 'going to get worse' in the US
2020-03-11,"Stock market live Wednesday: Dow bear market, official global pandemic, Wall Street says no crisis"
2020-03-11,Treasury recommends Trump Administration delay the April 15 tax deadline
2020-03-11,"Coronavirus live updates: CEO calls it a 'painful setback,' Merkel says most Germans will get infected"
2020-03-12,Energy powerhouse EDF part of trial using smart tech and heaters to optimize electricity use in buildings
2020-03-12,"Gap's earnings, sales beat, retailer names new CFO"
2020-03-12,Here are five things the pros are watching to gauge when the market turmoil may end
2020-03-12,Lagarde on Trump travel ban: 'I doubt very much that diseases have passports and are aware of borders'
2020-03-12,Starbucks CEO says customers may only be able to order via drive-thru or mobile due to coronavirus
2020-03-12,Here's how retirees can deal with market volatility when they don't have time to 'stay the course'
2020-03-12,Chamath Palihapitiya: Coronavirus fallout like financial crisis and dot-com bubble bust combined
2020-03-12,Here's Morgan Stanley's 'shopping list' for semiconductor stocks to buy amid the turmoil
2020-03-12,"Oil drops as much as 8%, on pace for worst week in more than a decade"
2020-03-12,Canada's Justin Trudeau is self-isolating while his wife waits on coronavirus test results
2020-03-12,"Stock market live updates: Dow tanks 2,200, S&P 500 bear market, sell-off deepens"
2020-03-12,'A Quiet Place Part II' delays March release due to coronavirus pandemic
