publish_date,headline
2020-03-12,"Coronavirus live updates: Senate cancels recess to address crisis, professional sports upended"
2020-03-12,"Brazilian official who posed for photo with Trump tests positive for coronavirus, reports say"
2020-03-12,Coronavirus market rout threatens to wipe out Trump's stock market gains since his election
2020-03-12,Dow futures point to more than 400 point opening loss following market's worst day since 'Black Monday'
2020-03-12,Why your tax return may spark interest from the IRS
2020-03-12,Champions League games postponed as virus hits world soccer
2020-03-12,Fed pumps $198 billion into short-term bank funding operations amid big demand
2020-03-12,"Congress shuts down Capitol to the public, White House cancels tours amid coronavirus pandemic"
2020-03-12,"Stock market live updates: Dow down 2,000, Fed stepping in, S&P 500 bear market"
2020-03-12,House Democrats' coronavirus bill delayed as GOP pushes to include Trump proposals
2020-03-12,Trump says markets are going to be 'just fine' as stocks crater amid coronavirus worry
2020-03-12,Here's what Goldman Sachs is telling clients to do to navigate the bear market
2020-03-12,'I obviously was stunned' — Mavs owner Mark Cuban had put 5%-10% odds on NBA suspending games
2020-03-12,JPMorgan and Goldman tell NY metro employees to work from home in coronavirus response
2020-03-12,Carnival shares tank after Princess Cruises says it will suspend global operations over coronavirus outbreak
2020-03-12,What to ask yourself before making any investment moves as the market falls
2020-03-12,'Circuit breaker' triggered again to keep stocks from falling through floor. What you need to know
2020-03-12,What can happen to a company if coronavirus sends every employee home
2020-03-12,"Sophie Gregoire Trudeau, wife of Canada PM Justin Trudeau, tests positive for coronavirus"
2020-03-12,There were a ton of stock calls on Thursday as analysts try to pick winners and losers amid crisis
2020-03-12,"Top US health official says coronavirus testing system is 'failing,' cases now confirmed in 44 states"
2020-03-12,NHL Commissioner Gary Bettman: No COVID-19 in NHL reported yet
2020-03-12,"As coronavirus threatens the elderly, Ohio asks for new volunteers to do 'patriotic duty' and work at poll sites"
2020-03-12,Italy locked down — in pictures
2020-03-12,NCAA cancels March Madness basketball tournaments due to coronavirus
2020-03-12,JPMorgan Chase orders up to half NY metro employees to work from home
2020-03-12,The five biggest tech companies lost more than $400 billion in value on Thursday
2020-03-12,Uber falls to all-time low as investors continue to measure coronavirus risk
2020-03-12,"Stock market live updates: Dow tanks 2,300 in worst day since Black Monday, S&P 500 bear market"
2020-03-12,Amazon tells sellers it's not taking new listings for face masks or hand sanitizer amid coronavirus price gouging
2020-03-12,Billionaire investor Mark Cuban adds to his Twitter stake as stock market craters
2020-03-12,The most important promotion a woman gets is the first one
2020-03-12,Major League Soccer suspends season for 30 days amid concern over coronavirus
2020-03-12,Markets are desperate for government action as they plunge deeper into bear territory
2020-03-12,Stocks are giving up their gains as they try to rebound from coronavirus sell-off
2020-03-12,"MLB will delay opening day by at least two weeks, spring training canceled due to coronavirus"
2020-03-12,Disney stock is down 28% since Bob Iger left CEO job last month
2020-03-12,Wharton's Jeremy Siegel calls for federal support for companies: 'We need bold measures'
2020-03-12,"Google Bangalore employee tests positive for coronavirus and office park shuts down, according to internal emails"
2020-03-12,Jim Cramer believes the White House is debating big plans to combat coronavirus and ease markets
2020-03-12,Disney and Universal close California parks in March to help halt spread of coronavirus
2020-03-12,Cryptocurrencies see $93.5 billion wiped off value in 24 hours as bitcoin plunges 48%
2020-03-12,Chinese food delivery giant offers paper 'shield' to diners to protect them against coronavirus
2020-03-12,"Stocks post biggest rally since 2008, clawing back some of their coronavirus collapse"
2020-03-12,'F9' delayed to 2021 amid coronavrius pandemic concerns
2020-03-12,"American, Delta and United cap Europe-US fares as Trump travel ban sparks demand surge"
2020-03-12,"Coronavirus live updates: France shutters schools, New York bans gatherings over 500"
2020-03-12,'Everybody is upside down:' Lobbyists flooded with calls from corporate clients worried about coronavirus
2020-03-12,PGA Tour won't allow fans for foreseeable future due to coronavirus
2020-03-12,Slack stock tanks 20% after hours on weak guidance
2020-03-12,Fed to pump in more than $1 trillion in dramatic ramping up of market intervention amid coronavirus meltdown
2020-03-12,Elizabeth Warren calls for a 'grassroots' stimulus package to counter coronavirus economic impact
2020-03-12,Judge orders former Army intelligence analyst Chelsea Manning released from jail
2020-03-12,Goldman says a New Jersey fitness center worker is 'suspected to have contracted' the coronavirus
2020-03-12,"Cramer slams government on coronavirus: 'They know nothing,' evoking his epic 2007 Fed rant"
2020-03-12,Oracle rises after beating quarterly expectations
2020-03-12,El-Erian sees stock market decline reaching 30% from highs and the world going into recession
2020-03-12,Nancy Pelosi cancels major New York fundraiser amid coronavirus fears
2020-03-12,"Stocks making the biggest moves after hours: Slack, Gap, Broadcom and more"
2020-03-12,Here's Bank of America's batten-down-the-hatches portfolio for an economic downturn
2020-03-12,New York's Broadway will go dark as restrictions tighten to prevent coronavirus spread
2020-03-12,Tesla reportedly sends employees back to US from Germany ahead of Trump travel ban
2020-03-12,The 'only way' to beat coronavirus is to 'risk a recession' Jim Cramer says
2020-03-12,Global task force says all live entertainment events in March should be postponed
2020-03-12,"Sports and finance have a lot in common, says Olympian Lauryn Williams"
2020-03-12,"Human trials for a coronavirus vaccine could begin 'within a few weeks,' top US health official says"
2020-03-12,Google Bangalore employee tests positive for coronavirus
2020-03-12,"NYC declares state of emergency, de Blasio says coronavirus 'could easily be a 6-month crisis'"
2020-03-12,"Italy closes bars, restaurants and most shops as coronavirus death toll jumps 30%"
2020-03-12,"Frontline medical workers are asking: With schools closing, who will care for their kids?"
2020-03-12,"Shopify is giving employees a $1,000 stipend to buy supplies while they work from home during coronavirus pandemic"
2020-03-12,New Disney CEO faces his first major challenge as coronavirus shuts down Disneyland and stock drops
2020-03-12,"Jamie Dimon discharged from hospital and 'doing very well,' JPMorgan tells staff"
2020-03-12,New York Gov. Cuomo bans gatherings of 500 or more amid coronavirus outbreak
2020-03-12,"Big banks have cash to help some industries in short-term crisis, but for others the pain may come later"
2020-03-12,How to use options to navigate wild volatility
2020-03-12,CBS and NBCU cancel live advertiser pitch events because of coronavirus
2020-03-12,The credit markets are signaling a bigger problem is afoot despite the Fed's interventions
2020-03-12,Coronavirus grinds the sports world to a halt: Here's what's canceled
2020-03-12,UAW confirms first-known coronavirus case of Fiat Chrysler auto plant worker
2020-03-12,"Coronavirus live updates: Princess suspends cruises, Congress shuts down Capitol to public"
2020-03-12,Stock futures point to more losses Friday following market's worst day since 'Black Monday'
2020-03-12,"With stocks selling off as rapidly as 1987, some analysts wonder if they can bounce as fast too"
2020-03-12,"There's a tail wind in sight for the struggling homebuilders, traders say"
2020-03-12,NHL suspends season due to coronavirus
2020-03-12,Supreme Court closes to the public until further notice amid coronavirus outbreak
2020-03-12,"New York real estate hit by coronavirus, market decline"
2020-03-12,How a decades-old design concept is transforming the energy efficiency of buildings
2020-03-12,Senate will cancel next week's recess as Congress works to pass coronavirus response plan
2020-03-12,"Coronavirus live updates: China reports 8 new cases, wife of Canadian PM tests positive"
2020-03-12,"Nike, Under Armour taking hits from coronavirus outbreak amid NBA cancellation, shares fall"
2020-03-12,Here's how I recreated my work setup at home during the coronavirus outbreak
2020-03-12,Amazon tells all employees to work from home if they can
2020-03-12,"Trump's European travel restrictions could drive some airlines out of business, trade group warns"
2020-03-12,"American, Delta cap Europe-US fares as Trump travel ban sparks demand surge"
2020-03-12,3 ways the downturn could help you build tax-free retirement savings
2020-03-12,Dow surges 700 points in wild trading as Wall Street tries to rebound from coronavirus sell-off
2020-03-12,Wharton business school is using the coronavirus pandemic as a learning opportunity
2020-03-12,Joe Biden releases plan to combat coronavirus in effort to show contrast with Trump
2020-03-12,"New York will see 'same trajectory' of coronavirus cases as China, South Korea and Italy, Gov. Cuomo says"
2020-03-12,"U.S. should 'wait and see' on fiscal help for companies, ex-Treasury Sec. Jack Lew says"
2020-03-12,Ariel Investments' John Rogers is 'hunkered down' but sees value in these stocks
2020-03-12,"Microsoft cancels Build, makes it virtual"
2020-03-12,"Coronavirus updates: France shutters schools, New York bans gatherings over 500"
2020-03-12,"US strikes Iran-backed group that hit Iraq base, officials say"
2020-03-12,Historic market plunge: Traders describe a day that went from 'uncertainty to panic'
2020-03-12,Daymond John: How to make the best of being stuck at home due to coronavirus closures
2020-03-12,"Bernie Sanders will win California primary, NBC News projects"
2020-03-13,Tesla stock drops despite monster market rally
2020-03-13,"The stock market is going to come ripping back quickly, says global investor Barry Sternlicht"
2020-03-13,"Europe is now the 'epicenter' of the coronavirus pandemic, WHO says"
2020-03-13,ESPN scrambling to figure out programming while live sports shut down indefinitely
2020-03-13,Pelosi says Democrats and White House reach a deal on coronavirus relief bill
2020-03-13,Domino's is the only restaurant stock up year to date
2020-03-13,Here's what every major company is doing about the coronavirus pandemic
2020-03-13,Disney to halt some live-action film production as coronavirus spreads
2020-03-13,Trump pressures Congress to 'approve a payroll tax cut' for the rest of the year
2020-03-13,"Stocks are expected to see more wild swings, even if Fed makes big policy move"
2020-03-13,Treasury Secretary Mnuchin says White House and Congress close to getting coronavirus bill done
2020-03-13,"After initial grief, new widows must reexamine their finances"
2020-03-13,New York will begin its first 'drive-through' testing center for coronavirus in New Rochelle
2020-03-13,Trump to buy oil for strategic reserve to aid energy industry: 'We're going to fill it'
2020-03-13,Here's what happened to the stock market on Friday
2020-03-13,Carl Icahn says the market sell-off has longer to go even though some stocks are 'awfully cheap'
2020-03-13,"Trump asks Walmart, Target and other retail giants to help tackle the Coronavirus crisis"
2020-03-13,Mnuchin says coronavirus sell-off will be great opportunity for long-term investors like '87 crash
2020-03-13,NFL prohibits in-person interviews with players before draft due to coronavirus
2020-03-13,Google is making a coronavirus information site to help find testing as more kits become available
2020-03-13,Eli Lilly CEO aims to start testing coronavirus cure 'this summer'
2020-03-13,China's plans to ease its 'green card' rules for foreigners spark racist backlash online
2020-03-13,Government leans on tech and telecom firms to help students forced to stay home
2020-03-13,"Coronavirus live updates: Pentagon halts domestic travel, South Korea reports 107 new cases"
2020-03-13,Coronavirus pandemic prompts the big 3 cruise companies to suspend operations
2020-03-13,"Your favorite TV shows may still be on the air now, but new episodes could be delayed as coronavirus shuts down production"
2020-03-13,"How much you need to save every month to earn $75,000 a year in interest for retirement"
2020-03-13,Cramer praises Trump for involving private sector in coronavirus response: 'This is real firepower'
2020-03-13,Oil rebounds 5% as Trump says US will purchase oil for strategic reserve
2020-03-13,"Stock market live updates: Is crash over?, Icahn not sure, Mnuchin say buying opportunity"
2020-03-13,Trump gives people with student loans a break amid coronavirus
2020-03-13,"Airline stocks soar on hopes for financial relief from coronavirus, Delta up 13%"
2020-03-13,Ford COO Farley to receive $2.5 million in shares if not selected as next CEO
2020-03-13,Trump declares national emergency over coronavirus
2020-03-13,"Washington reports 5 new coronavirus deaths, Trump says UK could be added to EU travel ban"
2020-03-13,"Ford, GM instruct employees to work from home due to coronavirus"
2020-03-13,Travel insurance might not help for trips called off due to coronavirus
2020-03-13,Facebook and Twitter slammed by congressman for allowing spread of 'racist themes and language' about coronavirus
2020-03-13,Trump says he will 'most likely' be tested for coronavirus
2020-03-13,US Olympic hopeful Monica Aksamit stranded in Poland due to COVID-19 travel ban
2020-03-13,Cramer's week ahead: Key metrics for the market are new coronavirus infections
2020-03-13,Trump indicates he opposes House coronavirus plan as Pelosi vows to pass it
2020-03-13,AT&T asks all employees to work from home if they can due to coronavirus
2020-03-13,"Stock market live Friday: Biggest jump in 11 years, Still down big for week, Mnuchin says buy"
2020-03-13,Trump says UK could be added to European travel restrictions
2020-03-13,Icahn reveals his biggest short position amid market turmoil: Commercial real estate
2020-03-13,S&P estimates a severe coronavirus outbreak in US could cost $90 billion in insured medical expenses
2020-03-13,"While the market tanks, this software company founded after 9/11 to help businesses deal with disasters is thriving"
2020-03-13,"Coronavirus could weaken climate change action and hit clean energy investment, researchers warn"
2020-03-13,"UAW negotiating paid leave for Fiat Chrysler workers, others regarding coronavirus"
2020-03-13,Government lawyers ask DoD to reconsider decision to give Microsoft $10 billion contract over Amazon
2020-03-13,Multilevel marketing sellers are using coronavirus to push oil and vitamin sales on Facebook
2020-03-13,"'I don't take responsibility at all' for lack of coronavirus tests, Trump says"
2020-03-13,Pfizer tells all US salespeople they must work remotely
2020-03-13,Trump demands more Fed action in coronavirus response even after $1.5 trillion liquidity injection
2020-03-13,Nike encourages all US employees to work from home as known coronavirus cases rise
2020-03-13,Cramer's lightning round: General Dynamics stock is a bet on a second Trump term
2020-03-13,This is how Joe Biden will tax generational wealth transfer
2020-03-13,Trump plans to declare national emergency over coronavirus pandemic
2020-03-13,There are some good reasons to check your homeowners insurance heading into spring
2020-03-13,"US officials shake hands, touch their faces and share a microphone at coronavirus press briefing"
2020-03-13,DoD asks judge to let it reconsider decision to give Microsoft $10 billion contract over Amazon
2020-03-13,"Stock market live updates: Is crash over?, Icahn not sure, Mnuchin says buying opportunity"
2020-03-13,"Watch the full interview with Carl Icahn on the crash, what's he's buying and his biggest short"
2020-03-13,American Dream megamall in New Jersey delays opening events over coronavirus
2020-03-13,Apple moves WWDC developers conference online due to coronavirus
2020-03-13,"These sectors beat the market once a recession starts, Morgan Stanley says"
2020-03-13,"Airline stocks soar on hopes for financial relief from coronavirus, Delta up 10%"
2020-03-13,How hospitals hope to keep 'worried well' from flooding emergency rooms during coronavirus outbreak
2020-03-13,"Icahn is shorting the commercial real estate market, which he says is going to 'blow up'"
2020-03-13,Watch: House Speaker Nancy Pelosi delivers remarks on coronavirus relief
2020-03-13,"Coronavirus live updates: Washington reports 5 new deaths, Trump says UK could be added to EU travel ban"
2020-03-13,Trump asks Energy Department to purchase oil for the strategic petroleum reserve
2020-03-13,"Coronavirus live updates: Pelosi vows to pass coronavirus bill, New York cases jump 30% overnight"
2020-03-13,"AMC is limiting how many people can see a movie at one time, more theaters could be next"
2020-03-13,"Coronavirus live updates: New York cases jump 30% overnight, Trump declares national emergency"
2020-03-13,Watch live: President Donald Trump expected to declare national emergency over coronavirus outbreak
2020-03-13,"US should give citizens $1,000 a month to limit coronavirus impact on economy, strategist says"
2020-03-13,The Masters and other major golf tournaments are postponed due to coronavirus
2020-03-13,El-Erian: Market looks 'less scary' as stocks set to rebound from nearly 30% drop from highs
2020-03-13,Progressive groups urge Supreme Court to broadcast arguments during coronavirus closure
2020-03-13,"Coronavirus live updates: Europe is now the 'epicenter' of the pandemic, The Masters is postponed"
2020-03-13,Citigroup employee from Manhattan office tests positive for coronavirus
2020-03-13,JPMorgan sees negative GDP growth but says the US will skirt a technical recession
2020-03-13,Treasury Secretary Mnuchin considers suspending student loan payments amid coronavirus
2020-03-13,"Louisiana postpones Democratic primary over coronavirus, the first state to do so"
2020-03-13,"These stocks are the best market crash turnaround candidates, Jefferies says"
2020-03-13,Cramer asks 'how can you not start buying here'
2020-03-13,Travelers swap spring break trips for staycations to avoid coronavirus risk
2020-03-13,Delta slashes flights by 40% — the most in its history — as virus cripples global travel
2020-03-13,Patagonia is closing all of its stores and shutting down its website because of the coronavirus
2020-03-13,"Brazilian president Bolsonaro, who dined with Trump, says he tested negative for coronavirus"
2020-03-13,"The Fed to start buying Treasurys Friday across all durations, starting with 30-year bond"
2020-03-13,"'Limit down' to 'limit up': A week of scary trading halts, but this time for a surge"
2020-03-13,"Wells Fargo upgrades Apple, sees a 'compelling risk/reward' amid coronavirus market plunge"
2020-03-13,Fed increasingly expected to cut interest rates to zero next week
2020-03-13,"Volatility spikes have brought about 'a great victory for ETFs as a structure,' CIO says"
2020-03-13,Boston Marathon delayed until September due to coronavirus
2020-03-13,Grubhub is suspending commission fees for independent restaurants
2020-03-13,Here's what would happen if coronavirus forces the NYSE to close its trading floor
2020-03-13,Bitcoin loses half of its value in two-day plunge
2020-03-13,"Coronavirus joins list of infamous market crashes, and it may not be over if policymakers don't act"
2020-03-13,Gov. Cuomo says New York has most coronavirus cases in US as new cases jump 30% overnight to 421
2020-03-13,Kelly Evans: Some really sage advice (it's from dad)
2020-03-13,Tesla shareholder trial delayed by judge due to coronavirus concerns
2020-03-13,"WHO says 'more needs to be done' to stem coronavirus outbreak in Iran as cases exceed 10,000"
2020-03-13,"Stock market live updates: Rally loses steam, Mnuchin says buying opportunity"
2020-03-13,"Mortgage rates jump back up to January high, as coronavirus fears put chill on spring housing market"
2020-03-13,"House passes coronavirus relief bill, sending it to Senate"
2020-03-13,Bill Gates leaves Microsoft board
2020-03-13,"Trump asks Walmart, Target and other retail giants to help tackle the coronavirus crisis"
2020-03-13,JPMorgan Chase says it has two cases of coronavirus at Manhattan headquarters
2020-03-13,Trump blames Obama for lack of coronavirus tests: 'I don't take responsibility at all'
2020-03-13,Fiat Chrysler plant workers walk out over coronavirus concerns in Canada
2020-03-14,"Delta, pilot union reach agreement to offer partial pay after virus forces flight cuts"
2020-03-14,Next-gen supercomputers are fast-tracking treatments for the coronavirus in a race against time
2020-03-14,"Trump tests negative for coronavirus, White House doctor says"
2020-03-14,These new batteries technologies could be the future of energy storage
2020-03-14,US extends travel restrictions to UK and Ireland as Trump discourages travel due to coronavirus
2020-03-14,Coronavirus crash is a true 'Black Swan' as Goldman thought the economy was nearly recession-proof
2020-03-14,White House signals third relief bill to help airline and cruise industries hit by coronavirus pandemic
2020-03-14,Review: Nissan Titan can't top its American competitors when it comes to full-size trucks
2020-03-14,Sports teams can hang onto sky-high valuations by taking care of employees now during coronavirus outbreak
2020-03-14,"Coronavirus live updates: Spain to impose nationwide lockdown, New York confirms first death"
2020-03-14,At or near retirement? Consider these moves to protect your nest egg
2020-03-14,How Critical Role helped spark a Dungeons & Dragons renaissance
2020-03-14,Vice President Mike Pence to hold press conference on coronavirus response at noon ET
2020-03-14,This ETF hedges against 'black swan' market events — here's how it's holding up this year
2020-03-14,"Restaurants, cafes and concert venues are getting pummeled as coronavirus forces social distancing"
2020-03-14,"France closes most stores on coronavirus fears, Spain imposes lockdown, US restricts UK travel"
2020-03-14,Your college closed early because of coronavirus. You might not get your money back
2020-03-14,"Stocks like Reynolds and Raytheon can weather a recession and even show upside, analysts say"
2020-03-14,Hospitals are canceling elective surgeries to make space for a potential flood of coronavirus patients
2020-03-14,"Grocers limit food purchases, urge shoppers not to hoard as panic buying continues. Kroger ramps up hiring"
2020-03-14,White House taking temperature checks for people near Trump and Pence in coronavirus precaution
2020-03-14,"Spain impose nationwide lockdown due to virus, closes all stores except groceries and pharmacies"
2020-03-14,Walmart reduces hours at US stores to keep up with surge of shoppers
2020-03-14,Georgia becomes second state to delay presidential primary due to coronavirus pandemic
2020-03-14,New York confirms state's first death from coronavirus
2020-03-14,Apple to close all stores outside of China until March 27 in response to coronavirus
2020-03-14,Coronavirus and market volatility shuts down the IPO market for potential listings like Airbnb
2020-03-14,"Coronavirus live updates: Spain to impose nationwide lockdown, Trump leads White House meeting"
2020-03-14,Italians are singing songs from their windows to boost morale during coronavirus lockdown
2020-03-14,Op-Ed: The US should call NATO to action and defend Europe against coronavirus
2020-03-14,"Not every bear market is accompanied by an economic recession, but chances are high"
2020-03-14,Trump says he took the coronavirus test as a precaution — the results are pending
2020-03-14,"France closes restaurants, cafes, movie theaters and other nonessential shops to fight coronavirus"
2020-03-14,"Coronavirus: American slashes international flights, Congo and Uzbekistan confirm first cases"
2020-03-14,"US adds UK and Ireland to coronavirus travel restrictions, Trump considers domestic travel curbs"
2020-03-14,These new battery technologies could be the future of energy storage
2020-03-14,A top tech analyst from Morgan Stanley is betting these two stocks can outperform in a downturn
2020-03-14,"Coronavirus live updates: France closes most stores, Spain imposes lockdown, US restricts UK travel"
2020-03-14,"Trump cheers Friday's stock bounce, which came after the worst drop in three decades"
2020-03-14,Trump says he has the right to remove Powell as Fed chair but hasn't 'made any decisions' yet
2020-03-14,Second Amazon employee in Seattle tests positive for the coronavirus
2020-03-14,A look at bear and bull markets through history
2020-03-15,Plunging stocks triggered a key market 'circuit breaker' — Here's what that means
2020-03-15,Americans returning from abroad face hours-long lines at US airports for coronavirus screening
2020-03-15,"Dow plunges 9% even after emergency Fed rate cut, trading briefly halted after the open"
2020-03-15,Nike is closing all of its stores in the US because of the coronavirus outbreak
2020-03-15,Trader creates new stock acronym for coronavirus-fueled panic: 'It's always darkest before the DAWN'
2020-03-15,"Trump says 'relax,' urges against hoarding as coronavirus cases soar and Fed cuts rates to zero"
2020-03-15,Biden and Sanders debate in the shadow of coronavirus – here are the highlights
2020-03-15,How the deadly coronavirus brought an industry to its knees: The 'cruise lines 9/11'
2020-03-15,"Op-Ed: Don't try to 'call a bottom' for the whole market, instead pick stocks for the long term"
