publish_date,headline
2020-03-31,"Gov. Cuomo says coronavirus is 'more dangerous' than expected as New York cases jump 14% overnight to 75,795"
2020-03-31,Billionaire investor Steve Cohen: 'After an earthquake there are tremors'
2020-03-31,The Fed's Loretta Mester says to expect 'some really bad economic numbers' before things get better
2020-03-31,Administration to release final rule on mileage rollback
2020-03-31,JetBlue slashes flights by 80% from its New York-area home as coronavirus spreads
2020-03-31,New York state just surpassed China's Hubei province for reported coronavirus cases
2020-03-31,"Stock market live Tuesday: Dow drops 410 points, down 23% in 2020, Worst first quarter ever"
2020-03-31,Private equity lobbyists were involved in the push for $500 billion coronavirus bailout fund
2020-03-31,How to keep your health insurance if you're furloughed or laid off
2020-03-31,Tax mavericks may try to bend the rules on coronavirus retirement savings withdrawals
2020-03-31,"House Speaker Nancy Pelosi says the country must move toward vote by mail, setting up a fight with Trump"
2020-03-31,"How the small town of Roundup, Montana, became a prominent place for 'prep centers,' and an important part of Amazon's supply chain"
2020-03-31,When will the money arrive? Here are answers to your questions about the coronavirus stimulus checks
2020-03-31,"Sony delays almost entire movie slate to 2021, proving studios are still committed to theaters"
2020-03-31,Rural hospitals and private medical practices struggle to stay open during the COVID-19 pandemic
2020-03-31,"Coronavirus expected to cripple US auto sales; companies push 0% financing, online buying"
2020-03-31,"CDC says diabetes, lung disease, heart disease and smoking may increase risk of severe coronavirus illness"
2020-03-31,Huawei says US blacklisting led to $12 billion revenue shortfall in 2019 as profit growth slowed
2020-03-31,Trump will approve 90-day delay for some tariff payments as coronavirus wallops economy
2020-03-31,"California Health Corps site scored 25,000 sign-ups in its first day, Governor Newsom says"
2020-03-31,Cramer sees new five-minute test as possible turning point in coronavirus-driven market decline
2020-03-31,Dow drops more than 800 points as worries over coronavirus intensify
2020-03-31,What to watch today: Dow set to post its worst quarter in over three decades
2020-03-31,Huawei wants to put Google apps in its own app store after US blacklisting blocks access to Android
2020-03-31,"Papa John's stock jumps, Domino's shares fall as pizza chains share first-quarter sales estimates"
2020-03-31,"Hedge funds are buying again and are likely to return to these old, favorite stocks"
2020-03-31,"Coronavirus live updates: New York cases jump to over 75,000 as ambulances, trucks and paramedics are sent to NYC"
2020-03-31,Market-moving analyst Stephen Tusa talks coronavirus impact and his favorite stock in the downturn
2020-03-31,'Opportunity of the century': How the coronavirus crisis could establish China as a global leader
2020-03-31,"After the Dow suffers such a bad first quarter, here's what typically happens the rest of the year"
2020-03-31,"Beleaguered cruise ship company Carnival to raise $6 billion in stock and debt, shares jump"
2020-03-31,"Stocks making the biggest moves in the premarket: Conagra, Carnival, RH, Visa & more"
2020-03-31,Which bills to pay during the coronavirus pandemic
2020-03-31,Trump calls for $2 trillion infrastructure package as part of coronavirus response
2020-03-31,"As energy stocks tumble, these names have best chance of survival"
2020-03-31,State Department confirms first official to die from coronavirus
2020-03-31,Macy's to be replaced on S&P 500 by Carrier Global
2020-03-31,"Sales of computer monitors and laptops are surging as we all work from home, NPD says"
2020-03-31,The best video call apps to use while you're social distancing
2020-04-01,"Wall Street analysts see plenty of buying opportunities as second quarter begins, including Verizon and JPMorgan"
2020-04-01,Kelly Evans: Not so great news for the stock market
2020-04-01,"Permanent changes from the coronavirus pandemic will benefit these tech stocks, Credit Suisse says"
2020-04-01,"Tesla could help make lithium ion batteries for ventilators to help fight COVID-19, says ResMed CEO Mick Farrell"
2020-04-01,Amazon workers plan strike at Michigan warehouse to call for coronavirus protections
2020-04-01,Doctors say Trump's idea to 'use a scarf' to protect against coronavirus is unproven
2020-04-01,IMF says coronavirus crisis requires 'wartime' policy response
2020-04-01,"Pentagon trying to get 100,000 body bags for FEMA's coronavirus response"
2020-04-01,Facebook's Sandberg: Learning from our mistakes prepared us to deal with the coronavirus
2020-04-01,"Florida, Pennsylvania issue statewide stay-at-home orders amid coronavirus outbreak"
2020-04-01,"Stock market live updates: Dow down 800, second quarter begins, Trump's warning"
2020-04-01,Dow jumps more than 450 points as Wall Street concludes another wild session
2020-04-01,U.S. oil industry pumps near record volumes even as demand and prices collapse
2020-04-01,Citigroup CEO Michael Corbat says bank is 'working around the clock' on small business relief program
2020-04-01,"GOP senator calls on Saudis to end its oil price war, says 'Americans died' protecting the kingdom"
2020-04-01,"Coronavirus effect could be 'far deeper than the subprime crisis,' says mortgage company CEO"
2020-04-01,New York Gov. Cuomo to close NYC playgrounds as coronavirus death rate starts to climb
2020-04-01,"Coronavirus tanks GM, Fiat Chrysler's first-quarter auto sales as pandemic shutters dealerships"
2020-04-01,Here are Bank of America's top stocks for the second quarter
2020-04-01,"US companies cut 27,000 jobs before the worst of the coronavirus shutdown, millions more coming, Moody's says"
2020-04-01,"Coronavirus live updates: Global cases hit 885,000 as China's numbers reportedly come under fire by US intelligence"
2020-04-01,Mnuchin says he will ask Congress for more small business loan funding if $350 billion pool runs out
2020-04-01,"Home Depot asks employees to take temperatures before coming to work, will limit traffic"
2020-04-01,"Private equity will get a liquidity cushion with payroll tax holiday, as some investments face a cash crunch"
2020-04-01,"Who's eligible for COVID-19 stimulus checks? Your questions, answered"
2020-04-01,California governor says 'We need more Googles' as company offers free Wi-Fi and Chromebooks to students
2020-04-01,"Where your coronavirus stimulus check will go furthest, based on US rents"
2020-04-01,'The other bomb' — Cramer's warning as first shale company files for Chapter 11
2020-04-01,Investors should expect a confusing earnings season ahead with delays and withdrawn forecasts
2020-04-01,Nancy Pelosi wants to move forward with infrastructure bill after House returns on April 20
2020-04-01,"Universal delays 'Minions: The Rise of Gru' to 2021, 'Wicked' likely pushed to 2022"
2020-04-01,Dow jumps more than 200 points after Trump tells CNBC Saudis and Russia will ease oil pressure
2020-04-01,"Here's how to change, cancel or even book upcoming travel plans"
2020-04-01,"Unemployment benefits for gig and self-employed workers stalled by confusion, delays"
2020-04-01,Goldman has a new favorite 'stable' stock for this coronavirus downturn
2020-04-01,"Stock market live updates: Dow down 900, second quarter begins, Trump's warning"
2020-04-01,Politicians are already calling for a 4th coronavirus relief plan. Here's what could be in it
2020-04-01,Here's how much bitcoin beat the Dow and S&P 500 in the first quarter
2020-04-01,"Italy readies more economic stimulus as its coronavirus death toll surpasses 12,000"
2020-04-01,"Stock market live updates: Dow down 1,000, second quarter begins, Trump's warning"
2020-04-01,"Brace for coronavirus fallout to take stocks to new lows, $107B money manager warns"
2020-04-01,"US, Italy and Spain have the most coronavirus cases. These charts show their infection curves"
2020-04-01,'Predictably Irrational' author says this is what investors should be doing during the pandemic
2020-04-01,Firms fear small business loan program in coronavirus rescue package will run out of money
2020-04-01,"Global coronavirus cases will hit 1 million and 50,000 deaths in a few days, WHO officials say"
2020-04-01,Stock market suffers another downturn - Jim Cramer and others weigh in
2020-04-01,These states could be hit with the biggest jobs losses from the coronavirus pandemic
2020-04-01,Dollar Tree CEO says supply chains stressed — but $1 billion of goods in 'pipeline somewhere'
2020-04-01,"Investors should have up to 10% in this 'hedge against the unexpected,' says 'Godfather' of gold"
2020-04-01,"Coronavirus live updates: US cases top 200,000, energy CEOs to meet with Trump Friday"
2020-04-01,Comcast CEO Brian Roberts pledges $500 million for employees whose jobs are impacted by coronavirus
2020-04-01,Legere is out as T-Mobile CEO as Sprint merger officially closes
2020-04-01,"Pentagon aiming to get 100,000 body bags for FEMA coronavirus response, report says"
2020-04-01,"Investors can do some buying as markets are 'a lot cheaper,' but key is moderation, says billionaire investor Howard Marks"
2020-04-01,Why some Americans may have to file tax returns before they see a coronavirus stimulus check
2020-04-01,"More than 1,000 New York City police officers have the coronavirus as 911 calls hit record highs"
2020-04-01,"US coronavirus cases top 200,000 as virus spreads and testing ramps up"
2020-04-01,"China hid extent of coronavirus outbreak, US intelligence reportedly says"
2020-04-01,IRS backs down and won't require Social Security recipients to file tax returns for stimulus checks
2020-04-01,"Amazon charts show it's ripe for a bounce back toward record high, says market analyst"
2020-04-01,Cruise ship passengers desperately plead with Florida to allow them in
2020-04-01,"Dow cuts gains in afternoon trading, now up just 80 points"
2020-04-01,New Jersey residents get until July 15 to file taxes
2020-04-01,"Selling tech to restaurants made Toast a $5 billion start-up — a month later, the coronavirus struck"
2020-04-01,"Europe should see a 'tick mark' recovery after a coronavirus plunge, economists say"
2020-04-01,Resist the urge to abandon the market: your 401(k) during the coronavirus pandemic
2020-04-01,Wimbledon 2020 tennis championships canceled due to coronavirus
2020-04-01,How the Burning Man community is helping to get masks and other supplies to hospitals
2020-04-01,Dow jumps more than 100 points after Trump tells CNBC Saudis and Russia will ease oil pressure
2020-04-01,This tax break may resurface in the next coronavirus bill – and CPAs are dreading it
2020-04-01,US manufacturers answer General Motors' call for ventilator components amid coronavirus crisis
2020-04-01,"While you're stuck at home, here's how to spot the International Space Station above the US"
2020-04-01,Energy CEOs will meet with Trump Friday at the White House as oil prices tumble
2020-04-01,"The coronavirus outbreak is a 'real threat to everyone on the planet,' WHO official says"
2020-04-01,"March's ISM manufacturing index is 49.1, signaling contraction as coronavirus hits economy"
2020-04-01,Nancy Pelosi cheers Trump's call for infrastructure bill as she unveils Democrats' plan
2020-04-01,"Chief regulator says mortgage bailout is 'on the honor system', pleads with borrowers to be honest"
2020-04-01,Trump says he doesn't know if China underreported coronavirus numbers: 'I'm not an accountant from China'
2020-04-01,Fed's Eric Rosengren says the central bank 'acted quickly' but Congress will need to do more
2020-04-01,"White House is not planning for a 4th coronavirus relief bill despite Democrats' push, officials say"
2020-04-01,Treasury Secretary Mnuchin says he's having ongoing discussions about infrastructure
2020-04-01,"NY lawmakers, unions urge Jeff Bezos to close Amazon warehouses hit by coronavirus"
2020-04-01,"El-Erian says he wouldn't buy into market yet, but offers a plan for those who feel they must"
2020-04-01,"Stocks making the biggest moves midday: Macy's, Carnival, Kroger, United Airlines & more"
2020-04-01,Media networks have paid billions for sports they won't receive this year — but the fighting for refunds hasn't started yet
2020-04-01,These states could be hit with the biggest job losses from the coronavirus pandemic
2020-04-01,WarnerMedia replaces CEO with Hulu co-founder Jason Kilar
2020-04-01,American Airlines apologizes for mistakenly offering dozens of pilots voluntary leave amid coronavirus
2020-04-02,"Coronavirus live updates: US cases top 217,000, Goldman's David Solomon says US response was 'slow'"
2020-04-02,Coronavirus sick leave: Who can't count on getting paid
2020-04-02,Chipotle CEO says the chain is developing brisket but new menu items on hold for now
2020-04-02,"Emerging markets will be 'cut to their knees' by pandemic, ex-IMF chief economist says"
2020-04-02,Chanos says gig economy companies like Uber will emerge from coronavirus crisis 'harmed'
2020-04-02,Larry Culp on GE Aviation's coronavirus furlough: 'There will be another side'
2020-04-02,Walmart puts sale of majority stake in UK chain Asda on hold as coronavirus upends grocery industry
2020-04-02,American Airlines cutting international summer schedule by 60% as coronavirus drives down demand
2020-04-02,"Coronavirus is unleashing an 'economic shock wave' not felt since the 1930s, hedge fund manager Mark Yusko warns"
2020-04-02,"Stocks making the biggest moves in the premarket: CarMax, Walgreens, Disney, Zoom & more"
2020-04-02,Trump invokes Defense Production Act for ventilator manufacturing
2020-04-02,"Coronavirus live updates: US cases top 226,000 as torrent of jobless claims continues"
2020-04-02,"These two airlines are 'too big to fail,' investor says"
2020-04-02,"GM, Honda partner to develop two new all-electric vehicles"
2020-04-02,"Bank of America cuts S&P 500 target to lowest on Wall Street, sees worst post-war recession in history"
2020-04-02,ClassPass reduces staff by more than half as social distancing drives fitness home
2020-04-02,Ford's first-quarter sales drop 12.5% amid coronavirus pandemic
2020-04-02,Jim Chanos says he covered bet against China's Luckin Coffee amid 70% plunge Thursday
2020-04-02,"Oil surges 20% after Trump tells CNBC Saudis, Russia reach production cut agreement"
2020-04-02,Small landlords struggle as renters either can't or choose not to pay amid coronavirus layoffs
2020-04-02,Instacart to provide workers with safety kits following strike over coronavirus protections
2020-04-02,"San Diego hospital prepares for 'slow-moving tsunami' of coronavirus cases as surgical masks, ventilators are in short supply"
2020-04-02,"Disney to furlough non-union employees at theme parks, waives annual pass fees"
2020-04-02,Rude awakening ahead for e-commerce brands like Warby Parker and Allbirds
2020-04-02,GE Aviation to lay off 50% of its engine manufacturing staff as coronavirus weighs
2020-04-02,"Coronavirus live updates: Global deaths top 52,800 as infection numbers cross a million"
2020-04-02,Shares of China's Luckin Coffee plummet 80% after investigation finds COO fabricated sales
2020-04-02,Stock futures point to opening fall as indexes head for modest weekly losses
2020-04-02,"Stocks making the biggest moves after hours: Tesla, Dave & Buster's, Chewy and more"
2020-04-02,"New York Gov. Cuomo says coronovirus outbreak in Long Island is 'troubling' as state cases surge to 92,381"
2020-04-02,"Amazon blocks sale of N95 masks to the public, begins offering supplies to hospitals"
2020-04-02,"One of this year's hottest stocks could be setting up for a fall, trader warns"
2020-04-02,"Chime bank pilots way to get $1,200 stimulus checks to users instantly after talks with Mark Cuban"
2020-04-02,JPMorgan CEO Jamie Dimon returns to work after heart surgery
2020-04-02,"Worldwide coronavirus cases reach 1 million, doubling in a week as death toll tops 50,000"
2020-04-02,Kelly Evans: A grim new record
2020-04-02,Goldman CEO David Solomon says 'no question' that the initial US response to coronavirus was slow
2020-04-02,Coronavirus: NYC Mayor de Blasio urges New Yorkers to cover face with scarves or bandanas while outside
2020-04-02,"Parents look to create a 'magical' Easter, as coronavirus changes the holiday celebration"
2020-04-02,"Stock market live updates: Dow up 300, jobless claims top 6 million, oil jumps 25%"
2020-04-02,"Trump tells CNBC he spoke to Putin, MBS and expects Saudis, Russia to announce 10 million barrel cut"
2020-04-02,"Americans expect to burn through their savings quickly, survey finds"
2020-04-02,Churches allowed to stay open in states where millions are particularly vulnerable to coronavirus
2020-04-02,Robert Herjavec: Possibly losing everything is scary whether you're a 'Shark' or small business
2020-04-02,Stock futures lower as indexes head for modest weekly losses
2020-04-02,"Oil surges more than 20% after Trump tells CNBC Saudis, Russia reach production cut agreement"
2020-04-02,"Booking Holdings CEO says coronavirus is 'nothing to laugh about,' after his own bout with COVID-19"
2020-04-02,Macy's is the first of what could be a retail and energy purge from the S&P 500
2020-04-02,Here are the right steps to taking a 401(k) loan during the coronavirus outbreak
2020-04-02,Paper stimulus checks could be delayed by up to 5 months
2020-04-02,Air Force will release nearly $900 million in withheld payments to Boeing as coronavirus hits industry
2020-04-02,Miami mayor asks Trump to suspend domestic and international flights from COVID-19 hotspots to Miami Airport
2020-04-02,Chanos says he is still 'maximum short' Tesla even with drop in last month
2020-04-02,"Oil surges 24% for best day on record after Trump tells CNBC Saudis, Russia reach agreement"
2020-04-02,Durbin denies Congress is rescuing airline shareholders with $50 billion bailout
2020-04-02,Dire feelings on Main Street on eve of small business lending program launch
2020-04-02,This company claims its smart thermometer could help detect coronavirus hot spots faster than the CDC
2020-04-02,"Democratic National Convention postponed until August, delaying official presidential nomination as coronavirus spreads"
2020-04-02,Cramer's lightning round: 'I think it is the time to buy Domino's'
2020-04-02,Goldman found the rare companies this year that could actually grow sales and earnings
2020-04-02,Need for nurses is driving record pay as coronavirus nears its peak
2020-04-02,"Walgreens says it saw sales surge, then drop off as coronavirus pandemic keeps customers indoors"
2020-04-02,Top Amazon lawyer calls fired strike organizer 'not smart or articulate' in meeting with top execs
2020-04-02,Trump campaign tells Jeff Sessions to stop claiming he is the president's biggest supporter
2020-04-02,US wipes out nearly half of the job gains since the financial crisis in just two weeks
2020-04-02,"Coronavirus live updates: VW extends Chattanooga plant closure to April 12, Amazon gives workers face masks"
2020-04-02,"Biden, Trump scale back campaigns as coronavirus spreads – but super PACs are going to war"
2020-04-02,What airlines are doing to clean their planes
2020-04-02,Here are high quality stocks with 'secure' dividends for these tough times
2020-04-02,"Fauci gets security detail after receiving multiple threats, reports say"
2020-04-02,Manhattan real estate sales ground to a halt in March. Prices could plunge next
2020-04-02,It could take 4 to 5 years for many Americans to recover wages lost to coronavirus
2020-04-02,CEO of spice maker McCormick: 'We've lived all phases of this crisis' and China is coming back
2020-04-02,"Amazon hires 80,000 new workers, will take temperatures and provide face masks after public outcry"
2020-04-02,"Facebook expects to add 10,000 workers in product and engineering this year, says COO Sheryl Sandberg"
2020-04-02,CBO sees the economy down 7% in second quarter and the jobless rate past 10%
2020-04-02,GE Aviation to furlough 50% of its engine manufacturing staff as coronavirus weighs
2020-04-02,Cash-strapped Royal Caribbean draws down its revolving credit lines as coronavirus pandemic tests the cruise industry
2020-04-02,"Coronavirus hits prisons: Ex-GOP Rep. Chris Collins' surrender date delayed two months as inmates, guards infected"
2020-04-02,Intruders are hijacking Zoom calls with noise and gross images — here's how to avoid becoming a victim of 'zoombombing'
2020-04-02,"Coronavirus live updates: Global cases top 1 million, Americans may face relief check delays"
2020-04-02,Disney to furlough non-union park employees in the US starting April 19
2020-04-02,"Stock market live Thursday: Trump report to CNBC rips oil higher, crude's best day, Dow up 450"
2020-04-02,Asia stocks little changed as oil prices pare gains after record surge
2020-04-02,"Oil gains accelerate, now up 30% after Trump tells CNBC Saudis, Russia reach cut agreement"
2020-04-02,Dow drops more than 300 points to close out another wild week on Wall Street
2020-04-02,Dow drops 500 points as sell-off accelerates to end a wild week
2020-04-02,COP26 climate change conference postponed until 2021 due to coronavirus
2020-04-02,Trump seen as 'moderator' in world oil talks as he prepares to meet US energy CEOs over price collapse
2020-04-02,"Coronavirus live updates: South Korea cases top 10,000, Singapore reports fifth death"
2020-04-02,Shopify shares fall as much as 13% after it suspends 2020 guidance due to coronavirus disruptions
2020-04-02,"Putin seeking to create new world order with 'rogue states' amid coronavirus crisis, report claims"
2020-04-02,Watch live: CNBC's @Work Livestream — Leadership & Management Amid Crisis
2020-04-02,"Zoom falls as much as 16% as CEO apologizes for security lapses, says daily users spiked to 200 million in March"
2020-04-02,Jim Cramer on Thursday's rally: Investors may be 'grasping at straws'
2020-04-02,Fed's Kaplan sees the jobless rate rising to mid-teens then falling to 8% this year
2020-04-02,"White House says small business lending program will be running Friday, even as JPMorgan says it's not ready"
2020-04-02,"Even with 6.6 million more workers seeking unemployment, millions more still need to file"
2020-04-02,'Godfather of ETFs' says this is what the bond market needs
2020-04-02,WeWork troubles deepen as SoftBank pulls its $3 billion tender offer
2020-04-02,Lululemon CEO: Some retailers will be able to 'weather' coronavirus pandemic. Others won't
2020-04-02,State unemployment offices scramble to handle surge in jobless claims amid coronavirus fallout
2020-04-02,The White House is watching these next coronavirus 'hot spots' to follow New York and New Jersey
2020-04-02,"Stock market live updates: Trump report to CNBC rips stocks and oil higher, crude up 20%"
2020-04-02,Defense department sees largest overnight spike in coronavirus cases
2020-04-02,Amazon lawyer calls fired strike organizer 'not smart or articulate' in meeting with top execs
2020-04-02,"HBO is making a bunch of its best shows, movies and documentaries free starting on Friday"
2020-04-02,The Navy's twin hospital ships have treated fewer than 20 patients as coronavirus battle rages
2020-04-02,Chipotle is working on a gift card program to support health-care workers through the coronavirus epidemic
2020-04-02,Detroit automakers take market share as consumers flock to pickup trucks amid coronavirus outbreak
2020-04-02,What to watch today: Dow to rebound after starting Q2 with heavy losses
2020-04-02,Navy relieves captain of duty after he pleaded for help with coronavirus outbreak on aircraft carrier
2020-04-02,"Job losses in March could be the worst in a decade, and that's just the beginning"
2020-04-02,"Lockdowns, curfews and doorstep testing: Africa's crackdown on the coronavirus"
2020-04-02,"Tesla soars on delivery numbers -- company delivered 88,400 vehicles in Q1"
2020-04-02,"Chime pilots way to get $1,200 stimulus checks to users instantly after talks with Mark Cuban"
2020-04-02,Coronavirus patient Chris Cuomo joins New York governor brother Andrew's press conference by remote video
2020-04-02,"New York Gov. Cuomo: 'I'm doing everything I can, but people are still dying' from the coronavirus"
2020-04-02,"Wall Street analysts bet on a bottom and upgrade more stocks, including Disney and Beyond Meat"
2020-04-02,Sales of video games soar as the coronavirus leaves millions trapped in their homes
2020-04-02,How to get your taxes in quickly and safely during the coronavirus pandemic
2020-04-02,Amazon will start taking workers' temperatures and provide face masks after public outcry
2020-04-02,This map shows which states are seeing the most job losses due to the coronavirus
2020-04-02,"Jim Chanos says beware the 'virus stocks' like Peloton, Zoom benefiting temporarily from lockdowns"
2020-04-02,"Phase 2 of coronavirus vaccine human trials may begin in spring, Moderna chairman says"
2020-04-02,US Secret Service warns that coronavirus email scams are on the rise
2020-04-02,Coronavirus chaos 'golden age' for hackers – Robert Herjavec on how to protect yourself online
2020-04-02,Asia stocks trade higher as oil prices pare gains after record surge
2020-04-02,Boeing to offer employees voluntary layoffs amid coronavirus pandemic
2020-04-02,Stock futures flat as indexes head for modest weekly losses
2020-04-02,Paying down debt may not be the best way to use your coronavirus stimulus check
2020-04-02,China defends its coronavirus data after report says US intelligence doubted numbers
2020-04-02,Uber said it would compensate drivers who test positive for COVID-19. This driver was still denied
2020-04-02,"Whiting Petroleum is just the 'first domino' to fall in US shale wipeout, strategist says"
2020-04-02,US weekly jobless claims double to 6.6 million
