publish_date,headline
2020-03-20,The upcoming job losses will be unlike anything the US has ever seen
2020-03-20,"Hopes are high for a coronavirus treatment, which could come much quicker than a vaccine"
2020-03-20,"Bank of America boosts pay for tellers by $400 a month, cuts their hours amid coronavirus outbreak"
2020-03-20,"12 years after Lehman, European banks face a new credit crisis"
2020-03-20,"Cramer worries that post-coronavirus US could have just three retailers: Amazon, Walmart, Costco"
2020-03-20,Trump will not offer Iran sanctions relief as coronavirus spreads rapidly in the country
2020-03-20,"Trump's Mar-a-Lago resort closes in peak of season as coronavirus spreads in US, report says"
2020-03-20,"Coronavirus live updates: States expand unemployment, WHO warns of health system collapse"
2020-03-20,Indiana is the latest state to postpone its 2020 primary as coronavirus spreads
2020-03-20,Cramer's lightning round: I would start a position in Abbott Labs
2020-03-20,'Do we still have to pay rent?' Retailers grapple with closed stores and coronavirus
2020-03-20,South Korea says detected North Korea missile fire 'inapproriate' amid coronavirus
2020-03-20,How one elite New York medical provider got its patients coronavirus tests
2020-03-20,Kraft Heinz factories are working three shifts a day to keep up with demand
2020-03-20,Delta warns second-quarter revenue to fall $10 billion because of coronavirus
2020-03-20,"Junk bond default rate to triple within 12 months, S&P says"
2020-03-20,"GOP Sen. Hoeven bought up to $250,000 in health sciences fund days after coronavirus briefing"
2020-03-20,"International Paper CEO says don't worry about diapers, 'there's plenty' of them"
2020-03-20,"State Department confirms its first coronavirus case in Washington, DC"
2020-03-20,"Amazon is likely to hold on to its market share gains after the pandemic, Oppenheimer says"
2020-03-20,Here's how your coronavirus rescue check from the government could be taxed
2020-03-20,Panicked wealthy fleeing the coronavirus drive up rental prices in the Hamptons and Hudson Valley
2020-03-20,Coronavirus hits China's economy twice as financial contagion spreads across the globe
2020-03-20,FDA says it won't take action against manufacturers that start making hand sanitizer
2020-03-20,"Sen. Loeffler, NYSE CEO husband defend stock sales after her private coronavirus briefing"
2020-03-20,Coronavirus rescue checks may shortchange some Americans on Social Security
2020-03-20,"Hospitals are still scheduling elective procedures during coronavirus crisis, and frontline medical workers fear they're infecting patients"
2020-03-20,Another harrowing week looms for markets as US economy shuts down and virus spreads
2020-03-20,The Trump administration promised borrowers a break on their student loans. They're still waiting
2020-03-20,"Member of Vice President Pence's office tests positive, US coronavirus cases now total more than 17,000"
2020-03-20,"Iran's coronavirus death toll tops 1,500; Bondi Beach closed as distancing rules ignored"
2020-03-20,"Boeing suspends dividend, CEO foregoes pay after virus-related aid request"
2020-03-20,"Food supply chains are so far holding up during coronavirus outbreak, CEOs say"
2020-03-20,"Target pays bonuses, hikes pay by $2 an hour amid coronavirus-induced surge in shopping"
2020-03-20,Communities rally around each other — and Google Docs — to bring coronavirus aid
2020-03-20,Gary Cohn says the US is in a recession that will cost 'trillions' as unemployment 'skyrockets'
2020-03-20,"Macy's taps $1.5 billion credit line, suspends earnings outlook and dividends amid coronavirus"
2020-03-20,"JPMorgan is giving tellers, other 'front-line' employees dealing with coronavirus a $1,000 bonus"
2020-03-20,"California's stay-home order not necessarily a 'one-size-fits-all' policy for other states, Pence aide says"
2020-03-20,Restaurateur Danny Meyer: It's going to take a month to recruit our team back and train them
2020-03-20,How Elon Musk took Tesla to hell and back with the Model 3
2020-03-20,Amazon AWS launches $20 million initiative to help fight the coronavirus
2020-03-20,Microsoft and Adaptive Biotechnologies are studying how the human immune system reacts to the coronavirus
2020-03-20,Analyst anticipates 'worst' financial crisis since 1929 amid fears of a global recession
2020-03-20,Clearing firm Ronin Capital unable to meet capital requirements at CME: Sources
2020-03-20,PG&E reaches bankruptcy deal with California governor
2020-03-20,"Cramer says 'I think there's a technical rebound coming,' but warns it may be short-lived"
2020-03-20,Tax Day is now July 15. Why you should get your return in even sooner
2020-03-20,Analysts upgraded a slew of stocks in Friday's calls of the day as investors hope for signs of a market turnaround
2020-03-20,'It's a new planet overnight': New York City businesses hit hard by coronavirus pandemic
2020-03-20,Private jet industry — the transportation of choice for the wealthy — asks for bailout funding
2020-03-20,"US and Mexico restrict non-essential travel across border, White House says amid coronavirus crisis"
2020-03-20,"Goldman sees unprecedented stop in economic activity, with 2nd quarter GDP contracting 24%"
2020-03-20,"It's a 'critical time' for governments to help airlines hit by coronavirus, says analyst"
2020-03-20,United warns of possible job cuts if government doesn't act quickly on coronavirus aid
2020-03-20,JC Penney yanks earnings outlook because of coronavirus
2020-03-20,WHO officials warn health systems are 'collapsing' under coronavirus: 'This isn't just a bad flu season'
2020-03-20,McDonald's suspended its $15 billion buyback program several weeks ago
2020-03-20,Disney Pixar's 'Onward' coming to digital and Disney+ earlier due to coronavirus outbreak
2020-03-20,"How much you can expect to get from Social Security if you make $30,000 a year"
2020-03-20,FCC approves SpaceX to deploy up to 1 million small antennas for Starlink internet network
2020-03-20,Cramer's week ahead: We're fighting a 'two-front war' with coronavirus
2020-03-20,"Senators urge Jeff Bezos to give Amazon warehouse workers sick leave, hazard pay"
2020-03-20,"New York City is the new coronavirus epicenter with one third of all US cases, Mayor de Blasio says"
2020-03-20,What to watch today: Dow looks for first back-to-back gains in six weeks
2020-03-20,"February saw the biggest fall ever in smartphone sales, says analyst firm"
2020-03-20,Cuomo orders most New Yorkers to stay inside — 'we're all under quarantine now'
2020-03-20,AMN Healthcare recent acquisitions come just in time to fight coronavirus outbreak
2020-03-20,Here's where Goldman thinks the market will bottom and we're not there yet
2020-03-20,"Alphabet self-driving car company Waymo suspends all driving operations in Phoenix and Detroit, internal memos show"
2020-03-20,"Coronavirus live updates: IRS moves tax filing deadline, JC Penney yanks earnings outlook"
2020-03-20,"February home sales jump to highest in over a decade, but big drop expected as coronavirus injects uncertainty"
2020-03-20,Education Dept. says borrowers can now pause student loan payments amid pandemic. They already could
2020-03-20,New York Gov. Cuomo orders 100% of non-essential businesses to work from home
2020-03-20,Mike Bloomberg will transfer $18 million to the Democratic Party as it gears up to face Trump
2020-03-20,"Oil falls 11%, on track for worst month on record"
2020-03-20,"Phishing scams, spam spike as hackers use coronavirus to prey on remote workers, stressed IT systems"
2020-03-20,Coronavirus: Global auto production could fall by 1.4 million vehicles this year
2020-03-20,Google's big developer conference is now completely canceled because of coronavirus
2020-03-20,"Stock market live Friday: Dow down 900, worst week in 11 years, oil craters"
2020-03-20,"UK PM Boris Johnson announces nationwide lockdown measures, telling cafes, pubs and restaurants to close"
2020-03-20,GM to lend its auto factories to support production of ventilators in coronavirus fight
2020-03-20,Distilleries making hand sanitizer? How small businesses are pivoting due to the coronavirus
2020-03-20,"From Olive Garden to Michelin-starred restaurants, a shifting stance on delivery to stay afloat"
2020-03-20,"As demand for coronavirus testing grows, Walmart and Walgreens will soon open drive-through sites for first responders"
2020-03-20,WHO officials say at least 20 coronavirus vaccines are in development in global race for cure
2020-03-20,"Stocks making the biggest moves midday: Travelers, Kellogg, Chipotle & more"
2020-03-20,Why the coronavirus pandemic may fast-forward 5G adoption in the US
2020-03-20,Two GOP senators face questions over stock sales ahead of the market's coronavirus slide
2020-03-20,Stock buybacks: What are they and how do they impact investors?
2020-03-20,"Coronavirus live updates: Singapore reports its first two deaths, Italy locks down further"
2020-03-20,"Markets are 'very oversold,' analyst says volatility will peak before investors see the bottom"
2020-03-20,"Stock market live updates: Stocks try to hold gains, New Yorkers ordered to stay home, Amazon leads tech"
2020-03-20,The Federal Reserve is expanding its asset purchases to include municipal bonds
2020-03-20,"IRS extends tax filing deadline to July 15 as coronavirus spreads, Mnuchin says"
2020-03-20,The new MacBook Air is the best laptop for Mac fans — and Apple finally fixed the keyboard
2020-03-20,Democrats shift fundraising strategies amid coronavirus crisis in bid to beat Trump and GOP
2020-03-20,"Spain official warns 80% of people in Madrid will get coronavirus, as nationwide death toll surpasses 1,000"
2020-03-20,"How parents cope when home is also a workplace, a school and a daycare center"
2020-03-21,How coronavirus could permanently change the movie industry
2020-03-21,Singapore to bar all short-term visitors in efforts to reduce imported coronavirus cases
2020-03-21,These fitness companies are offering free online workouts during coronavirus quarantine
2020-03-21,US seeks comments on tariff cuts for Chinese imports to aid coronavirus battle
2020-03-21,Singapore reports first two deaths linked to coronavirus
2020-03-21,Read the memo Jeff Bezos sent to Amazon employees about coronavirus safety at warehouses
2020-03-21,FDA grants 'emergency use' coronavirus test that can deliver results in 45 minutes
2020-03-21,Op-Ed: Coronavirus stimulus bill must include expanded Social Security payments
2020-03-21,Kudlow says coronavirus relief package worth more than $2 trillion
2020-03-21,US military Central Command confirms first case of coronavirus at HQ
2020-03-21,Hospitals turn to crowdsourcing and 3D printing amid equipment shortages
2020-03-21,"As more colleges move to remote learning, students struggle to adapt"
2020-03-21,"As Silicon Valley orders everybody to shelter in place, tech execs navigate barking dogs, screaming kids and Zoom calls"
2020-03-21,Amazon doubles overtime pay for warehouse workers as demand rises due to coronavirus
2020-03-21,New York City area airports resume flights after brief halt as coronavirus causes staffing issues
2020-03-21,Best Buy shifts stores to curbside pickup only as demand surges for home office equipment
2020-03-21,Wall Street analysts say buy these 'safe-haven' stocks amid market volatility
2020-03-21,"World Health Organization offers tips for living under coronavirus quarantine: Don't drink, smoke or watch too much news"
2020-03-21,I ate a meal in virtual reality. Here's what it tasted like
2020-03-21,"As Amazon orders surge, coronavirus delays deliveries and threatens to put sellers out of business"
2020-03-21,"'Virus-defensive' stocks started to outperform in January, before the broader market plunged"
2020-03-21,"Facebook has moved fast during coronavirus outbreak, and it could restore the company's reputation"
2020-03-21,Trump: 'I don't know' if my businesses will receive coronavirus assistance
2020-03-21,Apple updated Siri to help people who ask if they have the coronavirus
2020-03-21,"In the coronavirus sports void, these are the desperate bets gamblers are making"
2020-03-21,Why BMW and Mercedes made cheap cars that failed and why they keep trying
2020-03-21,Congress is working on a massive coronavirus relief package — it might not be enough for businesses
2020-03-21,"Coronavirus live updates: Spain death toll passes 1,700, India begins curfew"
2020-03-21,NYC restaurants face mass layoffs as coronavirus cripples economic life: 'This is a crushing blow'
2020-03-21,"Op-Ed: The US should rally G7, NATO and other global allies together in fight against coronavirus"
2020-03-21,"Actor, singer, 'The Gambler': Kenny Rogers dies at 81"
2020-03-21,"Congress is working on a $1 trillion rescue package, but it might not be enough for US businesses"
2020-03-21,"Coronavirus scams, feeding off investor fears, mimic fraud from the 2008 financial crisis"
2020-03-21,Pence will get tested for coronavirus after member of his office tested positive
2020-03-21,Op-Ed: Investor who made it through '87 crash gives optimistic case for the stock market right now
2020-03-21,Why Zoom has become the darling of remote workers during the COVID-19 crisis
2020-03-21,Vice President Mike Pence tests negative for coronavirus
2020-03-21,"FDA OKs 'emergency use' coronavirus test, global cases top 300,000"
2020-03-21,"Buy these 'social distancing' stocks, says JPMorgan"
2020-03-21,"Coronavirus cases top 300,000 worldwide as US becomes one of worst hit countries"
2020-03-21,"Stocks can return to records early next year if the US can curb coronavirus spread, says JPMorgan"
2020-03-21,"Coronavirus live updates: US hospitals seek $100 billion in aid, Spain death toll tops 1,300"
2020-03-21,"Coronavirus live updates: FDA OKs 'emergency use' test, global cases top 300,000"
2020-03-22,"Breaking down this sell-off, among the most extreme and rare Wall Street has ever seen"
2020-03-22,Cisco commits $225 million in fight against coronavirus as Silicon Valley initiates investment blitz
2020-03-22,Coronavirus stimulus bill fails in key Senate procedural vote
2020-03-22,Decline in stock futures worsens as investors await a stimulus agreement — Futures hit 'limit down'
2020-03-22,Planning in the time of coronavirus means thinking about some serious 'what-ifs'
2020-03-22,NYSE readies itself for first ever all-electronic trading day
2020-03-22,"Coronavirus live updates: Trump activates National Guard in California, New York and Washington state, Rand Paul tests positive"
2020-03-22,"Air pollution falls as coronavirus slows travel, but scientists warn of longer-term threat to climate change progress"
2020-03-22,These charts show how fast coronavirus cases are spreading — and what it takes to flatten the curve
2020-03-22,The coronavirus outbreak made me cancel my wedding
2020-03-22,Fed's Bullard: Coronavirus shutdown is not a recession but an investment in survival
2020-03-22,Investing for the post-coronavirus economy: 'We're not going back to the world we lived in'
2020-03-22,"Goldman makes bold upgrade of Boeing shares, saying it has enough cash and air travel will return"
2020-03-22,"Coronavirus live updates: Merkel in quarantine, Rand Paul tests positive"
2020-03-22,Governors across the nation slam federal coronavirus response: 'We didn't take this seriously'
2020-03-22,"Stock losses accelerate, Dow falls 900 points as Wall Street waits for fiscal stimulus on coronavirus"
2020-03-22,"Trump activates National Guard in California, New York and Washington state: 'This is a war'"
2020-03-22,"Coronavirus live updates: NY, Illinois governors warn states are competing for supplies, 'It's a Wild West'"
2020-03-22,Congress struggles to reach a deal on its massive coronavirus stimulus bill
2020-03-22,Earnings are about to do something they haven't done since 2008 because of coronavirus
2020-03-22,"Coronavirus: NY Gov. Cuomo says state to start clinical drug trial, authorizes temporary hospitals, asks US to nationalize medical supply buying"
2020-03-22,One start-up investor told companies to forget about 2020 forecasts and just get through the quarter
2020-03-22,"Financing programs for businesses hit by the coronavirus could amount to $4 trillion, Mnuchin says"
2020-03-22,Why long-term investors should never sell stocks in a panic
2020-03-22,NYSE set to temporarily transition to all-electronic trading
2020-03-22,"Trump activates National Guard in California, New York and Washington state to fight coronavirus outbreak"
2020-03-22,"Oil drops as much as 8%, extending declines after worst week since 1991"
2020-03-22,These are our favorite apps for exercising at home if you can't get to a gym
2020-03-22,IBM and White House to deploy supercomputer power to fight coronavirus outbreak
2020-03-22,Sen. Rand Paul tests positive for coronavirus
2020-03-22,WeWork board's special committee is demanding that SoftBank follow through with investment
2020-03-22,Chancellor Angela Merkel in quarantine after contact with doctor who tested positive for coronavirus
2020-03-22,"New York state has more coronavirus cases than France or South Korea as infections soar to 15,168"
2020-03-22,Dow sheds another 3% after coronavirus stimulus bill fails in Senate for a second time
2020-03-22,The government budget deficit is about to explode to fight the coronavirus
2020-03-22,Emirates Airline steps back from suspending all passenger flights after lobbying from governments
2020-03-22,Widows can lead a rewarding life after grief and growth stages
2020-03-22,Airlines tell Congress they need cash coronavirus aid or thousands will be furloughed
2020-03-22,How wearable robots are helping people with paralysis walk again
2020-03-22,Regulators urge banks to work with customers during coronavirus crisis
2020-03-23,Facebook joins YouTube and Netflix in reducing video quality in Europe amid virus pandemic
2020-03-23,"Congress may let you take $100,000 from your 401(k). What you should know"
2020-03-23,"David Tepper says he's buying some tech stocks, but market may have 10% to 15% more to fall"
2020-03-23,"Stocks making the biggest moves midday: Zoom Video, Hasbro, Netflix, Boeing & more"
2020-03-23,"New Mexico, Washington and a slew of other states are telling their residents to stay home amid coronavirus"
2020-03-23,"Stock market live Monday: Dow sinks 580 points, virus bill stalls in Senate, Tepper 'nibbles'"
2020-03-23,10-year yield dives below 0.7% after Fed announces unlimited asset purchases
2020-03-23,US tech CEOs from Tim Cook to Elon Musk pledge to help coronavirus fight with masks and ventilators
2020-03-23,"Market comeback gains steam as Dow soars 1,600 points on stimulus deal hope"
2020-03-23,Alphabet's Verily expands its coronavirus screening sites to two more California counties
2020-03-23,"Widespread coronavirus testing in US is 'weeks, if not months, out,' says CEO of test manufacturer Roche"
2020-03-23,Stocks drop after Senate's second coronavirus bill fail — Cramer and others on what to watch now
2020-03-23,"Coronavirus live updates: US stimulus package fails again to pass, China reports 78 new cases"
2020-03-23,"These cash-rich tech companies can 'weather the storm,' Evercore ISI says"
2020-03-23,CDC says coronavirus RNA found in Princess Cruise ship cabins for up to 17 days after passengers left
2020-03-23,"As coronavirus forces millions to work remotely, the US economy may have reached a 'tipping point' in favor of working from home"
2020-03-23,Mnuchin says Congress is 'very close' to a stimulus agreement and must get it done 'today'
2020-03-23,Japan stocks jump about 5% as Fed ramps up stimulus measures; Softbank surges 16%
2020-03-23,Dow rebounds more than 11% in best day since 1933 as Congress nears coronavirus stimulus deal
2020-03-23,"Tech lenders push for a piece of the coronavirus, small-business bailout"
2020-03-23,Coronavirus impact: Satellite images show world cities before and after outbreak
2020-03-23,US health officials say 147 nursing homes have at least one resident with coronavirus
2020-03-23,House Democrats introduce a $2.5 trillion coronavirus stimulus plan as Senate bill stalls
2020-03-23,"Coronavirus live updates: Florida requires travelers from New York and New Jersey to self-isolate, pressure mounts to postpone Tokyo Olympics"
2020-03-23,"How volunteers from tech companies like Amazon, Apple and Google built a coronavirus-tracking site in six days"
2020-03-23,Facebook is offering employees up to a month of paid leave to care for sick family members
2020-03-23,Fed surprises market with program to support corporate bonds amid coronavirus pandemic
2020-03-23,The Federal Reserve just pledged asset purchases with no limit to support markets
2020-03-23,"The US dollar will test 105 against a basket of currencies in the short term, analyst says"
2020-03-23,Amazon will deliver and pick up at-home test kits provided by new coronavirus program in Seattle
2020-03-23,El-Erian: 'Pockets of value' emerging in market but only for investors with high risk tolerance
2020-03-23,GOP Sen. Pat Toomey: New Fed action shows why the stalled coronavirus bill is 'so essential'
2020-03-23,Potential wave of mortgage delinquencies could bankrupt the payment system
2020-03-23,Senate coronavirus stimulus bill fails again
2020-03-23,"Coronavirus live updates: CVS to hire 50,000, Surgeon General issues ominous warning"
2020-03-23,Trump says businesses could reopen — soon — while fighting coronavirus
2020-03-23,Amazon gives part-time warehouse workers paid time off after a group of them fought for it
2020-03-23,Consumers could spend $20 billion less for gasoline this April as prices collapse in futures market
2020-03-23,Number of coronavirus cases within Defense Department doubles over the weekend
2020-03-23,"Coronavirus impact: Once pandemic ends, businesses may take 6 months to get up and running normally, says CFO survey"
2020-03-23,"Nordstrom suspends dividend, halts buybacks and taps credit in midst of coronavirus pandemic"
2020-03-23,Supreme Court hands win to Comcast in $20 billion racial discrimination suit
2020-03-23,CDC says coronavirus survived in Princess Cruise ship cabins for up to 17 days after passengers left
2020-03-23,3M CEO: 'Disappointing' to see N95 respirator masks at retail stores instead of hospitals
2020-03-23,"Trump administration isn't going far enough to help student loan borrowers, critics say"
2020-03-23,Japan stocks jump almost 4% as Fed ramps up stimulus measures
2020-03-23,Apple granted tariff exemption for Apple Watch
2020-03-23,"New York, New Jersey coronavirus 'attack rate' is 5 times higher than rest of US, top official says"
2020-03-23,"Coronavirus: Mayors, first responders urge Trump to help them get protective equipment 'now' to fight pandemic"
2020-03-23,"Coronavirus live updates: China says risk of local outbreak hasn't gone away, South Korea reports 9 deaths"
2020-03-23,"CVS Health looking to fill 50,000 jobs to meet demand"
2020-03-23,"Coronavirus pandemic is accelerating as cases eclipse 350,000, WHO says"
2020-03-23,"Stock market live updates: Dow down 900, Fed goes all-in, waiting on Congress"
2020-03-23,Uber CEO asks Trump to support gig workers impacted by the coronavirus
2020-03-23,Teladoc Health CEO: The health-care system is on the 'verge of a new era' for virtual care
2020-03-23,"'Get off your asses!' — Ken Langone blasts Washington, calls for passage of coronavirus relief"
2020-03-23,"This was the fastest 30% sell-off ever, exceeding the pace of declines during the Great Depression"
2020-03-23,CDC says coronavirus RNA found in Princess Cruise ship cabins up to 17 days after passengers left
2020-03-23,These banks are offering coronavirus financial aid
2020-03-23,"Dow rallies more than 1,700 points as Wall Street gets lift from stimulus hopes"
2020-03-23,Washington may protect your credit score if your number takes a hit during the coronavirus pandemic
2020-03-23,"SEC warns on coronavirus insider trading after stock sales by NYSE chair, his wife Sen. Loeffler, 3 other senators"
2020-03-23,Dow rallies more than 9% Wall Street gets lift from stimulus hopes
2020-03-23,Dow futures rise about 500 points as Senate haggles over virus bill
2020-03-23,Here's everything the federal government has done to limit the economic destruction of coronavirus
2020-03-23,Dow futures rise more than 300 points as Senate haggles over virus bill
2020-03-23,Joe Biden pushes Trump for worker protections in coronavirus bailout
2020-03-23,Dow briefly wipes out all the gains since Trump's election
2020-03-23,SoftBank strategy shifts from long-term domination to short-term survival as Vision Fund prepares for global downturn
2020-03-23,"Ventas withdraws 2020 guidance, declares quarterly dividend in face of coronavirus uncertainty"
2020-03-23,"If Congress doesn't act now on a coronavirus aid package, BTIG's Julian Emanuel sees stocks plunging another 20%"
2020-03-23,"Global coronavirus cases cross 350,000, death toll passes 15,000 as pandemic takes hold"
2020-03-23,"These stocks could benefit from the new, work-from-home normal, says Bank of America"
2020-03-23,Washington state Gov. Jay Inslee issues stay-at-home order amid the coronavirus outbreak
2020-03-23,"Democrats propose forgiving $30,000 in student debt for borrowers during coronavirus outbreak"
2020-03-23,"Market comeback gains steam as Dow soars 1,500 points on stimulus deal hope"
2020-03-23,No more votes expected Monday after Senate coronavirus stimulus bill fails again
2020-03-23,Japan stocks jump more than 4% as Fed ramps up stimulus measures; Softbank surges 18%
2020-03-23,Fashion retailer H&M weighs tens of thousands of job cuts because of coronavirus
2020-03-23,Blood donations needed during coronavirus pandemic
2020-03-23,"New York coronavirus cases surge 38% overnight to 20,875"
2020-03-23,"'Stay-at-home' executive order issued for Indiana, Virginia closes nonessential businesses"
