publish_date,headline
2020-04-09,"New York coronavirus daily death toll reaches third-straight record at 799, Gov. Cuomo says"
2020-04-09,LinkedIn offers to connect job-seekers with essential businesses for free
2020-04-09,Biden proposes lowering Medicare eligibility age to 60 and more student debt forgiveness as job losses soar
2020-04-09,"JPMorgan now sees economy contracting by 40% in second quarter, and unemployment reaching 20%"
2020-04-09,Jeff Bezos makes surprise visit to Amazon warehouse and Whole Foods store amid worker safety concerns
2020-04-09,"With Hollywood on hiatus, studios are bracing for fights with insurers over coronavirus losses"
2020-04-09,"Stock market live updates: Dow jumps 300, now up 13% on week, Fed's $2.3 trillion backstop"
2020-04-09,Op-ed: Don't ruin the Fed's great work by rushing economy back before it's safe
2020-04-09,Stocks in Asia mixed; major markets closed for Good Friday
2020-04-09,Prime Minister Boris Johnson released from intensive care
2020-04-09,About 30 million people lost these tax breaks when they filed last year
2020-04-09,"Don't fall for 'yield traps,' buy these 'secure' dividend stocks instead, Bank of America says"
2020-04-09,"Coronavirus live updates: China reports 42 new cases, 1 death"
2020-04-09,'Every part of the country' still at risk — ex-FDA chief urges US to stay united in coronavirus fight
2020-04-09,Palantir expects revenue to top $1 billion this year
2020-04-09,NYC first responders describe 'devastating' coronavirus cases as cardiac arrest calls surge
2020-04-09,Op-Ed: SBA chief pledges 'every available resource' to aid small businesses
2020-04-09,Department stores top list of consumer companies most likely to default on debt
2020-04-09,How much unemployment will I get? That depends on your state
2020-04-09,American Century launches first actively managed hidden-asset ETFs — here's what you need to know
2020-04-09,"Coronavirus live updates: NYC mayor warns tighter restrictions may be needed, Yelp starts layoffs, furloughs"
2020-04-09,'I feel better' — Cramer praises Fed's $2.3 trillion in loans to help businesses and governments
2020-04-09,Investor Peter Mallouk shows you how to leverage 0% interest rates to your advantage
2020-04-09,"Bill Gates: Schools will reopen in the fall, but economy won't magically return to the way it was"
2020-04-09,CVS and Walgreens are opening more drive-thru coronavirus testing sites. Here's what to expect if you go
2020-04-09,Oil jumps as much as 12% then cuts gains as traders await OPEC cut details
2020-04-09,"Fed fires an even bigger bazooka, expands its shopping list to include junk bonds"
2020-04-09,"Chamath Palihapitiya: US shouldn't bail out hedge funds, billionaires during coronavirus pandemic"
2020-04-09,"Crude oil gives up 12% gain, turns negative as traders await OPEC cut details"
2020-04-09,New York City mayor warns coronavirus restrictions might last until June: It's time to 'double down'
2020-04-09,Ex-Obama budget chief: Government's coronavirus assistance needs oversight to avoid backlash
2020-04-09,"Pfizer's lead coronavirus drug is showing promise, chief scientific officer says"
2020-04-09,What we've learned about how remote work is changing us
2020-04-09,"Ex-acting Navy secretary's trip to bash captain who pleaded for help with coronavirus may cost taxpayers $243,000"
2020-04-09,Senate adjourns until Monday after Democrats block McConnell's bid to add $250 billion in small business aid
2020-04-09,Nancy Pelosi says it's unclear when US economy can reopen — 'We could have a depression'
2020-04-09,Treasury Secretary Mnuchin says US could be open for business in May
2020-04-09,"Airlines should start hearing back about their bailout applications by Friday, Mnuchin says"
2020-04-09,"Pence bars top health experts Fauci and Birx from appearing on CNN, the network says"
2020-04-09,New York Gov. Andrew Cuomo says he's 'not that confident' in federal government's handling of coronavirus crisis
2020-04-09,OPEC and allies agree to historic 10 million barrel per day production cut
2020-04-09,Coronavirus live updates: NY bringing in more funeral directors after record deaths
2020-04-09,Frustration mounts on Main Street as entrepreneurs wait on banks and SBA for much-needed funding
2020-04-09,"Watch the full interview with Art Cashin on the market comeback, the Fed and the closed NYSE floor"
2020-04-09,"Coronavirus: Airlines should start hearing back about their bailout applications by Friday, Mnuchin says"
2020-04-09,"Federal Reserve makes an unprecedented move, stocks rally — Jim Cramer and others weigh in"
2020-04-09,Morgan Stanley CEO James Gorman has recovered from the coronavirus
2020-04-09,Cramer's week ahead: Washington is 'willing to spend big to keep this economy afloat'
2020-04-09,"Universal Studios extends park closures; US coronavirus cases top 452,000"
2020-04-09,"Markets rebounded big this week and analysts see more buying opportunities, including Starbucks and Raytheon"
2020-04-09,"Coronavirus pandemic will cause a 'much bigger wave' of protectionism, says trade expert"
2020-04-09,These are the three big things to focus on from OPEC and the G-20 meetings over the next 48 hours
2020-04-09,"Biologist Carl Bergstrom on coronavirus, misinformation and why we weren't prepared"
2020-04-09,What to watch today: Dow futures go positive after Fed details $2.3 trillion in loan programs
2020-04-09,Unemployed and eligible for Social Security? Here's what you need to know
2020-04-09,"Goldman lists stocks for if the worst is over, and stocks for if it's not"
2020-04-09,"Banks and health care companies will report earnings, but virus updates will matter most in week ahead"
2020-04-09,Wall Street firm dangled up to 175% returns to investors using US aid programs
2020-04-09,"Stock market live updates: Dow jumps 400, now up 13% on week, Fed's $2.3 trillion backstop"
2020-04-09,Air pollution drops 30% in Northeast US as coronavirus lockdown slows travel: NASA
2020-04-09,"Coronavirus could push half a billion more people into poverty globally, UN warns"
2020-04-09,"Coronavirus pushes auto dealers to embrace online sales like Tesla, Carvana"
2020-04-09,"Oil drops 9%, giving back early double-digit gain as traders await OPEC cut details"
2020-04-09,Here's what you need to know when it comes to paying for coronavirus treatment
2020-04-09,Microsoft won't release its Surface Neo dual-screen PC later this year
2020-04-09,McDonald's next move may depend on one fast-food rival's stock
2020-04-09,This map shows the states that suffered the biggest job losses last week due to coronavirus
2020-04-09,Op-Ed: Get ready for the recovery of the 1%
2020-04-09,Stocks in Japan and South Korea mostly higher; major markets closed for Good Friday
2020-04-09,Here's a look back at the historic 2020 Democratic primary race
2020-04-09,EU ministers seal deal on half a trillion euro coronavirus rescue plan
2020-04-09,Some of Britain's top tech firms are piling pressure on the government to save start-ups
2020-04-09,Google creates online unemployment application with state of New York
2020-04-09,US weekly jobless claims jump by 6.6 million and we've now lost 10% of workforce in three weeks
2020-04-09,"Walmart hires 100,000 to meet surging demand, as toilet paper and sewing machines fly off the shelves"
2020-04-09,New York City mayor warns that coronavirus restrictions may last until June: Time to 'double down'
2020-04-09,Foxconn says it has met hiring targets in Wisconsin. Now it wants its money
2020-04-09,Afraid to buy into this market? A key 2008 financial-crisis moment isn't reassuring
2020-04-09,Powell says the economic recovery can be 'robust' after the coronavirus is contained
2020-04-09,Cramer's lightning round: Calithera is a 'very good spec'
2020-04-09,Coronavirus live updates: New York bringing in more funeral directors after record deaths
2020-04-09,"Coronavirus live updates: Universal Studios extends park closures; US cases top 452,000"
2020-04-09,Cashin: Fed gives stocks a 'breath of fresh air' but full market recovery may take some time yet
2020-04-09,"Stocks making the biggest moves midday: Disney, Starbucks, Ford, American Airlines & more"
2020-04-09,"Doctors and nurses are signing up for the coronavirus fight in hotspots like New York, but many fear they'll be needed back home"
2020-04-09,"European stocks will outperform US in coronavirus recovery race, Barclays projects"
2020-04-09,Small caps haven't been this cheap compared to large stocks in nearly two decades — How to play it
2020-04-09,"Oil jumps 12% amid report Saudi Arabia and Russia have reached a deal, cut could reach 20 million barrels per day"
2020-04-09,"Stock market live Thursday: Among best weeks in history, Dow and S&P 500 jump 12%, thank the Fed"
2020-04-09,"Small caps enjoy best week ever, but chart analyst sees big trouble ahead"
2020-04-09,Federal Reserve unveils details of $2.3 trillion in programs to help support the economy
2020-04-09,OPEC and allies' historic oil cut hits snag as Mexico reportedly rejects deal
2020-04-09,Amazon says it could soon begin testing some warehouse workers for the coronavirus
2020-04-09,'This isn't forever but it is survival mode' — how to handle your loss of income during the coronavirus pandemic
2020-04-09,"With America at home, Facebook, Google make moves to win more of gaming market"
2020-04-09,Trump plans to launch second coronavirus task force focused on economy
2020-04-09,'He needs to earn our trust:' Progressive groups begin push for Biden to keep Wall Street out of the White House
2020-04-09,"Yelp lays off or furloughs more than 2,000 employees due to coronavirus"
2020-04-09,How the biggest companies in the world are preparing to bring back their workforce
2020-04-09,Stanford teamed up with Apple to release an app that connects first responders to drive-through COVID-19 tests
2020-04-09,Op-Ed: Don't ruin the Fed's great work by rushing economy back before it's safe
2020-04-09,Trump says airlines could receive grant details this weekend as sources say around 275 applied
2020-04-09,Coronavirus live updates: South Korea reports 27 new cases as infections slow
2020-04-09,How JPMorgan cut the ad-making process from months to days for its new spot
2020-04-09,Watch Chamath Palihapitiya warn about 'zombie companies' and oppose bailouts for billionaires
2020-04-09,Gone but not for good: Restaurants try to keep in touch with furloughed workers
2020-04-09,The 87-year-old doctor who invented the rubella vaccine now working to fight the coronavirus
2020-04-09,"Coronavirus live updates: NYC Mayor warns tighter coronavirus restrictions may be needed, Yelp starts layoffs, furloughs"
2020-04-09,"Start-up market is 'stratified' but it's 'the greatest time to start a company,' PayPal co-founder says"
2020-04-10,The IRS has a new website where you can get your stimulus relief check if you're not required to file taxes
2020-04-10,Wall Street analysts turned very bullish on these stocks during the pandemic market turmoil
2020-04-10,"LA County extends stay-at-home order, $30 billion in aid sent to hospitals"
2020-04-10,Here's how much you need to put in a 529 savings plan every month to send your kids to college debt-free
2020-04-10,"Coronavirus live updates: LA County extends stay-at-home order, $30 billion in aid sent to hospitals"
2020-04-10,"Goldman Sachs, the white-shoe investment bank, launches installment loan business with JetBlue"
2020-04-10,"Global coronavirus deaths surge past 100,000, doubling in nearly a week"
2020-04-10,A bear market rally or V-shaped bounce – one trader breaks it down
2020-04-10,Boeing considering 10% payroll cut after coronavirus pandemic shuts down plane manufacturing
2020-04-10,Treasury Department says larger airlines need to compensate taxpayers for coronavirus aid as talks drag on
2020-04-10,"Coronavirus live updates: NY sees negative net ICU admissions, HHS begins $30 billion in aid"
2020-04-10,"Americans will have a coronavirus antibody test 'very soon,' Pence says"
2020-04-10,"March US deficit shrinks, but virus budget storm seen in April"
2020-04-10,"Coronavirus live updates: Malaysia extends movement curbs, Mexico reports 403 new cases"
2020-04-10,"US coronavirus cases pass 500,000, Boris Johnson makes 'very good progress' in recovery"
2020-04-10,Trump administration pays out $26 billion in relief funds to hospitals Friday
2020-04-10,3M sues New Jersey company for alleged price gouging of masks to NYC officials
2020-04-10,Lawmakers urge Mnuchin to stop debt collectors from seizing direct payments
2020-04-10,Facebook spent $23.4 million in 2019 on Mark Zuckerberg's security and private air travel
2020-04-10,"Small business layoffs jump 1,000% in March"
2020-04-10,See religions around the world adapt in the age of coronavirus
2020-04-10,"As the coronavirus takes hold in Detroit, pandemic magnifies city's poverty, racial disparities"
2020-04-10,Tesla furloughs hit half of US sales and delivery employees
2020-04-10,Apple and Google team up to track spread of coronavirus using iPhone and Android apps
2020-04-10,"Confirmed coronavirus cases in the US pass 500,000, according to Johns Hopkins University"
2020-04-10,How China could use this moment to charge ahead with its geopolitical agenda
2020-04-10,"Italy PM extends virus lockdown, says euro zone rescue plan inadequate"
2020-04-10,Amazon sellers are finding new opportunity selling protective gear to hospitals as shortages rage
2020-04-10,Trump says US will 'help Mexico along' with its OPEC+ production cuts
2020-04-10,Paycheck Protection Program aid opens for sole proprietorships and independent contractors
2020-04-10,Warren and Harris introduce Senate bill to crack down on price gouging during the coronavirus pandemic
2020-04-10,Fiat Chrysler revives 'Groundhog Day' Super Bowl ad with Bill Murray for coronavirus videos
2020-04-10,The IRS is extending even more tax deadlines to July 15. Here's what you need to know
2020-04-10,How Instagram influencers are trying to slow the spread of coronavirus
2020-04-10,UK's exit strategy from coronavirus lockdown could see young adults released first
2020-04-10,Mexico throws OPEC's historic oil production cut into doubt ahead of G-20 meeting
2020-04-10,UK urges everyone to 'stay at home' after record daily spike in coronavirus death toll
2020-04-10,"Coronavirus live updates: Telemedicine surges, $30 billion in aid sent to hospitals"
2020-04-10,Consumer prices fall most in five years as gasoline plunges and travel costs decline at record pace
2020-04-10,US cities light up landmarks blue in support of health-care workers
2020-04-10,"'We will keep the roof over your head,' New York Mayor de Blasio says"
2020-04-10,"WHO sees 'welcome slowing' of coronavirus cases in hardest-hit countries, warns against lifting restrictions too soon"
2020-04-10,These investors are hanging on while they wait for better times
2020-04-10,When remote learning goes wrong: Zoom classes for preschoolers can be extra burdens on parents who just want refunds
2020-04-10,Warren introduces Senate bill to crack down on price gouging during the coronavirus pandemic
2020-04-10,Trump administration seeks ban on China Telecom in US citing 'unacceptable' national security risks
2020-04-10,"New US projections show summer coronavirus infection spike if restrictions are lifted, report says"
2020-04-10,"Trump says US will have 'substantially under' 100,000 deaths from coronavirus, lower than initial estimates"
2020-04-10,Advisors urge investors to avoid these mistakes with their 401(k) during coronavirus crisis
2020-04-10,Europe approves $590 billion in virus stimulus but fails to fix differences over joint debt
2020-04-10,"As coronavirus restrictions empty streets around the world, wildlife roam further into cities"
2020-04-10,"Coronavirus live updates: Italy extends lockdown into May, $30 billion in aid sent to hospitals"
2020-04-10,"Economists say US in short deep recession, but consumers expected to keep spending despite job losses"
2020-04-10,Fed's Quarles says Main Street lending program should be running in 2 or 3 weeks
2020-04-10,The IRS has a new website where you can get your stimulus relief check if you're not required to pay taxes
2020-04-10,New York posts negative net change in ICU admissions for first time since coronavirus outbreak
2020-04-10,"'We do hope this inspires others,' handbag CEO says about making masks for workers, consumers"
2020-04-10,Record oil production cut hangs in the balance as G20 meeting concludes with no specifics
2020-04-10,Trump says he's not going to reopen economy 'until we know this country is going to be healthy'
2020-04-10,Financial advisor groups want Congress to bring back this tax break
2020-04-10,iPhone to your door: Chinese firms test super-fast phone delivery as coronavirus caution remains
2020-04-10,New York state now has more coronavirus cases than any country outside the US
2020-04-10,"PayPal, Intuit QuickBooks approved to hand out emergency funds to small businesses in coronavirus program"
2020-04-10,In photos: Religion around the world in the age of coronavirus
2020-04-10,Google will guide users to virtual doctor's visits through Search and Maps
2020-04-10,Tesla furloughs hit half of U.S. sales and delivery employees
2020-04-11,"Coronavirus live updates: US death toll tops 20,000, Governors call for $500 billion more in aid"
2020-04-11,Airline cash grants offered by federal government could force carriers to take on more debt
2020-04-11,"New Jersey governor slashes all train, bus and light rail transit by 50%"
2020-04-11,The S&P 500 has rebounded 25% in less than three weeks. Here's what's going on
2020-04-11,"Thinking they won't qualify for aid, small businesses could miss out on millions in stimulus"
2020-04-11,Easter and Passover celebrated in a 'world turned upside down' as churches and synagogues close due to coronavirus pandemic
2020-04-11,Coronavirus: Colleges experiment with stay-at-home 'study abroad' programs
2020-04-11,"'The mutual fund industry is in trouble,' investor warns as hidden-asset ETFs hit the scene"
2020-04-11,Do you have questions about unemployment benefits? Here's what you need to know
2020-04-11,"Macy's taps Lazard to bolster finances as coronavirus saps sales, sources say"
2020-04-11,"These Social Security beneficiaries should file for stimulus checks immediately, government urges"
2020-04-11,How restaurants plan to survive widespread layoffs from the coronavirus pandemic
2020-04-11,Animal rescues are going to need more help than ever once coronavirus restrictions are lifted
2020-04-11,JPMorgan Chase to raise mortgage borrowing standards as economic outlook darkens
2020-04-11,Check your balance: Coronavirus stimulus money starts to flow into bank accounts
2020-04-11,"Coronavirus live updates: Italy to set up 'immunity passports,' outbreak swamps NYC 911 system"
2020-04-11,"US coronavirus death toll tops 20,000, Governors call for $500 billion more in aid"
2020-04-11,"NYC mayor announces public schools will remain closed rest of academic year, but governor pushes back"
2020-04-11,"Analysts say these are their best ideas during the pandemic, including McDonald's and Disney"
2020-04-11,Credit Suisse says use this market volatility to buy these 'GARP' names for the long term
2020-04-11,US coronavirus deaths highest in the world even as hospitalizations slow in New York epicenter
2020-04-11,States are bidding against each other and the federal government for important medical supplies — and it's driving up prices
2020-04-11,Every US state is now under a major disaster declaration amid coronavirus pandemic
2020-04-11,Coronavirus forces colleges to try study abroad staying at home
2020-04-11,Coronavirus live updates: India reports 909 new cases as states agree to extend lockdown
2020-04-11,'This will lead to airline bankruptcies' — flight attendant union furious with Treasury bailout offers
2020-04-11,"Coronavirus live updates: UK coronavirus death toll nears 10,000, Governors call for $500 billion more in aid"
2020-04-11,The Fed is on 'wartime' footing and still may be asked to do more
2020-04-11,"NBA players urge colleagues to get financially educated during work stoppage: 'Don't look at this as a timeout,' Chris Paul says"
2020-04-11,"UK's Boris Johnson is discharged from the hospital, Russia coronavirus cases spike"
2020-04-12,Dow futures slide more than 100 points as investors weigh coronavirus and oil outlook
2020-04-12,The failures and successes that have kept Nintendo relevant for 130 years
2020-04-12,UK Prime Minister Boris Johnson discharged from hospital
2020-04-12,Oil rises after OPEC and allies agree to historic production cut
2020-04-12,Fauci: Earlier social distancing measures 'obviously' would have saved more lives
2020-04-12,"All gassed up and nowhere to go: Gasoline prices are at multi-year lows, but no one is driving"
2020-04-12,"Coronavirus live updates: May 1 too soon to reopen, says a Johns Hopkins director, UK PM Johnson discharged"
2020-04-12,Goldman says beware stocks getting government assistance even though they may pop on the news
2020-04-12,OPEC and allies will hold an emergency virtual meeting Sunday night to finalize cut agreement
2020-04-12,"Fed's Neel Kashkari says coronavirus economic recovery 'could be a long, hard road'"
2020-04-12,Stocks in Asia trade lower; oil prices jump as OPEC and allies finalize record production cut
2020-04-12,"Coronavirus live updates: Nursing homes see surge in deaths, Italy daily death toll falls to lowest in weeks"
2020-04-12,"These deep-value screens found winners in 2009 and will work now too, UBS says"
2020-04-12,"Dow falls 300 points, but Netflix leads Nasdaq into the green"
2020-04-12,"Fauci expresses 'cautious optimism' coronavirus outbreak is slowing, US could start reopening in May"
2020-04-12,Dow futures slide more than 300 points as investors weigh coronavirus and oil outlook
2020-04-12,Oil prices are flat after OPEC and allies agree to historic production cut
2020-04-12,"State and local governments face budget crunch, hurting hopes for a quick economic recovery"
2020-04-12,OPEC and allies finalize record oil production cut after days of discussion
2020-04-12,Oil drops as supply concerns outweigh OPEC and allies' historic production cut
2020-04-12,Here's what advisors are doing to help clients — and themselves — amid coronavirus volatility
2020-04-12,"Coronavirus live updates: JHU director warns May 1 too soon to reopen, UK PM Johnson discharged"
2020-04-12,"Dow drops 300 points, Caterpillar slides 8%"
2020-04-12,"Disney World will furlough 43,000 union workers during coronavirus shutdown"
2020-04-12,Robert Shiller: Pandemic of fear could tip economy into a depression
2020-04-12,WHO envoy says coronavirus 'will stalk the human race for a long time to come'
2020-04-13,Dow jumps more than 300 points as corovavirus outlook improves
2020-04-13,"Netflix surges 7%, hits 52-week high as investors flock to stay-at-home stocks"
2020-04-13,Jim Cramer: 'I'm feeling more confident about the future'
2020-04-13,"Small businesses start to get rescue funds, but payouts overall are lagging"
2020-04-13,Walmart executive picked as eBay's new CEO
2020-04-13,"Dow rallies more than 500 points on improving virus outlook, Amazon jumps to all-time high"
2020-04-13,Seven saving habits for the coronavirus quarantine that should carry you for the rest of the year
2020-04-13,'Don't short America' — Ken Langone says coronavirus mitigation efforts are working
2020-04-13,"Apps collecting data to help stop the virus spread must limit sharing of information, cybersecurity expert says"
2020-04-13,"These risky stocks got a Fed lifeline and could be due for a 'big bounce,' Jefferies says"
2020-04-13,"Caterpillar stock is 'hands off' except for one reason, trader says"
2020-04-13,Dow jumps 500 points as corovavirus outlook improves
2020-04-13,Got a tax payment planned for April 15? You have just hours to reschedule it
2020-04-13,SoftBank blames 'deteriorating market environment' for projected $16.5 billion Vision Fund loss
2020-04-13,"Joe Biden defeats Bernie Sanders in Wisconsin Democratic primary, NBC News projects"
2020-04-13,Coronavirus live updates: Singapore records its biggest daily jump with 386 new cases
2020-04-13,"Stock market live Monday: Dow down 1%, Nasdaq green, Netflix surges"
2020-04-13,"Amazon to hire 75,000 more workers as demand rises due to coronavirus"
2020-04-13,New York Gov. Cuomo says 'I believe the worst is over if we continue to be smart' about coronavirus
2020-04-13,Asia stocks edge higher; China's yuan-denominated exports fall in March
2020-04-13,NY Gov. Cuomo says the 'ultimate resolution' of coronavirus will come with vaccine in 18 months
2020-04-13,Mnuchin flexes muscles on airline coronavirus aid — a taste of what other companies may face
2020-04-13,"Hotels and retailers not paying rent due to the coronavirus pandemic spikes in April, Trepp says"
2020-04-13,The largest oil output cut in history may still not be enough to prop up prices
2020-04-13,New York Gov. Cuomo: 'The worst is over if we continue to be smart' about coronavirus
2020-04-13,World Health Organization officials warn nations against easing coronavirus restrictions too early
2020-04-13,US Navy sailor from coronavirus-stricken aircraft carrier dies in Guam
2020-04-13,Here's Morgan Stanley's timeline for restarting the economy amid the coronavirus pandemic
2020-04-13,"Here's why it's suddenly much harder to get a mortgage, or even refinance"
2020-04-13,"Leon Cooperman says market is getting ahead of itself, earnings won't be normal for 2 years"
2020-04-13,"Stocks making the biggest moves after hours: Roku, AMC, Tesla and more"
2020-04-13,"Vox plans to announce around 100 employee furloughs later this week, hoping to avoid layoffs, sources say"
2020-04-13,"Coronavirus crippling film industry, US box office headed for worst year since 1998"
