publish_date,headline,description
2020-03-17,"Singapore, Taiwan and Hong Kong Face Second Wave of Coronavirus Cases",Returning travelers are bringing back new risks of infection 
2020-03-17,Behind Washington’s Stimulus Frenzy: the Prospect of Billions of Unpaid Bills,"Businesses and households have a similar and pressing problem: The money just isn’t coming in, but bills still have to get paid"
2020-03-17,Najafi and Trinity Broadcasting Offer to Acquire Tegna,"Bid values company at about $4.4 billion, adding to crowded field of suitors "
2020-03-17,SoftBank Backs Away From Part of Planned WeWork Bailout,Investor told office-sharing company it may not buy $3 billion of shares from existing investors as planned 
2020-03-17,"To Track Virus, Governments Weigh Surveillance Tools That Push Privacy Limits","Geolocation and facial-recognition systems can locate vectors of infections, but they also gather highly personal data "
2020-03-17,A Top Olympics Official in Japan Has Coronavirus,"Kozo Tashima, a member of the Olympic committee’s executive board, confirmed he had the virus after traveling to Europe and the U.S. "
2020-03-17,"As U.S. Tries to Slow Coronavirus Impact, Europe Hunkers Down","France’s 15-day lockdown takes effect as governments pledge billions to help companies, employees; global death toll surpasses 7,800"
2020-03-17,Trump Administration May Close U.S. Borders to Unauthorized Foreigners Over Coronavirus Risk,Asylum seekers would be immediately returned to Mexico under a plan that could take effect in as soon as two days 
2020-03-17,Marriott Begins Furloughing Tens of Thousands of Employees,Coronavirus outbreak has led to widespread travel cancellations and government-ordered travel restrictions
2020-03-17,Volkswagen Is Better Built for a Crash Than Most,"The world’s largest car maker has given investors an early read on how shutdowns could hit global industry, but it is better positioned than most   "
2020-03-17,Challenge for Policy Makers: Rescue Economy Without Fueling Populist Backlash,"Share buybacks raise eyebrows as government ponders rescues of airlines, other industries"
2020-03-17,What the Fed’s Credit Facility Means for CFOs Facing a Cash Crunch,"The central bank took action to help big companies, but questions remain about the health of main street businesses that many supply chains rely on"
2020-03-17,Government Personnel Chief Resigns After Six Months,Dale Cabaniss had served for more than 20 years as a senior staff member in the U.S. Senate
2020-03-17,Bronx School Gets Early Look at Remote Learning,Riverdale Country School offers a hint at what some students and teachers can expect
2020-03-17,"Amid Coronavirus, Managers Make Medical Calls About Who Can Work Where",Bosses are asking about people’s health and deciding whether they need to quarantine 
2020-03-17,"As Europe Hunkers Down, Governments Pledge Billions to Help Companies","France’s 15-day lockdown goes into effect, while global death toll hits 7,330"
2020-03-17,ESPN Unveils Plan for Dealing With Sports Shutdown,"The sports network is considering pushing up release of original content, airing zany sports and repackaging archived games "
2020-03-17,"Disney Looks to Sell TrueX, Ad-Tech Firm It Absorbed From Fox",TrueX is best known for offering interactive ads
2020-03-17,"Amid Coronavirus, It’s a St. Patrick’s Day Without Parades, Crowds or Green Beer","Irish celebrations, family traditions are canceled"
2020-03-17,Stocks Extend Gains In Choppy Trading,"Dow industrials, S&P 500 rise more than 4% in turbulent session following punishing selloff"
2020-03-17,"Iraq Taps New Candidate as Prime Minister, Testing Relations With Iran",Pro-Iranian factions denounced the designation of Adnan al-Zurfi as Iraq’s new prime minister 
2020-03-17,The Best Home Workout Machine? It’s Not a Treadmill,"Exercising exclusively at home? For efficient, full-body workouts, rowing machines beat treadmills or bikes, but they have a bad rep. These chic, techy upgrades aim to change that "
2020-03-17,"U.S. Suspends Visa Processing in Mexico, Threatening Businesses Reliant on Seasonal Workers",Disruption comes as farmers typically would be looking for foreign workers ahead of planting seasons
2020-03-17,Coronavirus Has Boomers Asking: Who Are You Calling Elderly?,"With older populations most at risk, baby boomers are dealing with the idea that maybe 60 isn’t the new 40 after all "
2020-03-17,Latest Hotspot for Coronavirus Hoarders: The Public Library,"Hearing of imminent closures, people rush to pick up books and DVDs; ‘this is what Black Friday must be like at Walmart’"
2020-03-17,Costco Buys Logistics Firm From Sears Owner for $1 Billion,"Deal for Innovel Solutions, a last-mile delivery company, is Costco’s largest since merger with Price Club in 1993"
2020-03-17,"Lessons From Italy’s Hospital Meltdown. ‘Every Day You Lose, the Contagion Gets Worse.’",The coronavirus is pushing a wealthy region with high-tech health care toward a humanitarian disaster
2020-03-17,Inside New York City’s Blitz to Create Online Classes for 1.1 Million Students,"Training for roughly 80,000 teachers began in preparation for internet-based lessons that are meant to start on March 23 "
2020-03-17,"Companies Mull Suspending, Ramping Up Share Buyback Plans Amid Coronavirus","Gap, DSV Panalpina and major banks said they would halt their repurchase programs"
2020-03-17,UAW Presses Auto Makers to Close U.S. Plants Amid Pandemic,Ford considers cutting shifts at some U.S. factories 
2020-03-17,Stocks Recover Ground in Volatile Trading,"Dow industrials, S&P 500 rise more than 3% in turbulent session following punishing selloff"
2020-03-17,The Vintage Datsun That Quietly Turned Trendy,"These 2000 models from 1968 were an afterthought for many car lovers—but he always loved them, and now his two-seater is en vogue"
2020-03-17,Iranians Defy Authorities in Bid to Access Holy Sites Closed Amid Coronavirus,President seeks to balance quarantine demands against opposition to limiting activity as some warn fatalities could reach millions
2020-03-17,Latest Hot Spot for Coronavirus Hoarders: The Public Library,"Hearing of imminent closures, people rush to pick up books and DVDs; ‘this is what Black Friday must be like at Walmart’"
2020-03-17,The Anxiety of Being Pregnant During the Coronavirus Pandemic,Scientists scramble to understand the effects; ‘I don’t want to put any stress on the baby’
2020-03-17,U.S. Blacklists New Islamic State Leader,The U.S. also blacklisted the minister of defense in Syrian President Bashar al-Assad’s government
2020-03-17,Fintechs Get Clearer Rules on Banking Licenses Under FDIC Plan,Proposal would impose new oversight on owners of industrial loan companies
2020-03-17,The Slip Dress: Lingerie or Wardrobe Staple?,"It’s back. As worn by Drew Barrymore and Kate Moss in the 1990s, the silky slip can be a louche, barely-there basic to be layered over tops and under blazers"
2020-03-17,UAW Presses Auto Makers to Close U.S. Plants Over Coronavirus Concerns,Ford considers cutting shifts at some U.S. factories 
2020-03-17,"Asbestos Warnings Grow With Penn State Lawsuit, National Push",Cleanup proposal in Pennsylvania and bill in Washington join efforts to curb and remedy use of material
2020-03-17,Government Is Broadening Investigations of Spoofing-Like Practices,JPMorgan is being probed for market manipulation of Treasury securities
2020-03-17,Democratic Primaries Go Forward as Voters Face Coronavirus,Polls suggest Joe Biden is poised to dominate the day’s voting
2020-03-17,Fox Corp. to Buy Streaming Service Tubi,Company strikes deal to acquire streaming service for as much as $490 million 
2020-03-17,What Are the Risks of Food and Grocery Deliveries?,"As the new coronavirus keeps people away from restaurants and grocery stores, more people are turning to deliveries. What precautions should you take?"
2020-03-17,"Coronavirus Pushes Factories to Stagger Shifts, Separate Workers","Manufacturers in the U.S. keep producing for now; ‘We have to be flexible, or we won’t survive’ "
2020-03-17,Tom Brady Gives New England the ‘Big Goodbye’,"On the eve of free agency, a stunning farewell from the most decorated quarterback in NFL history"
2020-03-17,HSBC Appoints Noel Quinn as Permanent CEO,Mr. Quinn has been interim CEO since late last summer
2020-03-17,"U.S. Military Prepares Hospital Ships for Deployment, to Open Its Labs",Defense secretary says labs would help test civilians for coronavirus; Pentagon also plans to distribute equipment
2020-03-17,"China Banishes U.S. Journalists from Wall Street Journal, New York Times and Washington Post",Beijing takes further measures against Voice of America and Time; Secretary of State Pompeo criticizes action
2020-03-17,The Travel Business and the Millions It Employs Confront All-Out Crisis,The coronavirus pandemic is shaping up to be the biggest test the modern travel industry has ever faced
2020-03-17,Kevin Durant Among Four Brooklyn Nets Positive for Coronavirus,"The Nets’ star, who said he is asymptomatic, is one of seven NBA players known to be infected with the virus"
2020-03-17,Coronavirus Fallout Reaches Some of the World’s Remotest Mines,"Outside of the stock market rout, the pandemic hasn’t had much effect on the biggest mining companies—until now "
2020-03-17,Trump Administration Seeks to Send Checks to Americans as Part of Stimulus Package,"Coronavirus-driven economic slowdown prompts $850 billion proposal, including effort to get money into consumers’ pockets"
2020-03-17,"Lessons from Italy’s Hospital Meltdown. ‘Every Day You Lose, the Contagion Gets Worse.’",The coronavirus is pushing a wealthy region with high-tech health care toward a humanitarian disaster
2020-03-17,New Normal Amid Coronavirus: Working From Home While Schooling the Kids,"Tapping grandparents, other backup babysitters isn’t always possible; the 4 a.m. shift "
2020-03-17,"Iraq taps New Candidate as Prime Minister, Testing Relations With Iran",Pro-Iranian factions denounced the designation of Adnan al-Zurfi as Iraq’s new prime minister 
2020-03-17,Dispute Over Justice Department’s Use of Overseas-Evidence Requests Grows,A former prosecutor goes public with his allegation that such requests are abused 
2020-03-17,A Bartender Was Set to Reopen a Storied Restaurant; Coronavirus Forced Him to Lay Off Entire Staff Instead,St. John Frizell and partners worked nonstop for a March 15  launch of Gage & Tollner in Brooklyn 
2020-03-17,Coronavirus Sends Travel Business and Millions It Employs Into All-Out Crisis,The pandemic is shaping up to be the biggest test the modern travel industry has ever faced
2020-03-17,U.S. Seeks to Send Checks to Americans as Part of Stimulus Package,"Coronavirus-driven economic slowdown prompts $1 trillion stimulus proposal, including effort to get money into consumers’ pockets"
2020-03-17,U.S. Postpones April 15 Tax Payments for 90 Days for Most Americans,"Coronavirus disruption prompts tax agency to extend deadline, waive interest and penalties "
2020-03-17,Biden Sweeps Tuesday’s Primaries as Voters Confront Coronavirus Fears,The vice president pads his lead over Bernie Sanders in convention delegates
2020-03-17,Primaries Go Forward as Voters Face Coronavirus,Polls suggest Joe Biden is poised to dominate the day’s voting
2020-03-17,"Coronavirus Upends Senior-Housing Business, Sending Shares Reeling","Any additional contagion in care facilities could 
		
			
		
	dissuade new residents from moving in, investors fear"
2020-03-17,Retail Spending Drop Shows Coronavirus Concerns Started to Take Hold Last Month,"February factory production was broadly flat, another sign the economy began to strain"
2020-03-18,How to Mix Drinks Like a Parisian,"We reached pastry chef-turned-cocktail maven David Lebovitz in his Paris apartment, where he paused, mid-stir, to share a few tips on mixing drinks and other tasks worth mastering"
2020-03-18,Pakistani Court Hears Appeal of Man Convicted of Killing Wall Street Journal Reporter,Omar Saeed Sheikh seeks to overturn 2002 conviction and death sentence in murder of Daniel Pearl
2020-03-18,IRS Details Tax-Payment Deadline Deferral to July 15 Due to Coronavirus,"Government to waive interest, penalties for 2019 filers, 2020 estimated taxes "
2020-03-18,Markets Enter New Phase—Where Cash Is All That Matters,Investors sold nearly everything they could Wednesday 
2020-03-18,Mexico Slow to Implement Strong Measures Against Coronavirus,"President cites impact on economy; other Latin American nations, with fewer cases, have taken tougher actions "
2020-03-18,"As Homeowners Wait Out Coronavirus, Some Rush to Refinance",Falling interest rates are causing a flurry of mortgage refinancing applications. What you should know to lock in these new rates
2020-03-18,Truckers Facing Coronavirus Hurdles in Keeping Supply Chains Moving,"Potential travel restrictions, controls at loading docks slow operations and raise alarms for freight haulers"
2020-03-18,The New Tax Deadline: Pay by July 15,Taxpayers who want to use the IRS’s deadline extension for payments still need to file something by April 15 
2020-03-18,"Apple Updates iPad, MacBook Air With New Keyboard",Tech giant drops price on MacBook Air by $100 as it abandons troublesome butterfly keyboard 
2020-03-18,"Senate Passes Paid-Leave Bill to Combat Pandemic, Turns to Administration’s Stimulus Plan","Government moves to address economic impact of coronavirus with support for workers, households"
2020-03-18,Top Colleges in the South for Student Outcomes,Duke University is No. 1 for the region in this category of the WSJ/THE College Rankings
2020-03-18,Detroit Car Makers to Temporarily Close U.S. Plants Over Virus Concerns,"Union leaders had pressed GM, Ford, Fiat Chrysler for shutdown, which will affect hundreds of thousands of workers"
2020-03-18,Still Traveling in the Middle of Coronavirus,"How life has changed for the people still flying—moments of odd quiet, and planes often so empty fliers can still practice social distancing"
2020-03-18,America Needed Coronavirus Tests. The Government Failed.,Decisions that limited testing for the pathogen blinded the U.S. to the outbreak’s scale. Here’s how it happened.
2020-03-18,The First Rule of Co-Working With Your Spouse: Don’t Yell Out for Toilet Paper,"Peloton machines, noise-canceling headphones, shared calendars and not-so-smooth jazz help couples stay sane while working together"
2020-03-18,New York City Had a Coronavirus Warning Sign: Spikes in ER Visits,"The visits increased daily beginning on March 1, and various factors could have contributed to the rise"
2020-03-18,"Fannie, Freddie Suspend Mortgage Foreclosures for 60 Days for Coronavirus Relief",The mortgage giants guarantee roughly half of the U.S. housing market 
2020-03-18,‘Ghost Town’ Seattle Shows How Coronavirus Shuts Down a City,"As downtown stores close, citizens debate whether and when to leave home; ‘I’m going to get my hair cut before they close for two months’"
2020-03-18,"Oil, Mining Companies Voice Opposition to Proposed Disclosure Rule",Some multinationals have joined anti-corruption advocates to call for regulatory alignment with regimes in Europe and Canada regarding disclosure of payments to foreign governments 
2020-03-18,America Travelers Are Trapped Abroad by Coronavirus Lockdowns,"As the virus spreads, Americans from Cambodia to Morocco, Chile to Spain are stuck far from home as governments seal borders to try to contain it"
2020-03-18,Plunging Rates Spell Opportunity for Student-Loan Borrowers,"What you should consider when it comes to student loans, the interest waiver and refinancing"
2020-03-18,The (Mostly) Unintended Consequences of Airline Bailouts,"Rescuing carriers is probably a necessary evil, but it will also cement everything investors dislike about European aviation "
2020-03-18,Pressure from Athletes to Delay Olympics Intensifies,"Though the IOC has repeatedly insisted that the Tokyo Games would go ahead as planned, the organization is now facing loud criticism from its own constituents"
2020-03-18,Co-Founder of AutoZone Enlivened a Dreary Branch of Retailing,Peter Formanek helped create brightly lighted stores and held down costs by staying in cheap motels 
2020-03-18,Skype Brilliantly in These Optimistically Hued Suits,Tailoring in unexpected colors including crimson and clover is increasingly popular in menswear circles—and just the thing to brighten up video-based conferencing
2020-03-18,"Russia Cements Ties With Crimea, Freezing Conflict With West","Six years after Russia seized Crimea from Ukraine, the peninsula is tightly bound to Moscow, which now covers almost 70% of the territory’s budget "
2020-03-18,American Travelers Are Trapped Abroad by Coronavirus Lockdowns,"As the virus spreads, Americans from Cambodia to Morocco, Chile to Spain are stuck far from home as governments seal borders to try to contain it"
2020-03-18,Pressure From Athletes to Delay Olympics Intensifies,"Though the IOC has repeatedly insisted that the Tokyo Games would go ahead as planned, the organization is now facing loud criticism from its own constituents"
2020-03-18,Purdue Bankruptcy Shield Extended to Sacklers Through October,"Some states had sought to resume lawsuits against the Sackler family despite bankruptcy negotiations surrounding its drugmaker, Purdue Pharma"
2020-03-18,"Call It a Layoff, a Furlough or a Cut Shift: Americans are Losing Work",Many employers are cutting staff or reducing hours; ‘It’s kind of a demoralizing thing’
2020-03-18,Senate Passes Bill to Combat Pandemic as Administration Proposes Direct Payments to Americans,"Government moves to address economic impact of coronavirus with support for workers, households"
2020-03-18,Square Gets Green Light to Open a Bank,Financial-tech company began its bid for a bank for 2½ years ago
2020-03-18,"As Coronavirus Empties Workplaces, Some Holdouts Have Wanted Employees to Show Up",Managers have argued risks are overstated as staff push for flexible work arrangements amid pandemic
2020-03-18,Cannes Lions Ad Festival Postponed to October,The ad industry’s biggest annual gathering gives up on June dates
2020-03-18,China’s Coronavirus Response Toughens State Control and Weakens the Private Market,"Communist Party leaders leaned hard on state-owned enterprises to fight the virus, hastening a retreat from a market-oriented economy"
2020-03-18,Intel to Release Neuromorphic-Computing System,"Pohoiki Springs, an experimental system to be rolled out this month, mimics the way human brains work to do computations faster with less energy"
2020-03-18,Quake Rocks Utah During Coronavirus Lockdown,"Airport shut down, Mormon temple damaged, but no serious injuries reported "
2020-03-18,New York Performers Improvise as Coronavirus Keeps Crowds Away,Some artists are turning to online platforms to share their work—in many cases at no cost
2020-03-18,Bernie Sanders Weighs Future After Losses to Joe Biden,Campaign manager says Vermont senator ‘is going to be having conversations with supporters to assess his campaign’ after Tuesday’s primaries
2020-03-18,Boards Begin Planning for Long-Term Fallout From Coronavirus Pandemic,"Thirteen percent of directors say their companies have delayed planned investments for 2020, according to the National Association of Corporate Directors"
2020-03-18,"No Lucky Charms, Plenty of Okra—What’s Left at the Grocery Store","Coronavirus preppers urgently stock up at the supermarket, leaving shelves bare, except for all those pork rinds"
2020-03-18,"Apple Updates iPad, MacBook Air with New Keyboard",Tech giant drops price on MacBook Air by $100 as it abandons troublesome butterfly keyboard 
2020-03-18,How Washington Failed to Build a Robust Coronavirus Testing System,Government decisions that limited testing for the pathogen blinded the U.S. to the outbreak’s scale. Here’s how it happened.
2020-03-18,"Staff at Kirkland Facility With Coronavirus Outbreak Spread It to Other Facilities, Study Finds",Poor procedures fueled the explosive outbreak of the new coronavirus at nine Seattle-area nursing homes 
2020-03-18,"For These Former Athletes, Real Estate Is a Whole New Ballgame",A professional golfer and a major league baseball player discuss their foray into selling property
2020-03-18,Starbucks Seeks to Reassure Investors,Workers press company to close stores as coronavirus pandemic spreads 
2020-03-18,Sports Leagues Offer Free Streaming of Older Games Amid Coronavirus Shutdown,The NFL and the NBA have removed paywalls for their own subscription services 
2020-03-18,Yo-Ho-Ho and a Bottle of Electrolytes: Is Tom Brady on the Verge of Becoming a Buccaneer?,"Not long after a legend leaves New England, a Florida destination emerges"
2020-03-19,"Schools Closed for Coronavirus, Online Work Won’t Count","Because administrators can’t guarantee all students will have access, some schools call online work ‘enrichment,’ not part of curriculum"
2020-03-19,Olive Garden’s Owner Reports Sales Plunge as Coronavirus Spreads,Casual-dining chains are particularly vulnerable to widespread restaurant closures 
2020-03-19,Swedbank Fined $397 Million Over Anti-Money Laundering Measures,Swedish lender’s Baltic operations have been under investigation for more than a year 
2020-03-19,Commentary: It’s Not Premature to Set Supply Chains for a Coronavirus Recovery,Companies shifting into survival mode should think now about how to build the healthiest business outcome
2020-03-19,"Hit by Coronavirus Slowdown, Hotels Try Catering to the Quarantined",Hospitality companies are adopting the risky strategy as occupancy rates plummet
2020-03-19,Consumers Face a Massive Credit Crunch. Lenders Are Still Figuring Out What to Do.,Out-of-work customers could miss loan payments and suffer plunging credit scores; lenders and credit-reporting firms are being asked to help
2020-03-19,Why Books Are Comforting in the Era of Coronavirus,"As Americans’ homes become inescapable refuges, are piles of real books soothing or just clutter? Our design columnist confronts her love-hate relationship with printed matter "
2020-03-19,Tesla to Suspend U.S. Car Production Over Coronavirus,Move follows days of confusion over whether electric-car maker’s factory should remain open after officials ordered activity curtailed
2020-03-19,Siemens CEO Joe Kaeser to Leave by Next Year,Current Deputy CEO Roland Busch to take over as chief by February 2021 at latest
2020-03-19,Shutting Markets Isn’t the Solution to What’s Wrong,It’s true that markets are failing in some of their most important roles—but they should stay open
2020-03-19,Why Dr. Anthony Fauci Runs,"The most influential man in American public health is a 79-year-old former marathoner who jogs and power walks as much as possible. ‘There was almost nothing that could stop us,’ his running partner says."
2020-03-19,"Ford Nixes Dividend, Suspends Guidance",Car maker to shore up balance sheet by drawing on credit lines as coronavirus pandemic spreads
2020-03-19,Our Favorite Sources for Ordering Meat Online,"Plenty of online butchers advertise top-quality cuts of meat, delivered direct to your door. But which of these outfits can you really trust—or afford?"
2020-03-19,U.S. Keeps Processing Seasonal Worker Visas After Warning From Farmers,Shift is an exception to State Department decision triggered by coronavirus
2020-03-19,"Fed Ramps Up Bond Buying, Indicating Much Larger Purchases Are Likely",The central bank will buy this week more than half of the $500 billion in government debt purchases announced Sunday
2020-03-19,U.K. Regulator Calls on Insurers to Be Flexible Amid Coronavirus Pandemic,Financial Conduct Authority says firms should ensure that global circumstances don’t affect customers’ current home or motor policies 
2020-03-19,Oil Posts Biggest One-Day Percentage Gain on Record,U.S. crude jumps 24% after Energy Department asks to buy up to 30 million barrels for strategic reserve 
2020-03-19,What Price Collapse? U.S. Producers Keep Pumping.,"U.S. crude output hits 13.1 million barrels a day, matching record set in February"
2020-03-19,"India Executes Four Men Over 2012 Delhi Gang Rape, Murder",Attack on the 23-year-old student on a moving bus is one of India’s most high-profile crimes against women 
2020-03-19,"In London, A 340-Year-Old Mansion With a Colorful History Asks $60.7 Million",
2020-03-19,War on Plastic Takes a Back Seat in Coronavirus Crisis,"The impact of a temporary return to disposable plastic cups and bags could be lasting, environmentalists fear"
2020-03-19,Saints Head Coach Sean Payton Tests Positive for Coronavirus,The 56-year-old Payton is the first known case inside the NFL
2020-03-19,The Next Coronavirus Financial Crisis: Record Piles of Risky Corporate Debt,"A fast-growing market in junk-rated leveraged loans is showing severe strains, a sign of a looming credit crunch that could stifle future economic growth   "
2020-03-19,Nearly Two Dozen MTA Workers Test Positive for Coronavirus,"Most cases didn’t display symptoms while at work and were a low risk to riders, agency says"
2020-03-19,The Job Shock Begins,Measures to combat the spread of the new coronavirus are already taking a heavy toll on the job market 
2020-03-19,Biden-Sanders Relationship to Guide Next Phase in Democratic Race,The two candidates and their aides generally get along 
2020-03-19,"Aussie Dollar at 55 Cents, Stocks Plunge in Korea: The World’s Desperate for Dollars",Investors are dumping assets and paying dearly to swap local currencies into U.S. dollars
2020-03-19,Coronavirus Hits State and City Budgets,Local officials say they don’t know how deep the hole might get; a double punch of higher spending and falling revenue
