publish_date,headline,description
2020-03-01,Bloomberg’s Billions,Michael Bloomberg’s spending on politics and charity is a proxy for his beliefs
2020-03-01,Democrats Race to Super Tuesday States With Time Running Short,Candidates seek to capitalize on exits of Pete Buttigieg and Tom Steyer after South Carolina’s Democratic primary 
2020-03-02,"Global Growth to Slow Sharply as Coronavirus Takes Heavy Toll, Says OECD","Global output is expected to fall during the first three months of this year, putting the economy at risk of recession "
2020-03-02,Nokia’s New Boss Must Learn to Fight Huawei,"The Finnish telecom-gear maker is shaking up its leadership, having admitted it needs to invest more in 5G technology   "
2020-03-02,Supreme Court Will Hear First Major Abortion Case Since Two Trump Appointees Joined,Case will test new conservative makeup’s approach to precedent 
2020-03-02,Turkey’s Syria Border Becomes Ground Zero for Geopolitical Crisis,The largest exodus in Syria’s nine years of conflict has overwhelmed the ability of aid workers to respond—and military tensions threaten to spiral out of control.
2020-03-02,Trump to Meet With GOP Lawmakers Amid Fight Over Curtailing U.S. Spying Powers,"Privacy hawks Rand Paul and Mike Lee to attend meeting, as well as Attorney General William Barr "
2020-03-02,Super Tuesday to Test Whether Bloomberg’s Ad Presence Pays Off,Former New York City mayor has run the most television ads in Super Tuesday states   
2020-03-02,ViacomCBS’s Pluto TV Boosts Marketing as Free Streaming Services Intensify Fight,"As the subscription streaming wars heat up, free TV services are also looking to lure viewers "
2020-03-02,"Biden vs. Sanders? Yes, But What About Chuck D vs. Flavor Flav.",
2020-03-02,CIOs Act as Companies’ Glue During Coronavirus Disruptions,IT leaders are playing a role in crafting contingency plans in addition to making sure technology is running smoothly
2020-03-02,"Sports Service DAZN, Streaming Rival to ESPN, Plots Global Expansion",Company known for its boxing content is expanding its sports rights and plans to launch in over 200 markets
2020-03-02,Saudis Renew Push for Output Cuts as Coronavirus Weakens Oil Business,"Outbreak is fueling Saudi Arabia’s push for supply cuts, hurting the oil industry’s profits and leading to project delays "
2020-03-02,Election-Weary Israelis Vote for Third Time to Try to Break Deadlock,Israel is voting for the third time in under a year after previous attempts have failed to return a government 
2020-03-02,Dow Industrials Rally 5.1% on Central-Bank Stimulus Hopes,"Blue-chip index adds nearly 1,300 points in record point move as investors bet on lower interest rates"
2020-03-02,Barclays Shareholder Calls for CEO to Leave Over Epstein Links,Sherborne Investors said the bank’s board should reverse its decision to recommend Jes Staley for re-election
2020-03-02,"In ‘ZeroZeroZero,’ A Gritty and Global View on the Drug Trade",The eight-part Amazon series is the latest to dig into international crime
2020-03-02,Tom Brady and the Wildest NFL Off-Season Ever,Brady has been with the New England Patriots for two decades. Now he could be on the move in an off-season that could see an unprecedented game of quarterback musical chairs.
2020-03-02,"Nicaraguan Priest, Poet and Revolutionary, Dies","Ernesto Cardenal, born into a wealthy family, allied with leftist Sandinista revolutionaries and clashed with the Vatican before breaking with President Ortega"
2020-03-02,Lyft and Uber Start Spending to Unseat California Legislators,Lyft puts $2 million behind push to defeat assemblyman; ‘They’re trying to send a message to all legislators’
2020-03-02,Colombia Upholds Abortion Laws as Legalization Battle Shifts to Argentina,Both countries have become the focus of activists working to loosen Latin America’s strict laws against the procedure
2020-03-02,Sarah Jessica Parker and Matthew Broderick Unite on Broadway,"In a conversation with their ‘Plaza Suite’ director, John Benjamin Hickey, the pair reflect on theater, marriage and gratitude: “I’m not bitter about what I have been given. But people are always wanting me to say how burdened I feel by Carrie Bradshaw, which couldn’t be further from the truth.”"
2020-03-02,A Day in the Life of Kanye West’s Set Designer,"David Korins, who also designed the sets for ‘Hamilton,’ on redesigning New York City institution the Drama Book Shop"
2020-03-02,Greek Soldiers Called In to Block Migrant Crossings at Turkish Border,EU officials back Athens’ strict border control measures in test of bloc’s eastern borders 
2020-03-02,Tim Cook and Apple Bet Everything on China. Then Coronavirus Hit.,"Quarantines, tariffs and slumping sales have caused agitation about the company’s strategy of assembling most of its products there"
2020-03-02,Novartis Unit to Pay $195 Million in Generic Drug-Price Fixing Case,"Sandoz admitted it was guilty of participating in several conspiracies to rig bids, fix prices"
2020-03-02,Nokia CEO Rajeev Suri Is Stepping Down at Telecom-Equipment Maker,Finnish company has been struggling to take advantage of a global shift to 5G mobile networks
2020-03-02,Are You Lonely? You’re Not Alone,"A new book from former U.S. Surgeon General Vivek Murthy explains why many Americans feel lonely, and what we can do about it "
2020-03-02,Canceled Games and Empty Stadiums: Will the Coronavirus Spread to Sports?,An industry built on live entertainment and big crowds wonders what happens if people have to stay at home
2020-03-02,"Chris Matthews to Leave MSNBC Amid Controversy, Sanders Remarks","Cable channel’s decision to release 74-year-old anchor from contract was mutual, according to source"
2020-03-02,U.S. Orders Cap on Chinese State Media Personnel,State Department to force reduction to 100 employees from 160
2020-03-02,Two Chinese Nationals Indicted in Alleged North Korean Bitcoin Hack,U.S. says the men helped launder some of $250 million in stolen bitcoin and other virtual currencies 
2020-03-02,Coronavirus Spreading Faster Outside China Than Within,"Global death toll surpasses 3,000, as new cases jump in Italy, Iran and South Korea "
2020-03-02,"Jack Welch, Legendary CEO of General Electric, Dies at Age 84","GE executive led conglomerate with hard-nosed tactics for 20 years, then saw it dismantled"
2020-03-02,Xerox Moves to Buy All of HP’s Shares in Public Takeover Bid,HP has resisted the deal while saying it is open to a combination on different terms 
2020-03-02,Point72’s Head Quant Is Leaving the Firm,Ross Garon to step down from post at Cubist Systematic Strategies unit
2020-03-02,WeWork Names Former Baker Hughes Executive as CFO,Kimberly Ross will oversee the finances of the office-sharing startup as it struggles to become profitable
2020-03-02,"Dow Industrials, S&P 500 Move Higher on Stimulus Hopes",The Bank of Japan joins the U.S. Federal Reserve in pledging to take action if needed.
2020-03-02,U.S. Coronavirus Death Toll Climbs to Six as Virus Spreads World-Wide,Four new deaths linked to the coronavirus have been reported in Washington state
2020-03-02,Novartis Unit to Pay $195 Million in Generic-Drug Price-Fixing Case,"Sandoz admitted it was guilty of participating in several conspiracies to rig bids, fix prices"
2020-03-02,Bolo Ties: How Western Neckwear Staged a Comeback,"Fueled by a revived interest in westernwear, the bolo tie is popular again, popping up on celebs like Post Malone and Lil Nas X and at fashion brands like Prada"
2020-03-02,North Korea Fires Two Apparent Missiles in Its First Test This Year,Pyongyang launched two missiles into the waters between South Korea and Japan
2020-03-02,AT&T Adds Another TV Option to Lure Cord-Cutters,"Internet-based AT&T TV closely resembles DirecTV service, but sidesteps the satellite dish"
2020-03-02,The Gyms That Want You to Leave ASAP,A new group of fitness clubs based around the idea of biohacking say their short workouts provide the strength benefits of traditional weights in a fraction of the time
2020-03-02,White House Drops Nominee Who Questioned Ukraine Aid Suspension,Nominee had warned that withholding aid could violate law
2020-03-02,Grammy Organization Fires CEO,Recording Academy ousts Deborah Dugan amid conflicting harassment claims 
2020-03-02,Collision of Two White Dwarf Stars Offers Clues About Rare Cosmic Events,Resulting massive star is one of only a handful of merged white dwarfs to be identified so far
2020-03-02,‘Heavy Light’ by U.S. Girls Review: An Ideal Introduction to Genre Experimentation,Forcefully expressive music gleefully draws from across rock and pop history to create sometimes-surreal juxtapositions. 
2020-03-02,Coronavirus Hits Once-Isolated U.S. Natural Gas Market,"Epidemic deals latest blow to domestic producers, exposing global links developed since start of shale boom"
2020-03-02,Coronavirus Heaps Misery on Europe’s Ailing Banks,Shares of European lenders are pummeled again following steep declines last week   
2020-03-02,Amtrak Hires Atlas Air CEO William Flynn to Run National Passenger Railroad,New boss is Amtrak’s third straight CEO from private sector amid a multi-year turnaround
2020-03-02,Dow Industrials Rally 5% on Central-Bank Stimulus Hopes,"Blue-chip index adds nearly 1,300 points in record point move as investors bet on lower interest rates"
2020-03-02,Inventive Percussion Without a Drum in Sight,"At a recent concert, the quartet Sō Percussion played glasses of water, blocks of wood, colored tape and more. "
2020-03-02,Are You Lonely? You’re Not Alone.,"A new book from former U.S. Surgeon General Vivek Murthy explains why many Americans feel lonely, and what we can do about it "
2020-03-02,Meat Stockpiles Surge as Coronavirus Epidemic Curbs Exports,"Chicken, pork and beef stack up in cold storage across the U.S. "
2020-03-02,U.S. Coronavirus Cases Climb as Virus Spreads Worldwide,"Global death toll surpasses 3,000, as new cases jump in Italy, Iran and South Korea, also rise in U.S. "
2020-03-02,Israel Election Exit Polls Put Netanyahu Ahead of Challenger,Prime minister appears to have edge over rival Benny Gantz to form government after a prolonged deadlock
2020-03-02,"Dow Industrials, S&P 500 Climb on Stimulus Hopes",U.S. indexes rise more than 2% as Bank of Japan joins Fed in pledging to take action if needed.
2020-03-02,Herbalife Sets Aside $40 Million for Bribery Settlement,The Los Angeles multilevel-marketing company is looking to resolve investigations by the Justice Department and the SEC 
2020-03-02,Biden and Sanders Offer a Choice: Unite or Fight?,Vermont senator talks of waging a pitched battle against the status quo. Former VP proposes a return to normalcy that prevailed before Trump.
2020-03-02,Moderate Democrats Consolidate Around Biden Ahead of Super Tuesday,Biden and Bloomberg both pitch themselves as the candidate capable of stopping front-runner Bernie Sanders
2020-03-02,Amy Klobuchar Ends Democratic Presidential Campaign,The Minnesota senator will endorse former Vice President Joe Biden
2020-03-02,Supreme Court to Review Affordable Care Act Next Term,Justices to weigh lower-court ruling that tossed out ACA’s individual insurance mandate
2020-03-02,"Puerto Rico Utility Deal Stumbles, Shaking Muni Investors",Municipal bondholders turned bullish on Puerto Rico’s troubled utility just as elected officials vetoed a politically unpopular repayment plan 
2020-03-02,Supreme Court Weighs Government’s Power to Rapidly Deport Asylum Seekers,Two cases pit authorities’ campaign to curb immigration against guarantees of due process 
2020-03-02,Pentagon Likely to Get First African-American Senior Leader Since Powell,White House is expected to name Gen. Charles Brown chief of staff of Air Force 
2020-03-03,Democrats Head to Polls in 14 States on Super Tuesday,"Bernie Sanders, the front-runner in the presidential primaries so far, seeks to fend off a resurgent Joe Biden"
2020-03-03,Investigators of USA Gymnastics Explore ‘Agent’ Claims,Families of gymnasts Simone Biles and Jordyn Wieber have been asked about the former head of the organization 
2020-03-03,Tornadoes Kill at Least 19 in Tennessee,"‘Nashville is hurting’ as twisters tear through area, causing widespread damage"
2020-03-03,U.S. Ports Likely to See Slump in Cargo Volume From Coronavirus,"Containership operators have canceled nearly 60 trans-Pacific sailings to the ports of Los Angeles and Long Beach, Calif., in the first quarter"
2020-03-03,"Most People Forgot This Car, But He Never Did",
2020-03-03,"Fidelity Reports Record Operating Profit, Revenue",Financial firm’s assets under management finished 2019 at $3.2 trillion 
2020-03-03,Insulin Giant Aims to Unlock Elusive Obesity-Drug Market,"Novo Nordisk sees a multibillion-dollar opportunity despite skepticism from doctors, patients, insurance companies "
2020-03-03,The Six Best-Designed Items of March,"Our design- and fashion-minded editors on the most compelling happenings, items and events of the month"
2020-03-03,Stocks Extend Drop Despite Surprise Fed Rate Cut,"Dow industrials drop 900 points in volatile trading, Treasury yields fall after Federal Reserve move"
2020-03-03,Tornadoes Kill at Least 22 in Tennessee,"‘Nashville is hurting’ after twisters tear through area, causing widespread damage"
2020-03-03,Bedding Brand Brooklinen Raises $50 Million from Summit Partners,"Startup says it will use cash to accelerate investments in retail, other areas"
2020-03-03,Federal Reserve Cuts Rates by Half Percentage Point to Combat Virus Fear,Central bank lowers federal-funds rate range to 1% to 1.25% in its first between-meeting move since the financial crisis
2020-03-03,Stocks Fall Sharply Despite Surprise Fed Rate Cut,Dow closes nearly 800 points lower; Treasury yields drop again despite Federal Reserve move
2020-03-03,Saudi Fund Hires Former McKinsey Consultant to Help Run Strategy,Jerry Todd’s recruitment comes as some officials question the roughly $300 billion sovereign-wealth fund’s strategy
2020-03-03,Bedding Brand Brooklinen Raises $50 Million From Summit Partners,"Startup says it will use cash to accelerate investments in retail, other areas"
2020-03-03,Ice-Fishing Resorts Are on Thin Ice. ‘How Else Do You Make it Through a Minnesota Winter?’,
2020-03-03,Honeywell to Roll Out Quantum Computer,JPMorgan has signed up as first public user for what Honeywell says will be world’s most powerful quantum machine
2020-03-03,Companies Find Ways to Keep Their Annual Reports From Being a Bore,"Videos, graphics and other elements can provide information in ways that engage and go beyond what regulators request"
2020-03-03,A High School Crush Inspired Larry Poons’s First Work of Art,
2020-03-03,China Calls U.S. Restrictions on News Agencies ‘Political Oppression’,Move signals possible escalation of tensions between the two countries over working conditions for journalists
2020-03-03,On Thin Ice: Too Much Slush Makes Ice Fishing a Risky Business,
2020-03-03,SoftBank Moves Into Chinese Real Estate,Tech investor put $1 billion each into Beijing apartment-rental firm and online real-estate portal shortly before coronavirus outbreak
2020-03-03,Publisher Delays John Bolton’s Book Amid Government Review,Simon & Schuster shifts release date to May 12 from March 17 
2020-03-03,CEO of Saks Parent to Step Down,Helena Foulkes sold businesses and helped pave the way for Hudson’s Bay to go private 
2020-03-03,Canadian National Railway Aims to Sharply Cut Freight Backlog This Week,CEO of Canada's largest railroad says supply-chain network may not return to normal until April after last month’s blockades
2020-03-03,Netanyahu Holds Lead in Israeli Election but Could Miss Out on a Majority,Another deadlock would prolong nearly a year of political paralysis in Israel
2020-03-03,Ice-Fishing Resorts Are on Thin Ice. ‘How Else Do You Make It Through a Minnesota Winter?’,
2020-03-03,The Terror of Teen Drivers: Parents Track Their Kids Without Being in the Car,"Apps allow parents and insurers to track teen drivers, though sometimes it backfires "
2020-03-03,"U.S. Offers Aid, not Missiles, as Turkey Pushes Back Syrian Forces",Washington seeks to reassure ally; Ankara requested Patriot missiles and other American weaponry 
2020-03-03,Comedian Roy Wood Jr. on Flying With His Young Son,What children—and airplane snacks—can teach us about traveling
2020-03-03,U.S. Coronavirus Cases Rise; First Death Earlier Than Officials Realized,"New cases reported in New York, Georgia and North Carolina as nationwide patient tally tops 100"
2020-03-03,Why People Are Sharing Their Family Secrets With Strangers in Public,
2020-03-03,U.S. Coronavirus Cases Rise; First Deaths Earlier Than Officials Realized,"New cases reported in New York, Arizona, Georgia and North Carolina as nationwide patient tally tops 100"
2020-03-03,Lawmakers Push Again for Info on Google Collecting Patient Data,"Sens. Blumenthal, Cassidy and Warren say questions remain unanswered on the tech giant’s health-care project known as ‘Project Nightingale’"
2020-03-03,Federal Reserve Cuts Interest Rates by Half Percentage Point,Central bank lowers federal-funds rate range to 1% to 1.25%
2020-03-03,Supreme Court Gives States Greater Rights to Prosecute Undocumented Immigrants,"Justices split over the case, which concerns identity theft by undocumented immigrants who provide false Social Security numbers on job applications"
2020-03-03,Trump Campaign Files Libel Suit Against Washington Post,"Suit follows similar legal action against New York Times, both related to articles referencing the campaign’s interactions with Russia "
2020-03-03,Tokyo Olympics Could Be Delayed; Officials Want Starting Gun Fired on Time,"‘We are doing all we can to ensure that the Games go ahead as planned,’ Seiko Hashimoto says "
2020-03-03,Maine Voters Keep Tightened Vaccine Requirements,Ballot measure fails to overturn new immunization law 
2020-03-03,U.S. Weighs Paying Hospitals for Treating Uninsured Coronavirus Patients,Trump administration may use disaster recovery reimbursement program that would pay providers 110% of Medicare for treating patients 
2020-03-03,Newell Brands Is Investigated by SEC,"Consumer-products company says probe focuses on sales, accounting practices "
2020-03-03,Stocks Swing Sharply After Surprise Fed Rate Cut,"Dow industrials, S&P 500 reverse part of quick rally after Federal Reserve rate move"
2020-03-03,Plant-Based Meat Makers Compete on Price,Impossible Foods cuts wholesale prices by 15% on average
2020-03-03,Netanyahu Holds Lead in Israeli Election but Lacks a Majority,Another deadlock would prolong nearly a year of political paralysis in Israel
2020-03-03,Trump Becomes First U.S. President to Speak With Senior Taliban Leader,An Afghan peace process faces many hurdles—including the resumption of Taliban attacks against Afghan forces this week 
2020-03-03,Vatican Tries to Tamp Down Questions on Pope’s Health,A spokesman said Pope Francis has a cold ‘without symptoms attributable to other pathologies’
2020-03-03,Retailers Confront Coronavirus Uncertainty,"Target, Kohl’s are upbeat about 2020 sales outlook despite fears surrounding epidemic"
2020-03-03,Erik Nordstrom Named Sole CEO of Nordstrom,"Appointment ends an unusual structure, but keeps control with the family "
2020-03-03,"Iran’s Stockpile of Enriched Uranium Has Jumped, U.N. Atomic Agency Says",Experts and diplomats warn that Tehran has slashed the time it would need to amass enough fuel for a nuclear weapon
2020-03-03,Lawmakers Push Again for Info on Google’s ‘Project Nightingale’,"Sens. Blumenthal, Cassidy and Warren say many questions remain unanswered on tech giant’s access to patient records"
2020-03-03,"For Growing Numbers of Struggling U.S. Cities, the Downturn Has Arrived",
2020-03-03,The Best Thing That’s Ever Happened to Roasted Sweet Potatoes,We all need some comfort right now—perhaps some outright indulgence. This recipe delivers both
2020-03-03,Streamer Quibi Raises Additional Funds Ahead of Launch,Latest $350 million in financing brings total raised to $1.75 billion
2020-03-03,Is It Time to Refinance Your Mortgage?,Fears about coronavirus may give homeowners an opportunity to lower their monthly bill 
2020-03-03,Coronavirus Slams U.S. Hotel Industry’s Global Operations,"Biggest brands like Marriott, Hyatt report declines in Asia businesses; Hilton says outbreak could hurt full-year earnings"
2020-03-03,Cloudflare Taps Its First CIO,"Juan Rodriguez, hired from Sage Group, is working on integrating data to help with planning and budgeting"
2020-03-03,Tornadoes Kill at Least 25 in Tennessee,"‘Nashville is hurting’ after twisters tear through area, causing widespread damage"
2020-03-03,City Halts Court Order to Chop Much of West-Side Condo Tower,Judge had cited zoning violation at 200 Amsterdam project; appellate panel will now take up issue 
2020-03-03,"U.S. Coronavirus Infections Rise as Cases Outside China Pass 10,000","New cases reported in New York, Georgia as nationwide patient tally tops 100"
2020-03-03,Sports Must Be Smart About the Coronavirus,"With the pathogen arriving in the U.S., leagues brace for disruption. Common sense is essential. "
2020-03-04,Here’s Why Health Experts Want to Stop Daylight-Saving Time,Research shows the annual shift disrupts sleep and leads to a higher immediate risk of heart attacks and strokes
2020-03-04,Can’t Code? You Can Still Make Your Own Apps,A growing number of companies and professionals are using tools that allow users to easily build custom apps for work
2020-03-04,Joe Biden Surges by Expanding the Democratic Electorate,
2020-03-04,Campbell Expects Higher Sales From Soup Stockpiling,Coronavirus epidemic is a further boost to demand after a strong quarter for the food maker
2020-03-04,"Refugees Stream Across Turkey, Trying to Enter the EU",
2020-03-04,Top Colleges in the Midwest for Student Engagement,Dordt University is No. 1 in the region and nationwide in this category of the WSJ/THE College Rankings
2020-03-04,"Sanofi, Fighting Back in Insulin Price Debate, Says Its Net Prices Fell 11%","Politicians have called price increases egregious, while large insulin makers have become prime targets for criticism in the presidential race"
2020-03-04,Are Those Screens That ‘Suggest’ 30% Tips Too Pushy?,"Tablet-based checkouts in coffee shops make it easy to add a gratuity, but many people feel manipulated into giving too much"
2020-03-04,Coronavirus Spreads in Washington State as Amazon Worker Tests Positive,China reports the lowest number of new cases since Jan. 21; U.S. cases grow to 128
2020-03-04,Refugees Stream Across Turkey in Bid to Enter EU; a Baby in an Isotherm Bag,
2020-03-04,Former Risk Officer at U.S. Bank Fined for Weak Anti-Money Laundering Oversight,"Michael LaFontaine ignored internal warnings about the bank’s transaction-monitoring software, according to the Financial Crimes Enforcement Network
		
			"
2020-03-04,GM Aims to Convince Wall Street Skeptics Its Future Is Electric,Detroit auto giant details electric-vehicle strategy involving billions in investment and new models with up to 400 miles of electric range
2020-03-04,Pentagon Linguist Charged With Providing Secrets to Individual Tied to Hezbollah,"Information shared by linguist included real names of individuals spying for the U.S., Justice Department says"
2020-03-04,Wealthy Millennial Home Buyers are Trading Sleepy Suburbs for Smaller Houses and Shorter Commutes,
2020-03-04,Marketing Software Firm Zeta Global Eyes IPO—Once Again,"Former Apple executive John Sculley’s startup says the company is profitable, booking more than $400 million in revenue last year "
2020-03-04,Coronavirus Could Affect How Companies Forecast Credit Losses,The outbreak could complicate businesses’ efforts to comply with a new accounting standard 
2020-03-04,Campbell Raises Earnings Outlook,Food maker posts better-than-expected results for latest quarter
2020-03-04,U.S. Stocks Jump as Markets Weigh Biden Wins,Health-care shares led by Anthem and UnitedHealth rise; bond yields hover near record lows
2020-03-04,China’s Biggest Shipyard Raises $718 Million to Ease Coronavirus Impact,State-owned companies are accessing “coronavirus bonds” with preferential rates
2020-03-04,Lego Commits to China Expansion as Revenue Climbs,The toy maker said it will open new stores in China after seeing double-digit sales growth in the country
2020-03-04,‘The New Kale’: Cauliflower Becomes a Bestseller,
2020-03-04,Netanyahu Falls Short of Majority as Israel Again Faces Electoral Deadlock,"Prime minister’s right-wing bloc won biggest share of votes, making it likely he will get first chance to form a government "
2020-03-04,Russia Opposes Saudi Plan for Drastic Oil Cuts,OPEC and its chief oil market ally remain far apart on a possible response to coronavirus. 
2020-03-04,"In Boston, Money Managers Fire Shot at Wall Street Brokers",Investor conference next week will cut banks out of a lucrative role 
2020-03-04,Imagine a Middle Seat You’d Actually Pay For,Airlines are experimenting with seats that are wider than those on the window or aisle—with an eye on charging a premium for them
2020-03-04,Supreme Court Justices Voice Clashing Views as They Weigh Louisiana Abortion Law,Statute requires doctors performing procedure to hold admitting privileges at a hospital no more than 30 miles away
2020-03-04,Lawsuits Accuse Big Hotel Chains of Allowing Sex Trafficking,"Dozens of women say Hilton, Marriott, Wyndham and others turned a blind eye to organized prostitution at their establishments "
2020-03-04,Elliott Reaches Truce in Long Battle Over Hong Kong Bank,Bank of East Asia is assessing whether it can sell assets or otherwise improve its business
