publish_date,headline,description
2019-09-04,"Big College or Small, You Can Find a Highly Ranked One",The top 100 schools in the WSJ/THE College Rankings include colleges of all sizes
2019-09-04,The Biggest Bargains Among U.S. Colleges,The schools that offer the best value are often those with modest resources
2019-09-04,Compare Any Two Colleges From the 2020 WSJ/THE College Rankings,
2019-11-14,How to Decide Whether to Move or Stay in Your House in Retirement,Also: answering a reader’s question about getting the shingles vaccine
2019-11-14,He Wanted Something More From Retirement. So He Got Three Jobs,"After a career in marketing and sales, Thomas Marshall has found physical and intellectual satisfaction by working completely different jobs"
2019-11-17,Coming to Terms With Occasional Memory Loss,"I no longer panic at the minor lapses. Instead, I see them as opportunities"
2019-11-17,The Revealing Words People Use to Describe Retirement,"Men talk about ‘hobbies’ and ‘travel.’ For women, it’s about ‘calm’ and ‘time.’"
2019-11-17,There’s a New Type of Senior on College Campuses,
2019-11-17,What Science Tells Us About Preventing Dementia,
2020-01-15,Top Colleges in the Northeast for Student Outcomes,Harvard and Princeton top the regional list for this category in the WSJ/THE College Rankings
2020-01-22,Top Public and Private Colleges in the West,UCLA is the region’s top public school and Caltech the leading private college in the WSJ/THE College Rankings
2020-01-29,Top Colleges in the South for Student Engagement,"Samford University heads this list from the WSJ/THE College Rankings, followed by Baylor and Oral Roberts"
2020-02-05,Top Big-City and Small-Town Colleges in the Midwest,The University of Chicago and Carleton College head these lists in the WSJ/THE College Rankings
2020-02-05,The Financial Challenge for Athletes: Retirement Is Always Near,Their financial advisers explain how they create portfolios suited to lucrative but short careers
2020-02-06,Do You Have to Be Active to Have a ‘Successful’ Retirement?,
2020-02-09,Thinking of a College Co-op Program? Here’s What You Need to Know,"The right work experience can give graduates a boost, but there are lots of questions to ask"
2020-02-12,Omnicom’s Hearts & Science Expands Marketing Tech Consulting Group,The agency projects the group will account for 30% of revenue within the next three years
2020-02-12,Harvard Is Top Ivy in WSJ/THE College Rankings,"Harvard University, No. 1 overall in the WSJ/THE College Rankings, is followed in the Ivy League ranking by Yale and Penn"
2020-02-13,When It Makes Sense to Review Your Will,
2020-02-13,"Instagram Targets More Funding, Ad Revenue-Sharing, for Video Hub","The Facebook-owned company looks to pay more for videos on its IGTV app, though no formal funding program is in place "
2020-02-14,Should Parents Try to Spend the Same Amount of Money on Each Child?,Sometimes what seems most equitable isn’t necessarily the most fair
2020-02-17,Game Plan: A Couple Wants to Pay Off Debt—and Save for Disney World,"An adviser suggests a plan for debt reduction, spending and saving for bucket-list items"
2020-02-17,"You’re Getting Married Again. Should You Combine Finances, Too?",
2020-02-17,"People Don’t Save Enough for Emergencies, but There Are Ways to Fix That",
2020-02-19,David Ruder Weathered Black Monday as SEC Chairman in Late 1980s,Former Northwestern University law dean sought wider powers for agency in wake of crash 
2020-02-19,U.S. House Subcommittee Scrutinizes Accounting Rule Maker,Rep. Sherman looks to make accounting rules a focus of the Congressional subcommittee despite legislative obstacles
2020-02-19,Target Faces Labor Organizing Effort at New Jersey Warehouse,"Unionization bid comes as Target, other companies move logistics operations closer to urban population centers"
2020-02-19,Top Colleges in the West for Student Outcomes,"Stanford heads this list from the WSJ/THE College Rankings, followed by Caltech, UCLA and Berkeley"
2020-02-20,"Texas Tycoon Clayton Williams Survived Oil Bust, Flopped in Politics","Entrepreneur, riding high on cowboy image, blew a big lead in polls to lose 1990 gubernatorial election"
2020-02-20,Swiss Regulator Censures Julius Baer in FIFA Money Laundering Case,"The Swiss bank failed to do enough to identify to determine the identity of its clients, Switzerland’s Market Watchdog says "
2020-02-20,Maersk Warns of Lower Earnings From Coronavirus Impact,The world’s biggest container ship operator says efforts to hold back the spread of the virus are weighing on both China’s exports and imports 
2020-02-20,U.S. Blacklists Five Senior Iranian Officials Ahead of Parliamentary Elections,Treasury Department alleges the officials prevented fair elections in Iran 
2020-02-20,More Manufacturers Bet on Simulation Software,Tool allows auto makers and others to assess how changes to a line will affect production
2020-02-20,New Mexico Sues Google Over Children’s Data Privacy,"State alleges tech company’s education platform improperly gathers students’ personal data, tracks their online behavior"
2020-02-20,Volkswagen CFO Frank Witter to Step Down in June 2021,He has led the German auto maker’s finances since 2015
2020-02-21,What the E*Trade Deal Tells You About the New Investing Game,The days of the ‘financial supermarket’ are over. Investment firms want to grab as much of your money as they can.
2020-02-21,Today’s Logistics Report: Maersk Seeks Anchor; Canada’s Rail Standoff; Garlic Markets Pressed,Today’s Top Supply Chain & Logistics News from WSJ
2020-02-21,California Disputes Trump Administration’s Claim That Abortion-Coverage Mandate Violates U.S. Law,State’s response comes after administration officials threaten to withhold federal funds 
2020-02-21,Trump Says He’s Prepared to Give More Aid to Farmers Hurt by Trade Conflict,President raises prospect of third aid program to offset export losses until new trade deals pay off 
2020-02-21,Marriott Hires Former Merck CIO as Tech Chief,Jim Scholefield is also a veteran of Nike and Coca-Cola
2020-02-21,FDA Clears New Type of Cholesterol Drug,Doctors see the drug as an alternative for millions of patients who can’t take or aren’t responding to statins 
2020-02-21,SEC Rejects Controversial ‘Speed Bump’ Proposal,Regulator disapproves plan from Cboe to introduce trading delay to one of its exchanges
2020-02-21,"The Premier League’s Mad, Mad, Mad, Mad Dash for Fifth Place",Manchester City’s European ban has breathed new life into a snooze of a season
2020-02-21,I’m in Love—With a Weighted Blanket,Heavy comforters promise to alleviate stress and promote sleep. But sometimes you just need a hug. 
2020-02-21,"DSV Expects Job Reductions of Up to 4,000 on Panalpina Integration",European freight forwarder expects $332 million in annual cost savings from post-acquisition consolidation 
2020-02-21,You’re a Scorpio? Why the Earth’s Wobble Means Your Zodiac Sign Isn’t What You Think,"Over span of human life, Earth’s movement makes stars appear to shift to east by about one degree "
2020-02-21,Canadian Rail Blockades Highlight Grievances of Indigenous Groups,
2020-02-21,Greyhound to Stop Allowing Border Patrol on Its Buses Without Warrant,Friday’s policy change followed a government memo saying agents couldn’t board buses to question passengers without a warrant or company consent
2020-02-21,Iran Faces Long-Term Banking Woes Under Terror-Finance Watchdog Action,"Tehran’s blacklisting by the Financial Action Task Force sends a signal to Pakistan, which is also in the watchdog’s sights "
2020-02-21,A Richard Neutra-Designed Home on the California Coast Asks $15 Million,"Filmmaker Marc Forster is selling the white stucco property in Santa Monica, which was commissioned by a pair of Hollywood hopefuls in the 1930s"
2020-02-21,Wells Fargo Reaches Settlement With Government Over Fake-Accounts Scandal,Bank to pay $3 billion to settle investigations by the Justice Department and SEC
2020-02-21,How to Change Anyone’s Mind,"People instinctively resist being forced to do things differently. Instead of pushing, try removing the barriers that stand in their way."
2020-02-21,SEC Investigates Altria’s Investment in Juul,Regulators investigating Marlboro maker’s disclosures after two charges totaling $8.6 billion 
2020-02-21,How One Singapore Sales Conference Spread Coronavirus Around the World,
2020-02-21,"Fox, Comcast Pursue Takeovers of Ad-Supported Video Services",Entertainment giants increasingly look to give consumers free or low-cost alternatives to premium subscription streaming services
2020-02-21,Bernie Sanders Was Warned Russia Is Trying to Boost His Presidential Campaign,"U.S. officials briefed candidate about a month ago, in reaction to intelligence said to be considered compelling"
2020-02-21,Google Resists Demands From States in Digital-Ad Probe,Company is reluctant to surrender some documents in investigation of possible anticompetitive practices
2020-02-21,A Man for All Seasons at 100,What has brought my father to the century mark? A life defined by duty.
2020-02-21,Weinstein Jury Appears Deadlocked on Predatory Sexual Assault,"Panel asks if it can reach partial verdict on rape, criminal-sex act counts, prompting judge to tell them to keep deliberating"
2020-02-21,Do the Benefits of Digital Devices in School Classrooms Outweigh the Downsides?,Proponents say new technologies are essential in education and can help narrow the achievement gap; critics say they are setting many students back
2020-02-21,The Architect Who Wants to Rebuild Notre Dame as It Was,"Philippe Villeneuve, who oversees France’s historic monuments, is resisting efforts to rebuild the cathedral’s iconic spire with a ‘contemporary’ touch "
2020-02-21,Boeing Finds Fuel-Tank Debris in Two-Thirds of 737 MAX Jets Inspected,"The scale of the problem, previously unreported, points to wider quality issues that have bedeviled the aerospace giant"
2020-02-21,HBO Max Will Include ‘Friends’ Reunion Special,"Launching in May, new streaming service also will have previous episodes "
2020-02-21,"Richard J. Fox, Philadelphia Real-Estate Developer, Championed Temple University",Entrepreneur managed arena project and fought long battle to build a community near Valley Forge park
2020-02-21,EBay Moves Toward Selling Its Classified-Ads Business,"Private-equity firms including TPG and Blackstone, as well as strategic bidders, have shown interest "
2020-02-21,"The Robot in Aisle Five Isn’t Stalking You. No, Really.",
2020-02-21,CFOs Adapt to Workers Negotiating for Higher Pay,"Finance chiefs are realizing they must increase salary offers, staffing firm says "
2020-02-21,Nine Ways to Make Your Work Day Better,A new book argues that headphones in the office can be helpful; weekend email not so much.
2020-02-21,Losing Your Hair? Why This Solution Is No Longer Shameful,"Discussing waning manes is suddenly fashionable thanks to new, stigma-free products and evolved attitudes toward thinning tresses "
2020-02-22,Google Plots Course to Overtake Cloud Rivals,Job cuts are part of yearlong push to shake up unit and focus on delivering growth to Alphabet
2020-02-22,Trump Era Challenges Maine Voters’ Loyalty to Susan Collins,Democrats see Maine race as pivotal in bid to win Senate control 
2020-02-22,The Invisible King of Broadway,"John Gore has quietly built an empire with a stake in everything from funding to touring to ticket sales, while staying out of the spotlight"
2020-02-22,The Controversial Past of the Tycoon Behind the Astros,"When Jim Crane bought Houston’s baseball team in 2011, the league had concerns about his business history. Then the Astros became the epicenter of baseball’s biggest scandal."
2020-02-22,The Pleasure of Defying Food Fashions,Fads like avocado toast are bad for farmers and make menus duller. It’s time to cultivate unfashionable tastes.
2020-02-22,Legacy Preference Gets Fresh Look Following College-Admissions Scandal,Universities have defended custom as needed to encourage donations from alumni
2020-02-22,Can Sporty Sedans Still Thrive in an SUVs’ World?,"Alfa Romeo’s tasty Giulia has lovely curves, a powerful engine and an updated UX inside. So why are sales plummeting? Dan Neil explores how this immortal beauty fits into the current auto landscape"
2020-02-22,"U.S., Taliban Start Weeklong Partial Truce in Effort to End Afghan War","U.N. says more than 10,000 civilians killed and injured in Afghanistan last year "
2020-02-22,Intuit Near Deal to Buy Credit Karma for $7 Billion,Acquisition would be Intuit’s largest ever and the first sizable transaction under CEO Sasan Goodarzi
2020-02-22,Singapore Isn’t Kidding When It Comes to Fostering Fertility,"Government offers cash grants and public housing, but birthrates remain stubbornly low"
2020-02-22,Don’t Talk to Strangers? These Apps Encourage It.,Young people flock to apps that let them chat with like-minded people online. But safeguards are imperfect. 
2020-02-22,Wall-to-Wall Carpet Is Back: Why Design Pros Love (and Hate) It,The memory of icky midcentury shag and synthetic cut pile has left many skeptical of broadloom carpet. But advances in technology are changing some minds
2020-02-22,One Last Shot for a Historic Manhattan Bar,South Street Seaport’s Bridge Cafe has remained closed since superstorm Sandy. Its former manager still hopes to revive it. 
2020-02-22,Trump’s India Visit to Stress Personal Ties Over Economic Issues,"The U.S. president will likely receive a festive welcome from Prime Minister Modi, including a rally at a 110,000-seat cricket stadium"
2020-02-22,‘To Kill a Mockingbird’ Gets a Bigger Stage—for a Day,"In rare occasion, production will be put on in Madison Square Garden for New York City teens "
2020-02-22,Twitter Suspends Some Accounts Backing Michael Bloomberg,Social-media site says users violated rules against manipulation and spam
2020-02-22,Build a Smoother Smoothie. You’ve Earned It.,"With a calming shot of rum and considerably less sugar, this grown-up riff on an Orange Julius takes the edge off winter (and aging)"
2020-02-22,"Italy, South Korea Work to Contain Coronavirus Outbreaks",International health officials are worried about growing clusters of the illness outside of China
2020-02-22,Carlos Ghosn’s New Life in Exile,
2020-02-22,Dropbox Finally Doesn’t Drop,Lowly valued cloud player boosts profitability target and drops in a buyback plan 
2020-02-22,Warren Buffett’s Berkshire Hathaway Stock Underperforms the Most Since 2009,The conglomerate’s stock rose 11% in 2019 compared with a 31.5% total return in the S&P 500
2020-02-23,"Tapping Trump’s Anger About 2016 Surveillance, White House Seeks Overhaul of Spying Law",Effort is spurred by president’s criticism of the investigation of former campaign adviser Carter Page 
2020-02-23,Bernie Sanders Looks Ahead After Nevada Caucuses Win,"Contests in 15 states over the coming week and a half, including Super Tuesday, could determine the course of the race for the Democratic nomination."
2020-02-23,‘No One Should Experience Such Heartache’: Readers Share Stories of Losing Loved Ones to Drug Addiction,"‘What a Father Learned After Losing Both Sons to Drug Overdoses,’ an interview with author Steve Grant, prompted readers to relate their experiences"
2020-02-23,Russia Leans on Mercenary Forces to Regain Global Clout,Campaigns in Africa and the Middle East involve private security contractors and business interests with ties to Kremlin
2020-02-23,Residents in Mississippi Capital and Beyond Brace for More Flooding,
2020-02-23,Should All Children Learn to Code by the End of High School?,Supporters say coding know-how is good for students in an increasingly digital world. Opponents say public schools shouldn’t serve as job-training sites for tech companies.
2020-02-23,"Swiss Franc Climbs Against Euro, Leaving Central Bank in Bind","Swiss National Bank might be forced to intervene to stem franc’s rise, which risks angering U.S. "
2020-02-23,What’s the Best Way to Use the Cloud to Store Personal Data?,The Wall Street Journal hosted a conversation by email with three experts on cloud storage and the security and privacy issues around it
2020-02-23,"Democratic Leaders Split on Taxes, New Bail Law",Assembly members expected to propose raising income taxes to address budget deficit; senators are reluctant 
2020-02-23,ESG Funds Mostly Track the Market,Push toward ‘sustainability’ in investing so far isn’t having outsize impact on stocks 
2020-02-23,Turning to Weightlifting to Battle Against ‘Skinny Fat’,
2020-02-23,"Move Over, Elliott. Argentina’s New Bond-Market Nemesis Is Fidelity.","The mutual-fund giant isn’t known for tough tactics, but its hard line on a $250 million payment underscores the growing power of large fund firms"
2020-02-23,Natural-Gas Exporters Struggle to Lock Up Buyers Despite ‘Freedom Gas’ Pitch,"President Trump plans to make the case during his trip to India, but the global gas glut has made the market more commoditized"
2020-02-23,Does the U.S. Need a National Digital Currency?,Proponents say payments with a digital dollar would be faster and easier. Opponents say it would be costly and inefficient.
2020-02-23,Chinese Military Turns to U.S. University to Conduct Covert Research,Case of Chinese researcher at Boston University renews fears Beijing is targeting American academia
2020-02-23,The Take-No-Prisoners Rivalries in Online Luxury Fashion,
2020-02-23,"Losing $450,000 in Three Days: Hackers Trick Victims Into Big Wire Transfers",
2020-02-23,"If You Knead No-Carb Bread, It Might Cost You Some Dough","Hoping to make the perfect loaf with no (or few) carbs, bakers are trying ingredients including bamboo, green bananas, cauliflower and powdered collagen. ‘It looked like silicon, globs of silicon and glue all through it.’
		
			"
2020-02-23,Boeing Offers More Support for MAX Suppliers,"A network of 600 big suppliers, plus hundreds of smaller firms, has been in limbo since Boeing halted 737 MAX production "
2020-02-23,National Security Adviser Discounts Reports of Russian Interference to Help Re-elect Trump,"‘There’s no briefing that I’ve received, that the president has received, that says that President Putin is doing anything to try and influence the elections in favor of President Trump,’ Robert O’Brien said"
2020-02-23,Should Government Halt the Use of Facial-Recognition Technology?,"Critics say false positives are far higher for some groups of people than for others, but supporters of the technology says the actual numbers involved are tiny"
2020-02-23,"Physicians, Hospitals Meet Their New Competitor: Insurer-Owned Clinics",Insurers are a new threat to doctors and hospital systems that have made big investments in physician practices 
2020-02-23,Bernie Sanders Looks Ahead After Nevada Caucus Win,Contests in 15 states over the coming week and a half could determine the course of the race
2020-02-23,AI Is the Next Workplace Disrupter—and It’s Coming for High-Skilled Jobs,"Occupations most vulnerable to artificial intelligence are marketing specialist, financial adviser and computer programmer, Brookings study finds "
2020-02-23,Falling Fuel Costs Buoy U.S. Consumers,
2020-02-23,World Economy Shudders as Coronavirus Threatens Global Supply Chains,Manufacturers’ increased reliance on more interconnected China sees shortages ripple around the globe
2020-02-23,Startups Wrap Brand Identity With Sustainable Packaging,Companies are focusing on whether a customer feels guilty or virtuous about how the product was boxed to drive business results
2020-02-23,Coronavirus Spreads Outside China as Officials’ Worries Mount,"The emergence of clusters of infection in new countries including South Korea, Italy and Iran show that it is unclear how the virus is transmitted"
2020-02-24,Maye Musk on Why She Can’t Always Make It to SpaceX and Tesla Launches,"The supermodel, dietitian and mother to Elon, Kimbal and Tosca talks about her go-to breakfast, favorite TV shows and how she and her busy family stay in touch"
2020-02-24,"Salesforce, Silver Lake Pump Money Into ServiceMax",The new $80 million investment is aimed at helping the software company beef up product development 
2020-02-24,Jussie Smollett Pleads Not Guilty to New Charges,Former ‘Empire’ actor’s legal team files motion to dismiss case on double-jeopardy grounds 
2020-02-24,He Went to a Hockey Game Expecting Dinner. He Wound Up Getting the Win.,"A talk with “emergency back-up goalie” David Ayres, who stopped the Toronto Maple Leafs Saturday night—and became an overnight NHL sensation"
2020-02-24,"Coronavirus’s Global Spread May Not Be Contained, WHO Says","Number of new cases in China declines, but it isn’t clear whether outbreak can be stopped from spreading globally, World Health Organization says  "
2020-02-24,Several Injured as Car Runs Into Carnival Parade in Germany,Police in the country on high alert since deadly shooting last week
2020-02-24,The Metropolitan Museum of Art Orders the Full English,"After six years of work—and a regime change—the Met unveils its revamped British Galleries, reimagined in cinematic style by design stars Roman and Williams"
2020-02-24,Investors Retreat From Oil Firms in Sign of Rising Skepticism,"Major oil companies, pressed to cut carbon emissions, are shunned in markets as they mull greener future"
2020-02-24,HSBC Keeps Net Open for New CEO,"Unicredit boss Jean Pierre Mustier ruled himself out, but interim CEO Noel Quinn may still not get the job"
2020-02-24,Texas House Race Tests Democratic Voters’ Appetite for Liberal Insurgents,
2020-02-24,Coronavirus Tests Europe’s Open Borders as Italy Death Toll Rises,Schools are closed and gatherings are banned as Italy reports a sixth virus-related death
2020-02-24,"With Migrant Workers in Limbo, Part of China’s Economy Is Stalled","Many must choose the least-bad option: Stay in their hometowns without jobs, or return to expensive cities and a 14-day quarantine"
2020-02-24,"Austin, Nashville Rank at Top of Hottest U.S. Job Markets",Apple is building $1 billion corporate campus in Texas capital; Amazon is investing in Tennessee city 
2020-02-24,Michael Bloomberg Aims to Improve in His Second Democratic Debate,Former New York City mayor kept away from the public eye all weekend to prepare
2020-02-24,Dozens Injured as Car Runs Into Carnival Parade in Germany,Police in the country on high alert since deadly shooting last week
2020-02-24,Trump Kicks Off Two-Day India Visit With Massive Rally,"The two countries share concerns about terrorism, immigration and the rise of China as a superpower"
2020-02-24,"Dow Industrials Drop 1,000 Points as Coronavirus Cases Mount Outside Asia","S&P 500, Nasdaq fall more than 3% after steep declines across Europe, Asia; bond yields slide"
2020-02-24,‘The Last American Hammer’ Review: Standoff Satire,An unemployed conspiracy theorist faces off against a federal agent inside a museum of Toby jugs in this ruefully humorous work at Pittsburgh Opera.
2020-02-24,"With Current Tools, Fed Unlikely To Sustainably Hit Inflation Target: Fed Paper",San Francisco Fed paper finds public worries that in the next downturn the central bank will once again hit de facto zero rates
2020-02-24,Primark Owner ABF Looks for Suppliers Outside of China Amid Coronavirus Outbreak,"U.K. conglomerate has enough inventory to fill shelves in its Primark unit through the summer months, finance chief John Bason says "
2020-02-24,"As NCAA Handwrings, Female Athletes See Opportunities From Looser Endorsement Rules","Athletes will likely be allowed to promote products and their own businesses under changes to name, image and likeness restrictions "
2020-02-24,Scientists Detect for the First Time Quakes on Mars,"Initial findings about Martian interior, atmosphere and magnetic field are published in research papers"
2020-02-24,JetBlue Closes Sustainability-Linked Loan With BNP Paribas,Airline looks to align its financial strategy with ESG goals through credit facility 
2020-02-24,"Malaysian Prime Minister Mahathir Mohamad Resigns, Cabinet Dissolved",Moves plunge country into chaos less than two years after 94-year-old leader took office in historic election
2020-02-24,Steve Wynn Pays $105 Million for Pair of Picassos,The sale comes as a trio of private galleries sell off works from the estate of Don Marron
2020-02-24,Weinstein Found Guilty of Third-Degree Rape and First-Degree Criminal Sexual Act,Hollywood producer found not guilty of predatory sexual assault and first-degree rape
2020-02-24,Dine Looks to Slow Closures of Applebee’s Restaurants,Company expects franchise operators to close between zero and up to 10 Applebee’s locations this year in the U.S.
2020-02-24,Facebook Investigated Suspicious Pro-Sanders Content,Social-media giant hasn’t substantiated the activity it reviewed; senior officials alerted to internal probe
2020-02-24,"Assange Put Lives at Risk, U.S. Argues as Extradition Hearing Begins",WikiLeaks founder appears in packed London courtroom for legal battle expected to last several months
2020-02-24,"Glass, Once the King of Packaging, Seeks a Comeback",
2020-02-24,Supreme Court to Consider Religious Rights Case Involving Same-Sex Couples,High court to weigh Philadelphia’s decision to exclude Catholic group from foster care program
2020-02-24,"Teck Pulls Oil Project, Blames Canada’s Climate-Policy Uncertainty","CEO says ‘no constructive path forward’ for multibillion-dollar oil sands mine, which has become flashpoint in climate-change debate"
